speaker,content
黄肇輝議員,我在想不是建議，既然剛才看到的那個地方很破舊了，也有崩塌的危險，我們是不是有一個方案，可能用加蓋或是其他方式，加蓋當然可以增加一些公共使用空間，像是如果有一個籃球場也不錯。
水利局邱忠川局長,大原則是我們儘量不要把排水系統加蓋，當然如果為了其他方面的需要，我們再來考慮是不是用箱涵的方式辦理，好不好？
黄肇輝議員,請局裡規劃一下，因為您們總是比較專業，謝謝局長。
黄肇輝議員,第二個是城市藝術季，我們知道臺南市很多這種藝文活動，我之前參加臺南應用科技大學的校慶，剛好校長坐在我旁邊，跟我聊了很多。特別講到他們今年6月參加了北海道索朗祭，後來看到照片，市長也有參加，市長記得這一場嗎？校長說他們帶著學生到日本北海道，特別講到北海道是一個觀光勝地，在不是那麼熱門的時段，他們就辦這樣的祭典，讓北海道一整年都有遊客，有風景的時候看風景，沒風景的時候就看這些表演。他們帶著學生去那個地方，他覺得是很好的表演，但他覺得回到臺南卻沒有地方讓他們表演。我們看一下最近比較有趣的，在業務報告時候也跟文化局長討論過管樂的藝術季，過去曾經有一段時間也是踩街的方式，可是最近又回到室內。時間很長，從5月18日到8月30日，在室內當然也有效果，但是就覺得有點可惜。臺灣都會邀請日本橘高校或者翡翠騎士，連續兩年國慶邀請日本很有名的管樂高中的學生來臺灣表演，我們怎麼不知道要蹭這個熱度？
黃偉哲市長,有，他們不給我們。
黄肇輝議員,真的還需要再努力一點。
黃偉哲市長,我們去找過文化總會，我們可以單獨邀請大概800萬。
黄肇輝議員,不管是怎麼樣，我覺得有這個熱度也可以進行。特別那時候也有跟局長討論，日本高校的管樂隊其實都會搭配高校的棒球隊，他們在球場比賽的時候就是一個應援團。當然臺南也有小小一團，特別是明年亞太棒球村要成立了，是不是可以運用這個方式，找一些管樂學校來應援大賽之類的。
黃偉哲市長,我覺得這個概念很好。
黄肇輝議員,特別因為今年暑假，大橋國中有一個管樂團。
黃偉哲市長,他們去棒球場看表演。
黄肇輝議員,對，他們就在這邊就幫他們應援，他們是國中，但是去參觀高中的學校，也去現場實地參與在球場裡面的應援，我覺得不錯。嘉義管樂嘉年華已經行之有年，10幾年了，右邊是臺中的踩舞嘉年華，他們都有類似這樣子的大型活動，臺南我知道有一些，但是覺得小小的，也沒有辦法成為一個臺南很有特色的，類似一個藝術季。我在業務質詢時也提到臺南有很多吉祥物，市長也知道我們有很多吉祥物，甚至可能有些還不認識，也是可以融入，給您們做個參考。其實我們有很多適合踩街的內容，除了管樂之外，我們有些很有特色的，像是宗教的，也有一些鼓隊的、踩舞的，其實可以發展出一個很有特色的嘉年華形式，局長想要回應嗎？
文化局謝世淵局長,議座的建議很好，事實上在今年的國際民俗藝術節有用踩街的形式，踩街其實在表演形式當中是很容易聚眾的一種方法，剛剛議座的建議，我們可以參考。
黄肇輝議員,我知道有這些，但我個人的感覺都是小小的，能不能讓大家知道臺南有這一場很重要的活動參加，給市長跟局長參考。
文化局謝世淵局長,好，謝謝。
黄肇輝議員,因為時間的關係，我必須要跳到下一個議題。
黄肇輝議員,針對火災預防，最近常常有鋰電池或電動機車的火災事件，上星期高雄又有一起。現在廣設很多電動車的充電停車場，這個可能跟消防局跟交通局有關，臺北市的停車管理工程處要求只要是公共停車場裡面有充電樁，他們就必須配置滅火毯，臺南市有嗎？
交通局王銘德局長,有，目前要求委外業者要逐步設置。
黄肇輝議員,所以有要求？不管是公有或私有的？
交通局王銘德局長,就是在封閉場域設充電樁的。
黃偉哲市長,跟議員報告，現在新的規定要求，這些設充電的一定要是露天的、頂樓的，不能在出入口，不能影響到……
主席陳皇宇議員,謝謝黄肇輝議員，接下來請吳通龍議員質詢，時間10分鐘，吳議員請。
吳通龍議員,謝謝主席。市長、副秘書長還有各位局處首長，大家早安、大家好，辛苦了。
吳通龍議員,市長，二仁溪我相信是臺南市所有議員都非常關心的，今天的二仁溪河道廢棄物，是當時創造臺灣經濟奇蹟所遺留下來的產物對不對？當時大家都在那裡拔五金、廢電線。電線拔一拔之後，把銅拿去燒，塑膠的東西燒一燒之後就地掩埋，所以這是我們創造經濟奇蹟遺留下來的產物。
黃偉哲市長,那時候比較沒有環保觀念。
吳通龍議員,那時候當然也沒有要求這麼嚴格，如果是現在就不能這樣做了，這是無庸置疑的。這條二仁溪看起來真的很漂亮，不過要怎麼整治它呢？我們要怎麼整治、清理它呢？
黃偉哲市長,跟議員報告，請局長跟您報告，因為有最新的進度。
吳通龍議員,我相信在黃市長執政之下整治這條溪，也可以在歷史上留一個紀錄。
黃偉哲市長,臺南市跟環境部有做成一個決議。
吳通龍議員,好，謝謝，請局長說明看看何時可以整治？
環境保護局許仁澤局長,"部長這星期一有來，我特別帶他去看，因為之前總統特別指示部長要加快速度，所以跟市長報告後，我們提一個專案報告給國發會，他現在同意了，二仁溪這邊差不多還有8,000多噸要清，有3個點，高雄市那邊有5,000多噸，所以全部清除的話要10幾億。現在行政院同意給專案預算，我們這邊差不多需要8億多，這是專案預算，我們送計畫就可以給我們預算使用。"
吳通龍議員,這個也是要積極。
環境保護局許仁澤局長,對，年底之前趕快把計畫送出去。
吳通龍議員,如果沒有積極的話，我相信應該也是一年拖過一年、一屆拖過一屆。現在幸好總統是我們的前市長，對不對？他也很清楚，由總統下令行政院，我相信這個對他們來說是小事情，當然我們也要積極。
環境保護局許仁澤局長,這是專案預算，所以不會受影響。
吳通龍議員,我也希望在黃市長的執政之下可以完成，我想這是歷史上會記載的，當然環保局局長也很用心，這是無庸置疑的。市長跟所有的服務團隊大家都很強，市長有被記載的話，局長也是會有歷史性的記載，所以我希望可以速速完成，凡是做任何一件事情都非常積極、用心做才會完成。如果沒有注重它的話，就是一年拖過一年，永遠都沒辦法完成，這是好幾十年的歷史了，對不對？我希望市長、局長可以把這個東西完成，我相信百姓也會非常感恩的支持，感謝局長。
環境保護局許仁澤局長,謝謝。
吳通龍議員,這是麻豆清水里溝仔墘水圳旁的防汛道路，一邊有做綠美化，一邊就是崎嶇不平，水圳旁邊的路延伸下去種了農作物，像這種路況到採收的時候，車子載著麻豆柚子行經時，顛簸到連柚子都掉下來了，像這種情況，局長有辦法處理嗎？您看一邊就是這樣的路，一邊做了綠美化、一邊則是崎嶇不平。
水利局邱忠川局長,我跟議座報告，這個應該是農田排水的業務，如果農水署沒辦法處理，我們來處理好嗎？
吳通龍議員,對，我看把它處理好，不要都寄望農水署。
水利局邱忠川局長,我們來拜託農水署。
吳通龍議員,因為經費不多，應該幾10萬而已，最好是由局長把它處理好。
水利局邱忠川局長,好，我儘量跟農水署來研究。
吳通龍議員,他如果沒辦法，就由您處理好不好？
水利局邱忠川局長,是。
吳通龍議員,我相信這樣才真的是對百姓有交代，我行經到這邊時，人家要我看這條水圳，一邊做了綠美化，一邊連走路都不好走，我也去走過，我希望您能夠幫忙好不好？
水利局邱忠川局長,是，我會跟嘉南水利會討論。
吳通龍議員,如果他們不幫我們做，我希望我們自己做，這樣好不好？這條當時也是麻豆公所做的。
黃偉哲市長,不知道那條多長？
吳通龍議員,大概幾百公尺，大概3米的寬度而已。
黃偉哲市長,光是車子就很難會車了。
吳通龍議員,不是很容易會車。
水利局邱忠川局長,鋪柏油。
吳通龍議員,對，就是破破爛爛的，要載柚子的時候，他們說柚子載到最後都掉了，顛簸的狀況很嚴重，百姓都一直在說。
水利局邱忠川局長,我們馬上來研究，看看是哪個機關處理，如果他們真的沒辦法，我會拜託市長幫我們。
吳通龍議員,不用市長，您就有辦法了，還要到市長那裡去！這個真的讓百姓感慨良多。
吳通龍議員,這裡是174線，局長您看這個路壞得夠不夠澈底？這條就是要去曾文水庫的路對不對？
工務局陳世仁局長,您說的這個地方應該在王爺宮跟六甲隧道中間。
吳通龍議員,對，真的有夠差，之前這條路好像是公路局幫我們保養的。
工務局陳世仁局長,不是，那是縣市合併之前。
吳通龍議員,不能因為我們管理後，路變得這麼差，我如果到王爺大丘，百姓就一直跟我反映，議員您去幫我們爭取一下，我也講過很多次了吧？
工務局陳世仁局長,我跟議座報告一下，這段差不多10公里，最近發生災害後有做擋土牆，做完之後路面都會一起修復。現在路面比較不好的，我們明年會編相關預算處理。
吳通龍議員,我希望能夠把它改善一下好不好？
工務局陳世仁局長,好。
吳通龍議員,178線也是一樣。
工務局陳世仁局長,"這條路有去看過，真的很差，但是所需經費很龐大，要4,800萬，是從大匏崙到大內的這段道路。我們明年度先編差不多2,000萬處理。"
吳通龍議員,我只講178線，您就知道在大匏崙，代表您很用心。我跟您說178線，您就馬上回答我是大匏崙那邊的道路。
工務局陳世仁局長,我看到公里數。
吳通龍議員,道路真的是很差，幫我們處理一下好不好？
工務局陳世仁局長,好。
吳通龍議員,這條是里長跟我說的，117線官田八田路這條路有兩、三個單位在管理，這段是公所管理、這段是水利會管理，再過去那段才是工務局管理，哪有一條道路有那麼多的單位？可不可以適時把它整合一下？
工務局陳世仁局長,跟議座報告，公所管理和工務局管理是一樣的。
吳通龍議員,但是有一段是農田水利會的，那就不一樣了。
工務局陳世仁局長,沒關係，我們去看看，因為現在農田水利會也改制為農水署了，也是政府單位。
吳通龍議員,一起管理比較快，不要一條分成兩、三個單位管理好不好？
工務局陳世仁局長,好。
吳通龍議員,都是政府管理的工作好不好？
吳通龍議員,再來是大內區自來水管要汰舊換新的問題，這是經發局的業務嗎？
經濟發展局林榮川局長,這是自來水公司的。
吳通龍議員,現在整個大內的管線可能也老舊了，我希望您能夠跟自來水公司協商一下，可以的話幫他們換一換，不然有些沒水，這樣好不好？
經濟發展局林榮川局長,好。
吳通龍議員,可能以前的管都是小的，現在……
主席陳皇宇議員,謝謝吳通龍議員，接下來請王宣貿議員質詢，時間10分鐘，王議員請。
王宣貿議員,謝謝陳皇宇主席。我要先探討的是，今年是臺南400年，我們的藝文提升非常多，也是在這段期間深刻認識到謝世淵局長，他對所有藝文團體非常照顧，也非常用心推廣所有藝文活動。甚至我在走訪這些藝文團體的時候，有人跟我說他看到局長蹲下來跟一個剛化完妝的女生說，非常感謝您們願意為臺南的藝文付出，很多藝文團體都看在眼裡，對局長非常認可。我也是因為臺南400，跟這些團體有所接觸，走一走之後發現，團體要成立的話，要來這邊登記成為藝文團體，您知道整個臺南市有多少個？
文化局謝世淵局長,有立案的團體大概超過200個。
王宣貿議員,整個臺南市大概290個，我統整後我的選區大概是24至29個。
文化局謝世淵局長,大新營區。
王宣貿議員,沒錯，所以我覺得奇怪，這邊也很多人，為什麼都沒有人要登記？為什麼這麼少，局長大概知道為什麼嗎？
文化局謝世淵局長,我們會儘量輔導，因為這個其實跟後續的一些補助資源有關，跟我們整體的生態基礎也有關，所以我們會儘量輔導。
王宣貿議員,補助的資源，大概是怎樣的資源？
文化局謝世淵局長,比如傑團，或者是春秋季的補助，其實需要立案的資格。
王宣貿議員,所以傑團也是從這邊開始？成團這是第一階段，傑團是第二階段，是這樣子對吧？其實有的團體有一些想法，例如他來登記之後，不能進行收費型的教學，假設傳統藝術要生存，要出去表演對不對？或者是我可以繼續教下一代，有人願意來學，他就可以收。生存就要收費，結果公文跟他們說登記之後不能從事各項收費、教學等業務，團體要傳承或者開業就不行。甚至我去走訪時瞭解到，很多學校邀請他們去教學，要給他們錢，但卻不能用團體來申請，他們覺得很可憐，用個人的可不可以？可以，但是卻不能用他們所申請的藝文團體去做這件事情，所以他們會覺得這個有點麻煩，局長您要說什麼？
文化局謝世淵局長,我們一定支持在地立案的團體。
王宣貿議員,但是限制太多，真的太多了。
文化局謝世淵局長,我們來檢討這個事情，我給您一個書面的完整回覆，釐清這件事情。
王宣貿議員,好，您要瞭解到地方真正第一線這些藝文團體會遇到的狀況，當然我們是出於好意，而且這個證甚至還要換，我們剛剛看到多久要換證？
文化局謝世淵局長,4年一次，因為我們必須要確定它是不是有在正常運作，涉及到很多後續的作業。
王宣貿議員,"當然，假設登記了我們都不去理他，會一直越來越多，說不定現在就有2,000或5,000多個了，因為我們有在查驗，但我們發現查驗之外，他們每年都要交一份報告書，有這件事情嗎？您知道他們每年要繳交什麼東西嗎？對他們來說其實是一個負擔或麻煩，假設是布袋戲的，這一年還要寫報告交給您們，對這些藝文團體來說，無異是增加一個負擔，已經申請不到什麼經費了，還有這麼多限制，不如不要申請，所以有的團體會覺得登記到底有沒有用。"
文化局謝世淵局長,我們可以檢討這個制度，確實瞭解有沒有在正常運作，跟補助之間一定有相關。但是什麼是最適合的時間，我覺得在執行上可以做一個更好的設計。
王宣貿議員,對，所以我有想過，假設是為了防範很多人來登記，卻沒有一個有效的營運，就只有一個牌，導致這個功能有點喪失，我覺得是不是也可以E化？因為他們每年的報告都是用紙本，就像食品業者，因為我做過這個，我就直接拿這個舉例，就是用健保卡登錄，我是負責人、我今年做了什麼、我有在營運等等的，把它填一填就好，不用那麼麻煩，甚至上傳演出成果，您們也可以減輕很多的行政負擔，不用紙本審查，我建議可以效仿食品業者登錄系統。
文化局謝世淵局長,做一個比較便民的管理系統，議座的建議是這樣子吧？
王宣貿議員,是，沒錯。再來這麼多的團體組織，在臺南400的提案中有多少人參加？以我們大溪北地區的話？
文化局謝世淵局長,其實這個有兩個層次，如果就今年整體的活動而言……
王宣貿議員,很多沒錯。
文化局謝世淵局長,議座也很清楚，風調雨順基本上是溪北跟大新營的團體為主。
王宣貿議員,這是一個大涵蓋，民間參與計畫的提案呢？
文化局謝世淵局長,民間參與計畫49個，溪北比如磐果，我的印象有磐果，有一些其實可能會是學甲、七股那邊。大新營區的話，我現在想到的是磐果。
王宣貿議員,因為我的選區，我自己走訪後大概只有您剛剛說的。
文化局謝世淵局長,應該是磐果。
王宣貿議員,因為他們很努力在推動，我整理了這張表格要讓您看一下大概有誰參加，發現其實參加的數量還好，沒有特別多，因為他們也遇到一些狀況，例如核銷竟然要寫成這樣，他們說過去就是這樣核銷的，比如不能寫材料一批，要寫醬油1罐、雞蛋1包、皮蛋6粒、蝦米2包，寫得這麼複雜。假設我是一個布袋戲的演出團體，核銷要做成這樣，下次誰還要跟您申請？如果明年建城300還是這樣的話，誰敢跟您申請？
文化局謝世淵局長,這件事情我特別跟議座解釋一下，有一個社造案在成果展現的時候，他把內容、細節都說明了。
王宣貿議員,不是，他說是承辦要求的。
文化局謝世淵局長,我們確實有把這一張拿給申請的另一個單位參考，有人做到這個程度。
王宣貿議員,可是他要求寫成這樣。
文化局謝世淵局長,我覺得過與不及之間可以檢討，如何合乎規定，但也能把大致的內容交代清楚，這個我們可以討論，感謝議座的建議。
王宣貿議員,因為我的印象中，假設是他來申請，他有沒有花這筆錢，如果有收據或其他證明方式就好了，應該不用要求到這種程度吧？
文化局謝世淵局長,是，這個我們來檢討。
王宣貿議員,我需要問其他局處嗎？應該不用。
黃偉哲市長,我跟議員報告，我們將來做成一個通案的，但也要可以跟審計處交代，因為不是我們過了就算了，監察院、審計單位……
王宣貿議員,我偷問過審計處，他們說不用這麼麻煩。
黃偉哲市長,如果他們都可以的話，我們也不用這樣。
王宣貿議員,承辦也不用這麼麻煩，他要看這麼多資料。
黃偉哲市長,在便民跟合法之間兼顧。
王宣貿議員,好，謝謝市長，也謝謝局長。再來我們剛剛有談到傑出團體對不對？傑出團體要先成團，然後要先有藝文登記對不對？
文化局謝世淵局長,要立案。
王宣貿議員,大溪北大概有多少人參加？過去有的那些，現在是不是都沒有？
文化局謝世淵局長,傑團的甄選絕對不會分。
王宣貿議員,沒錯，我去走訪的時候，其實有人覺得傑團也是很麻煩的一件事情，為什麼？您沒有發現傑團裡面都沒有什麼藝術團體嗎？
文化局謝世淵局長,議座是說傳統藝術的類型嗎？
王宣貿議員,幾乎都是偏向舞團，因為我們的審查辦法其實非常不友善，我一樣舉布袋戲或偶戲來說，我們的評審標準有一個營運管理，要有行政人員，有什麼組織、團體，在營運上就要花上30幾萬、60幾萬的人事成本，所以直接打趴一些傳統藝術。就算入選之後甚至還要有一場售票公演，對他們來說都是個負擔，雖然這個是規定，但是我覺得我們應該要好好思考，怎樣才可以幫助到更多領域的傑團，因為這樣的限制只有一些大型的可以符合，所以我不知道選傑團的原因是要提倡，或者讓他們有一個更好的舞臺？如果要給他們更好的舞臺的話，是不是有一些人參與上就落了一階。最後他突然跟我說了這一句，他突然很黯淡地說，臺南市文化局已經不是我們的家了，我覺得我們應該好好思考，不是指您，但是您必須概括承受，因為您是局長，一個藝文團體講出這句話真的有點落寞。局長您很好，但是我們要整體想一下。
主席陳皇宇議員,感謝王宣貿議員，接下來請盧崑福議員質詢，時間10分鐘，盧議員請。
盧崑福議員,感謝主席。市長，關於觀光三輪車，我之前有跟您提過，以安平來說，大家來玩的時候對安平的印象就是不好停車，停車場離我們的景點有一段距離，而且安平的景點每個點之間也都有一段距離。所以如果一般要用走的，兩天、三天就玩不完，您瞭解我的意思嗎？
黃偉哲市長,以最近來說，1999接到最多的就是安平那邊的交通問題。
盧崑福議員,我之前有拿資料給您看，從107年開始鹿港的三輪車就申請合法上路。
黃偉哲市長,您上次質詢有提供這些照片，您提到您去鹿港的時候。
盧崑福議員,對，今天我還要拜託交通局，4個局處就是交通局、觀光旅遊局、警察局還有經發局，未來由您們4個局聯合成立，拜託由交通局當召集人。
黃偉哲市長,我上次有回應您，我請秘書長整合局處的意見，朝向能夠合法設立的方向。我們叫人來設，也不能挖一個坑，到時候他被開罰單。
盧崑福議員,因為現在4個局沒有頭，所以我拜託交通局當召集人好嗎？您來當召集人，針對未來我們的觀光……
黃偉哲市長,請秘書長做召集人，把4個局組起來。
盧崑福議員,哪一位？
黃偉哲市長,方秘書長。
盧崑福議員,方秘書長又沒來。
黃偉哲市長,他今天請假去高雄開會。
盧崑福議員,您要再跟他說。
黃偉哲市長,我上次有承諾，我有交代他。
盧崑福議員,因為這4個局都很重要，拜託一下，人家107年就已經合法上路了，包括保險等等，人家都做得很完整，安全方面已經都有制定法規。
交通局王銘德局長,跟議座報告，道交條例確實授權地方政府可以制定辦法開放，剛剛市長交代我們4個局協調，我們會來主政。另外，我也交代同仁先去跟彰化縣政府瞭解，看看他們目前實際的營運管理方式是什麼，也參考目前有訂的，像高雄也訂過。我們把相關的法規找來，就開始研議如何訂定本市的辦法。
盧崑福議員,對，這也是為什麼要您主導的原因，市長剛剛是要方秘書長主導。
交通局王銘德局長,沒問題，秘書長協調。
盧崑福議員,因為依據交通部道路交通管理處罰條例的69條，這件事情要由您們主導。
交通局王銘德局長,是，授權地方政府可以開放管理。
盧崑福議員,市長，如果能早點上路，對臺南市真的有幫助，而且這樣子進行，未來也可以讓地方多一個就業的機會，停車的問題也會多少改善。
黃偉哲市長,交通就不會那麼阻塞。
盧崑福議員,對，好像又多了一個選項，我覺得很好。我去鹿港回來後，一直想著還要再去，一個景點、一個遊覽地區讓出遊的人想要再去。
黃偉哲市長,那個不是腳踏的，是用動力的。
盧崑福議員,對，時速差不多15、20，都這樣慢慢的，都有保險，每一輛車就像摩托車一樣都有申請牌照。
黃偉哲市長,應該沒有發生過大車禍？
盧崑福議員,不曾，我問他這幾年發生過車禍嗎？他說不曾。我又問如果車禍的話是不是有保險？他說有，完全都有保險，您懂我的意思嗎？
黃偉哲市長,我知道。
盧崑福議員,所以也要拜託警察多幫忙一下。觀光旅遊局，會刺激觀光，讓地方更繁榮、更好對不對？經發局，我們的商圈也要靠這個多少幫忙一些，再拜託您們4個局了，方秘書長會召集，4位局長請坐。
盧崑福議員,市長，義消本身因為勤務的關係會出入火場。
黃偉哲市長,有一定的危險性。
盧崑福議員,"危險當然有，可是最基本的是他們的健康，因為會吸入懸浮微粒，吸入空氣裡面的一些不好的物質到我們人體。所以我在這裡也要代表義消拜託您一下，關於健康檢查，政府一年編了300人，臺南市的義消有1,870個。"
消防局李明峯局長,"2,080位左右。"
盧崑福議員,"現在又增加了變成2,080多位。您們昨天給我的資料是1,800多位。"
消防局李明峯局長,那是有實際進入火場的。
盧崑福議員,"2,000多位的話，一輪可能要等6年多。"
消防局李明峯局長,我跟議員報告，我們有調查過。
盧崑福議員,當然有人不去。
黃偉哲市長,尊重他的意願。
盧崑福議員,當然，我在這裡拜託您，我們一次到位，把它編足。義消他們長期以來的付出，政府可以照顧的，何樂而不為呢？我們一次把它編足，他們要去、不想去就是由他們自己選擇，這樣好嗎？
消防局李明峯局長,議員我跟您報告，消防法前天修正通過，之前還沒有通過時，112年、113年市長都有給我們預算。
