speaker,content
蔡淑惠議員,市長，你看你的局處長問了什麼都不知道，要去查，我覺得他們的府會聯絡人都有來我們黨團詢問過，大概會問什麼資料，也很願意提供給他，因為我希望藉由總質詢的時候解決問題，不是發現問題之後就把問題放在旁邊。
黃偉哲市長,蔡議員你的講法我深深認同，如果府會聯絡人有去問了，議員也提供不是採取突襲的方式，而我們並沒有把相關的資料準備好，那是我們的錯。
蔡淑惠議員,市長，我從來不做突襲的質詢，因為我希望藉由總質詢去解決一些問題，所以只要府會聯絡人來尋求我們到底要問什麼議題，我基本上都會提供，但是今天看起來，他們兩個一樣提不出我要的資料，甚至發包這種事情，心理治療所已經從 110 年到 112 年逐年增加預算，可是只有寬欣心理治療所提供老師的心理治療服務，我現在問了也不知道到底是人家不願意來，還是我們只鍾情於寬欣心理治療所，我也不知道，那這個質詢能幹嘛？
教育局鄭新輝局長,跟議員報告，同仁回覆只有寬欣來投標。
蔡淑惠議員,只有寬欣來投標？
教育局鄭新輝局長,對。
蔡淑惠議員,你有沒有去了解一下，你看一下臺南市的免費心理治療所服務，你看他們有那麼多家的心理治療諮商所願意來服務，為什麼教師的部分就只有寬欣？局長，你有沒有想過為什麼，整個臺南市有 1 萬位老師，包括校長、園長、代理老師，結果只有一家寬欣來服務他們，你覺得這樣的服務品質會好嗎？你覺得這樣的服務夠道地嗎？如果今天我家離寬欣心理治療所太遠，我會願意車程那麼遠去諮商嗎？我本來沒有憂鬱症，每天都從那邊騎過去，可能都變成憂鬱症，局長，你有沒有想過這個不夠便民，對老師不夠友善。
教育局鄭新輝局長,向議員報告，好嗎？
蔡淑惠議員,所以我們光有這樣的服務，事實上我覺得真的只是一個口號。
教育局鄭新輝局長,我跟議員報告，它們的服務滿意度都在 99%以上，當然第二個，它們的服務方式除了在諮商服務所之外，也可以約定時間跟地點，儘量以老師的便利性為主。
蔡淑惠議員,局長，如果今天的滿意度是 99%以上，我就不會受到老師的拜託，請我對於這個部分能夠為他們發聲，局長，你聽懂嗎？
教育局鄭新輝局長,聽得懂。
蔡淑惠議員,今天就是有很多老師認為預約的時間不一定能符合，預約的時間地點他們不一定能配合，所以他們覺得心裡需要接受諮商的時候，他們得不到第一時間的諮商，我跟你說，人要自殺是一剎那之間而已，你知道嗎？人如果要自殺是一剎那之間而已，如果還排到半年後、2 個月後、4 個月後，我覺得你要思考一下。
教育局鄭新輝局長,現在就是只有一家來投標，或許未來有更多家投標，我們可以採用複式決標的方式，或許也可以考慮。
蔡淑惠議員,有沒有可能跟衛生局連結？
教育局鄭新輝局長,可以。
蔡淑惠議員,衛生局說他們有很多心理諮商師，有 5、60 個，衛生局願不願意配合教師的部分？
衛生局蘇世斌局長,"跟議員報告，衛生局的部分是開放給全部市民，去年 111 年有 1,697 位來接受服務，外面有 4 家心理諮商所。"
蔡淑惠議員,"1,000 多位，教育局長，老師有多少人來做諮商？"
教育局鄭新輝局長,一年的話有大概 200 多位。
蔡淑惠議員,所以 1 萬位老師就有 200 多位需要心理諮商，還是有很多老師想要心理諮商，不得其門而入或是時間排不進去，我希望這個會後你去調查一下，好不好？
教育局鄭新輝局長,對，只要老師……
蔡淑惠議員,我覺得老師在疫情的時候，他要面臨的不是只有教學的改變，甚至可能要面臨學生因為染疫確診之後，過程中家長的反映，我覺得老師在那段時間的壓力相對非常大。
教育局鄭新輝局長,是。
蔡淑惠議員,所以拜託局長，你身為一個臺南市教育局局長，旗下有那麼多老師、校長、代理老師，你要做到對他們關心。
教育局鄭新輝局長,是。
蔡淑惠議員,不是說經費逐年增加就覺得能量度會增加，我覺得這樣是不對的，甚至有這麼多的心理治療所，只有寬欣，甚至可以去邀約其他的心理治療所來投勞務標，甚至可以把勞務標切成 1/2、1/3，每一個診所都有，我覺得你要去思考一下，而不是一直都照本宣科，每一年都是寬欣，我對寬欣沒意見，我也不知道它在哪裡，但是我覺得這個是不可思議，好不好？這部分要拜託你一下。
教育局鄭新輝局長,是，我們來檢討看看。
蔡淑惠議員,我們也希望老師的部分一年不是只有 4 次，如果他真的有需要，甚至可以開放更多次，當然我們建議是 8 次，可是我個人覺得可以比 8 次更多，如果這個老師真的有需要，給他 10 次、100 次都沒關係，只要能夠讓他的心理更平衡，對他的教學有幫助，我覺得都應該，好不好？
教育局鄭新輝局長,我們來研議。
蔡淑惠議員,警察局長，員警一年有多少次的諮商機會？
警察局廖宗山局長,我們沒有限制諮商機會。
蔡淑惠議員,沒有限制？可是就我的資料裡面，警察一年諮商的次數是 20 次，勞工的諮商次數也大概有 6 次，勞工局長對不對？
勞工局王鑫基局長,有需求的時候就會安排。
蔡淑惠議員,對，就是基本的是數字，警察大概 20 次，勞工 6 次，教師目前表定只有 4 次，教育局長，我覺得對老師諮商的部分有欠缺，能量度也不夠，就算黃偉哲市長願意把經費增加，但是我希望未來能夠讓諮商的次數不會因為個人而限制次數，如果有需要應該要開放讓他們去諮商，好不好？
教育局鄭新輝局長,我們就提供必要的補助，當然如果個人的部分確實有需要，我們再看看衛生局有沒有其他資源可以支援。
蔡淑惠議員,衛生局長，心理治療師可能自己心理有一些壓力也需要受到諮詢，心理治療師如果有不適任的狀況，依個資法來說，我們可以公開在網路上說某某人不適合做心理治療師，或是他有什麼樣的狀況，可以嗎？
衛生局蘇世斌局長,應該不可以。
蔡淑惠議員,應該不可以，那我如果今天找了心理治療師比我還嚴重，我還去讓他心理諮商，不是很奇怪嗎？我不知道這位心理治療師的個案怎麼樣，個人是不是有問題，我要怎麼查詢？
衛生局蘇世斌局長,這個網路上應該是查不到，臺南市目前大概有 320 位諮商心理師。
蔡淑惠議員,諮商心理師的證照是一輩子的，還是每一年。
衛生局蘇世斌局長,應該有繼續教育的認證。
蔡淑惠議員,沒有繼續教育的就不行？
衛生局蘇世斌局長,沒有繼續教育不能夠換證。
蔡淑惠議員,沒有繼續教育不能夠換證。
衛生局蘇世斌局長,現在所有的證照都有一定的期限。
蔡淑惠議員,所以局長，你知道老師有所謂的不適任教師，心理治療師這個制度如果能夠建立起來，對於未來這些老師、勞工、警察，他們要選擇心理治療師的時候應該會更明確一點，這個部分你們去思考一下，是不是依法來說可以用什麼方式，好不好？
衛生局蘇世斌局長,是。
蔡淑惠議員,這個部分再拜託你。
衛生局蘇世斌局長,謝謝。
蔡淑惠議員,教育局長。
教育局鄭新輝局長,是。
蔡淑惠議員,我想請教一下，對於今年年底的全國運動會，你扮演什麼樣的角色？
教育局鄭新輝局長,一開始整個籌備的工作是教育局下層的體育處，後來在去年體育局成立之後，原來局裡面規劃包括各個學校都有按照分工籌備。
蔡淑惠議員,所以現在的全國運動會組織架構是當時體育處還沒成立體育局的時候就已經完成，還是體育局成立之後新的架構？
教育局鄭新輝局長,那個是之前初步架構就已經建構完成，後來也都沒有太大變動。
蔡淑惠議員,這個架構是在教育局的時候就已經架構完成，只是體育局照著這樣做，對不對？
教育局鄭新輝局長,後來他們有做了一些微調，調的部分不大，大架構大概是這樣。
蔡淑惠議員,你請坐。體育局長。
體育局陳良乾局長,是。
蔡淑惠議員,體育局成立多久了？
體育局陳良乾局長,去年的 7 月 1 日成立。
蔡淑惠議員,所以到今天 6 月 8 日為止未滿一年。
體育局陳良乾局長,是。
蔡淑惠議員,一個小孩未滿一歲能夠走路的應該也不多，不要說跑步，好不好？你在這麼重要的全國運動會，它睽違 16 年之後，再次回到臺南市舉辦全國運動會，相對之下，如果今天沒有體育局的話，教育局就是舉辦全國運動會最重要的局處，剛好去年 7 月 1 日成立之後，變成把全國運動會這重責大任全部給體育局去成立，我對你的組織架構有一個很奇怪的想法，一共有 5 部 30 組，對不對？
體育局陳良乾局長,對。
蔡淑惠議員,5 部的部長全都是體育局的人，行政組是體育局的主秘，典禮組也是體育局的，服務部也是體育局，競賽部也是體育局，宣傳部也是體育局的部長。
體育局陳良乾局長,是。
蔡淑惠議員,局長，是你的能力夠好，還是你的部屬很強，可以讓 5 部 30 組的 5 部部長那麼重要的職位都由體育局承攬，是人家不願意幫你？還是你覺得你們有辦法承受？
體育局陳良乾局長,這樣聯絡比較方便。
蔡淑惠議員,這樣聯絡比較方便，我跟你說，現在電話很方便，美國跟臺灣交流，用 Line 也可以聯絡，還可以視訊，你用這個理由我覺得很奇怪，像宣傳部的部長，為什麼不能是新聞及國際關係處來處理？為什麼部長還是秘書室的主任，局長，人家說「會曉拍派較好走傱」(臺語)，處長請坐。「會曉拍派較好走傱」(臺語)，臺南市政府這個團隊非常強，藉這個機會我要誇獎一下姜淋煌局長，市長，姜淋煌局長是我看過最有團隊精神的一個局，不管哪一個局處出了問題，或是哪一個局處有議員想要去質詢，他一定主動出面去溝通協調，不管這個溝通協調有沒有效，但是我們看到他的努力。
黃偉哲市長,就是我很會「拍派」(臺語)，他很會「走傱」(臺語)。
蔡淑惠議員,很好，你會「拍派」(臺語)他會「走傱」(臺語)，所以你分派他就對了，我覺得全國運動會不要把所有責任都推到體育局，因為這是全臺南市的大事。
黃偉哲市長,這是臺南市的大事，不是一個局處的大事。
蔡淑惠議員,對，所以市長、局長，我要講的就是這個，既然有這麼多的局處長可以讓你去用、拜託，為什麼把所有的責任用到體育局？體育局人事編制一共有多少人？
體育局陳良乾局長,64 個人。
蔡淑惠議員,64 個人要舉辦全國運動會，我拭目以待，如果下面這些人不配合你，怎麼辦？我最近聽到一個笑話，他說姪子幫叔叔工作，結果伯父不開心，你聽得懂意思嗎？姪子幫叔叔工作，結果伯父不開心。
黃偉哲市長,就是伯父的兒子替叔叔工作，伯父不開心。
蔡淑惠議員,對，伯父不開心，你知道伯父是什麼嗎？伯父就是教育局，叔叔就是體育局，最近我們聽到的順口溜就是這樣，幫叔叔工作，伯父不開心，當然我相信鄭新輝局長不會，但為什麼會是這樣，因為看到你的組織架構裡面有太多的校長，甚至 30 組裡面有 27 組都來自學校的協助，但是局長，我可不可以請教你，對於校長，你有什麼能耐可以叫他做事？他為什麼要聽命於你？
體育局陳良乾局長,之前都規劃好，教育局的時代就規劃好，我們就延續下來。
蔡淑惠議員,那時候是教育局規劃，校長是隸屬在教育局底下，所以校長會去執行，市長，你可不可以考慮一下，再過幾年還有一個全民運動會，一樣是把這個重責大任推到體育局身上，一樣會動用到學校老師、校長，是不是可以在未來校長、老師的遴選，讓體育局有機會能夠參與，我覺得人都是這樣，像我們有很多話不敢直接講出來是因為有選票的壓力，如果今天體育局為了要舉辦這麼多重大的活動，而他卻對於校長、老師沒有遴選機制的資格，我想他們不太會盡全力幫忙，這個組織架構剛才講的很清楚，是當時體育局還沒有成立，還是體育處的時候，教育局當時列出來的組織架構，所以那時候的校長不得不答應、不得不同意、不得不配合，但是現在體育局如何能奈何校長們？體育局長。
黃偉哲市長,以前伯父和叔叔沒有分家，現在分家了。
蔡淑惠議員,對，伯父和叔叔。以前警察局和消防局也是合併在一起，鄭局長請坐。體育局長，今天把全國運動會拿出來做總質詢，我個人認為體育局 64 個人員編制，如果沒有學校、校長、老師的配合支援，體育局是辦不起來。
體育局陳良乾局長,是。
蔡淑惠議員,但是你如何在這中間拿捏的好，讓他們心甘情願盡全力來幫你，這很重要，就像在座所有的一級主管一樣，可能很多人竊喜，這個全國運動會跟我的局處沒有關係，很多人可能會覺得它跟我的業務無關，我可不可請教各位局處長，你覺得全國運動會跟你的業務無關的請舉手好不好？通通有關係，很好，那為什麼那次的專案報告，有的局處沒有來？
體育局陳良乾局長,這是我們邀請的。
蔡淑惠議員,對，局長，這就是重點，你的專案報告裡面不是所有局處長都到，那現在認定全國運動會跟他們的業務都有關係，是你失職嗎？還是你瞧不起他們？
體育局陳良乾局長,不是，是我們疏忽了。
蔡淑惠議員,你們疏忽了，那很好，我希望下次全國運動會再開籌備會，或越來越接近尾聲的時候，拜託多使用這些局處長，請他們協助，好不好？
體育局陳良乾局長,有，我們都有定期開跨局處的會議。
蔡淑惠議員,可是剛剛問了，像上次專案報告我就覺得很質疑，奇怪，蘇恩恩怎麼沒到，是不是？
體育局陳良乾局長,是。
蔡淑惠議員,宣傳部那麼重要，他居然不到，他說你沒有邀請他，所以體育局是有問題的。
體育局陳良乾局長,沒有請他是體育局的疏忽。
蔡淑惠議員,這麼多人要協助你，結果你一個都不用，全部都承攬在體育局的身上，你有那麼厲害嗎？你還不滿一年，我說連走路可能都還不會，還要用跑的？對不對？
體育局陳良乾局長,是。
蔡淑惠議員,局長，你要去思考一下，未來在 10 月份舉辦全國運動會的時候，你該怎麼樣調整你的步伐，好好去做，好不好？這個部分再麻煩你一下。
體育局陳良乾局長,謝謝。
蔡淑惠議員,但我還是要再三拜託教育局長，你身為一個教育局長，既然全國運動會本來是你要舉辦的，你不是處於協辦之外，你要覺得這跟教育局主辦的一樣去協助他們，不是「徛懸山，看馬相踢」(臺語)，等著看笑話，看體育局出醜，這是臺南市很重要的面子問題，這個部分拜託教育局能夠努力一下。
教育局鄭新輝局長,跟議員報告，這個是全市府的大事，教育局不可能置身事外，而且一開始的時候，這些校長都是非常優秀的校長，我們還是對他有信心，都會跟體育局隨時聯繫，他那邊如果發現指揮或事務推動上有困難，直接跟我講，我馬上就會去處理。
蔡淑惠議員,很好，你能這樣講，透過直播大家都知道，也可以存證，局長，我覺得有時候心態跟講出來的不太一樣，我舉個例，教育局有沒有盡力協助體育局舉辦這次的全國運動會，我收到的消息是有，教育局支援了它 27 組的人，支援了它什麼……等？所以你們這種老大心態，認為有幫忙，怎麼會沒有，30 組裡面給了 27 組，所以你會覺得那是體育局的工作，不是你的工作，所以你覺得給了它很大的恩惠，支援了它那麼多的資源。
教育局鄭新輝局長,沒有，那個不會是恩惠，那都是我們的事，怎麼會是恩惠呢！
蔡淑惠議員,所以局長，這件事被講出來後我聽了就不太高興，聽起來就像老阿伯在欺負叔叔，以爸爸欺負兒子，今天如果沒有體育局協助你這次辦全國運動會，教育局就是全國運動會最主要的主辦單位，所以你要有這樣的心態，要慶幸剛好體育局可以幫你分擔這個工作，而不是你去支援它們，這是心態不同，所以教育局長，希望你能夠改變一下心態，也讓這些參與的優秀校長有共同榮辱共存，這是臺南市的大事，大家一起來努力，好不好？謝謝。
李中岑議員,體育局局長。
體育局陳良乾局長,是。
李中岑議員,局長，我請教你一下，目前全國運動會籌備的狀況，你覺得目前最重要的四個方向是什麼？
體育局陳良乾局長,第一個是賽事順利，第二個場館一定要安全舒適標準，第三個要讓全民都能夠關注這個工作，迎接來自 22 縣市的代表隊，第四個要讓比賽公正公平的展開。
李中岑議員,還有一個重點，局長，你沒說到，就是希望臺南市的選手可以拿更好的成績。
體育局陳良乾局長,對，好成績。
李中岑議員,是不是？
體育局陳良乾局長,是。
李中岑議員,接下來，這個是在上個星期日舉辦的國際龍舟錦標賽的舵手研習，局長，你看到這個環境、河道，我請教一下，這是要怎麼研習？這個真的非常糟糕，整條河面全部都是布袋蓮，甚至，播一下影片，這是教練選手開著裁判船去清河道，自己開船去清河道，你看這是多麼危險的狀況，市長，你也看一下，這整條河上面不是布袋蓮就是死魚。為什麼我說上有布袋蓮，下有拖屎連，選手最可憐，因為過去我是划船選手，所以也是在這條河道上訓練，那時候因為水上有很多布袋蓮，而且水底下沒有清淤，造成很多雜物，所以選手時常不是撞壞船，就是會翻船，重點是那天為什麼會有這樣狀況，因為在右上方的阻攔繩斷掉了，所以才會造成整條河道全部都是布袋蓮，甚至你看，這是隔天我去現場看的，還有很多死魚，市長，你知道當下的味道有多難聞嗎？在太陽曝曬下真的是非常難聞，在現有的狀況，要選手怎麼去訓練？第一個，要求人家辦研習，結果場域是這樣的情況；第二個，在選手訓練的過程當中，如果發生了危險或是公安事件，這個部分是誰要去負責？當初你們要設立水上運動中心，也是透過臺南市府各單位局處同意之後，才會設立在嘉南大圳的那個位置，對不對？但是你看現在這樣的狀況，未來會不會再發生，我不知道，但是這一些布袋蓮，如果要讓它飄到大海去，必須要一個月的時間才會完全乾淨，重點是 9 月，划船跟輕艇的賽事，它們是提早比賽。
體育局陳良乾局長,是。
李中岑議員,所以 9 月份離現在剩下 3 個月的時間，如果時常有這樣的問題跟狀況，請問選手要怎麼去練習？這部分到底要怎麼練習？清淤的部分，局長你也說經濟部水利署第六河川局有同意了，到底何時要進行？目前為止都一直沒有下文，我希望說加速，因為已經講了很久，從 2、3 年前，甚至更久之前就一直在提，可不可儘快去處理這些問題，市長，我要求要讓選手有一個完善又安全的水域，這樣選手才可以練習得快樂又安心、安全，我不希望剛剛的狀況還會再發生，這樣真的非常危險，而且現在大家真的很急迫的訓練，因為馬上就要比賽了，所以希望市長要求經濟部水利署第六河川局，包含市府各單位局處要趕快去處理，好不好？
水利局韓榮華局長,跟議員報告，昨天反映之後，我們也跟經濟部水利署第六河川局請求它們儘速進行布袋蓮清理作業，讓選手可以練習。第二個有關清淤的部分，因為經濟部水利署第六河川局需要一些相關的經費，它也在尋求水利署的經費，儘速來辦理水道的清淤作業。
李中岑議員,我期待時程儘量快一點，因為水上運動中心已經完工，驗收也完畢了，所以我希望驗收完畢之後就可以進行訓練，那才是最主要的，好不好？
水利局韓榮華局長,是。
李中岑議員,局長，請坐。再來，我為什麼會提到這位杜元坤醫師院長，他本身是臺南人，也是一位橄欖球選手，局長你知道嗎？也是你的前輩。
體育局陳良乾局長,是。
李中岑議員,過去不管是在當選手的階段，他是一位很優秀的選手，而在當醫生的階段，也是一位很優秀的醫師，但他當了醫師之後並沒有忘本，有能力了就來照顧基層體育，所以我抓到很多訊息，包含在臺南市成立杜元坤橄欖球運動發展協會，他針對每一間學校也好、教練也好，還是選手比賽的部分，各個階段都有補助，所以這麼一個人格高尚的人，為了自己的故鄉、為了過去努力的體育項目，他願意來付出，所以我覺得這個部分真的非常難得，我也藉著今天總質詢的時間感謝他，感謝對臺南市的體育基層付出了很多心血，包含他的協會也有舉辦冬令營的訓練，把所有的選手跟教練集結在橄欖球場進行訓練，互相琢磨切磋球技，來帶動整個臺南市的成績，所以這次激勵是有成效的，臺南市可能過去沒有得獎的學校，或是過去一直有拿獎，但是成績可能到一定門檻就上不去的狀況，就已經打破了，所以這次很多學校都有得到名次，過去也很多學校都沒有進到 8 強，也是因為協會的努力，杜元坤院長的幫忙協助。
黃偉哲市長,這幾年的成績是有目共睹。
李中岑議員,所以這就是我們為什麼一直跟臺南市政府，不管是體育局、教育局、各部門，說激勵真的是有效，為什麼永遠都說沒有錢，沒有錢沒錯，但是要去思考我們要怎麼去運用，市長，你都知道要運用社會資源。
黃偉哲市長,可是公部門的資源這幾年來一直以來挹注了不少。
李中岑議員,有限。
黃偉哲市長,也挹注了不少。
李中岑議員,提升、提高了很多。
黃偉哲市長,訓練、獎勵。
李中岑議員,對，這個我都知道，但是我覺得我們自己本身的資源有限，所以我們才會去拜託到外界。
黃偉哲市長,還有跟你補充一個人。
李中岑議員,市長，你知道我為什麼要說這個？
黃偉哲市長,劉福財前理事長也是對於足球有貢獻，杜元坤對於橄欖球、劉福財對於足球……
李中岑議員,付出很多。我也知道劉福財理事長對足球體育貢獻很多，但是為什麼這次我會特別提到杜元坤院長，什麼原因？市長你知道嗎？這個是冬令營現場訓練的狀況，舉辦完之後還有一個頒獎，就是針對這些進步優秀的選手進行頒獎，來鼓勵他們。市長，我有很多的無奈，我也讚賞市長很厲害，可以找到很多資源來資助市府沒辦法去做的部分，但是我覺得很不妥當，明明知道有加碼金，但加碼金從何而來？你沒說清楚，很多議員都以為是議員質詢，市長說好就加碼，但是你卻沒有講清楚說明白，這些加碼金到底是從哪裡來。
黃偉哲市長,議員，我們除了杜院長之外，還有其他的來源，其他的企業捐贈。
李中岑議員,是，所以市長，大部分的獎金加碼是不是都是由杜院長？
黃偉哲市長,因為我們今年主辦，一次性。
李中岑議員,我問是不是，有嗎？
黃偉哲市長,他扮演了很重要的部分。
李中岑議員,對，不管是杜元坤院長，還是其他來協助提供這次全國運動會的獎金，我覺得你在新聞稿裡面都沒有一字一句的感謝。
黃偉哲市長,我覺得你講得很對，我們對於熱心幫忙的企業或個人都應該心存感謝，而且應該公開表達。
李中岑議員,所以市長我剛才說到，可能你稱讚、感謝財團的時候，會卡到利益的關係。
黃偉哲市長,有這樣的顧慮。
李中岑議員,但是杜院長他是完全沒有任何的利益，他贊助這些經費、幫忙這些經費，得不到什麼好處，他還是必須要去當醫生。
黃偉哲市長,只是他的心願跟熱血。
李中岑議員,他的心願，就像過去人家說的吃果子拜樹頭的感覺、理念，很多狀況下，不能像市長直接發出一個新聞稿，就當作臺南市政府替選手加碼。
