speaker,content
黃偉哲市長,我們會研究適法性，如果適法性沒有問題，我們可以考慮這樣做。
周麗津議員,因為我覺得臺南市的酒駕事故不減反增，拜託市長，市府趕快研議來實施。
黃偉哲市長,是，曾幾何時，我們在去年的時候還獲得酒駕取締的績優城市，可是現在反而就增加了13.1％，這是無法接受的。
周麗津議員,所以對於這個我建議的方案，麻煩你們要趕快來評估。
黃偉哲市長,大家可以看到新北市，以113年1到7月他們是416件，臺北市100件，我們居然高達561件，這是很難接受的，在六都裡面排第二，僅次於臺中市。
周麗津議員,所以這個部份要麻煩市府趕快來研議，看看能不能讓這些酒駕累犯不要一再酒駕。
黃偉哲市長,而且我跟議員報告，因為接下來就要靠近年關了，年關有很多尾牙，尾牙很多都喝酒，酒喝多就會肇事，所以為了要能及時遏止這種酒駕的歪風，不管是市民或是外地來的人，反正有這樣子的情形，我們都嚴格加以取締，取締後，在適法的範圍內，剛才議員建議可以公告，我們就把他公告出來，不要僅是公告在我們的網站。
周麗津議員,是，公告在他家附近鄰里的公布欄。
黃偉哲市長,好，如果說適法性沒問題就可以考量的。
周麗津議員,好，謝謝市長。接下來我們看一下，這是衛生局的公文，民眾收到之後以為是詐騙集團寄來的，很困惑，要在文列3天內提出意見陳述書，所以拿到本席的服務處詢問，其實我也可以了解到市府為了防治登革熱、防治蚊子，有時候必須有一些手段，剛開始實施的時候，我們民眾反彈聲音很大，也建議說可以用勸導的方式，這一張公文是我們衛生局發出的，當時也是由我們副局長黃文正代寫，局長，您知道這件事嗎？
衛生局李翠鳳局長,已經有了解了。
周麗津議員,已經有了解了，所以這一張是真的，不是假的？
衛生局李翠鳳局長,跟議座說明，這一張單子是這樣子的，就是說這個民眾的罰單是在109年他就被舉發，但是確實那時候登革熱防治中心的這個承辦人，他在執行上有一些疏失，所以在去年的時候，一共撈出300多件，該去開出裁處書沒有開的，所以去年一次開出了300多張，這個民眾接到了這個之後，我們會讓他有陳述意見，但是這個民眾沒有陳述意見，所以在法律上就去強制執行，他被強制執行扣了錢之後，這個民眾就提出訴願，所以這一次會發這個公文給他，是因為他去訴願，訴願只有給我們20天的期間，我們才會說你3日內來跟我們說明，不過這個民眾如果有問題，他其實可以打電話來，我們還是會讓他延長。
周麗津議員,可是一般市民不知道電話聯絡，他們看到3天內就很緊張了，而且他說4年前發生的事情，你現在要叫我去回想，局長，就如你講的，4年前的事情，你叫我現在回想，我有可能也會忘記了，所以這對民眾來說真的是很困擾。
衛生局李翠鳳局長,對，其實這個承辦人目前我們也已經解僱了，他其實是有一些文書登載不實，不過這都過去了，將來我想對於這種事情，我會請同仁親自用電話，先跟對方通知，就是說我們會有這個公文，也讓他知道這個事情，也讓他有一個說明，我想這樣可以減少民眾突然接到公文的錯愕，這個部分我們可以做的更細緻。
周麗津議員,局長，您講的有300多件公文沒有發出去，這300多件公文你們現在已經都全部發出去了嗎？
衛生局李翠鳳局長,去年112年就已經全部都發出去了。
周麗津議員,112年，可是這是上個月他收到的？
衛生局李翠鳳局長,對，因為他沒有去繳錢，所以他就被強制執行。
周麗津議員,沒有，這個還沒有強制執行。
衛生局李翠鳳局長,因為他提了訴願，這一張是因為他提訴願，所以我們跟他說你來訴願的時候，我們給你3日的說明。
周麗津議員,這個也還沒有提訴願，這個沒有，他接到之後去跟里長講，里長來我服務處陳情，他用口頭上跟我講，然後我馬上幫他寫了陳述書，請他再自行去寄給我們衛生局，所以是在前一、二個星期發生的事情，不是衛生局你講的去年的事情。
衛生局李翠鳳局長,對，因為這個109年的被執行，是在112年才把這一張舉發書寄出去，就是因為中間這個承辦人的疏失，所以這個人已經被解僱了，112年發現到有109甚至更早的舉發書，總共有300多件，所以是去年寄的。
周麗津議員,所以這是你們衛生局的疏失，不是民眾的疏失，你不能這樣子強制要求他們3天內一定要陳述。
衛生局李翠鳳局長,對，所以我們說以後要用電話事先跟他說明，他如果時間上需要延長或調整。
周麗津議員,希望不要有以後。
衛生局李翠鳳局長,當然我們也是這樣希望，現在是亡羊補牢。
周麗津議員,好，麻煩局長，假如你們有收到這個部分的陳情，可以更寬容一點，看到公文寫3天，民眾會怕，我們打電話去衛生局，你們說沒關係，可以拖個幾天，可是市民不知道有這件事，看到這樣的公文會擔憂，不知道該怎麼處理，賺錢很辛苦的。
衛生局李翠鳳局長,好，我們以後會先用電話通知，這樣才不會造成市民的緊張，謝謝議座建議。
周麗津議員,市長，我想跟你講，最近我們的運河是不是有大量的吳郭魚暴斃？現在要怎麼處理？到今天為止，我早上去看還有看到一些。
黃偉哲市長,我們希望能夠儘快來處理。
周麗津議員,儘快處理要有方案啊？
黃偉哲市長,我們會儘快研議。
周麗津議員,請局長回答一下。
水利局邱忠川局長,跟議座報告，現在整個安平區的汙水接管率都已經達到97％，所以我們也還在探討原因。
黃偉哲市長,這個運河的魚現在好像已經……
周麗津議員,還有一些，而且有的已經流到鯤鯓，早上鯤鯓的居民還有來跟我反映。
黃偉哲市長,我們會在最短的時間內趕快把魚清掉。
周麗津議員,把魚清掉，問題也要找到，不要每次颱風過後就有一些魚屍浮在運河上面，要找到問題來源。
主席郭鴻儀議員,好，感謝周麗津議員的市政總質詢，今天上午的議程到此結束，非常感謝黃偉哲市長、方秘書長、各局處首長的列席，也感謝新聞媒體好朋友的採訪、本會同仁的出席，以及電視機前各位市民朋友的收看，上午議程到此結束，散會。
