speaker,content
周麗津議員,局長，您說加入在長照的部分，那一般六十五歲以上的長輩就不可以用這一個方案了嗎？
社會局盧禹璁局長,長照是專門為我們六十五歲以上服務的。
周麗津議員,所以所有六十五歲以上的長輩都可以用這個方案嗎？
社會局盧禹璁局長,都可以用，但是要根據他的經濟狀況，有不同的付費狀況。
周麗津議員,好，這一點再麻煩局長，這個部分也是我關心的議題，再麻煩局長幫我們加速。
社會局盧禹璁局長,是，我們年底前就會簽署完畢。
周麗津議員,好，謝謝。接下來，我想跟市長講一下，荷蘭自動導航系統公司最近公布了亞洲交通最糟城市出爐，臺灣在前十名裡面有臺中、高雄、臺南，臺北是第11名，臺北10公里的路要開21分50秒，市長，你也有看到臺南是第10名，對不對？
黃偉哲市長,對。
周麗津議員,臺南10公里的路要開22分10秒，其實我也知道交通在臺南已經花了很多的功夫跟很多預算，也做了很多的改變，那花了那麼多的心力跟經費，為什麼我們還在亞洲交通最糟的城市排名前10名呢？
黃偉哲市長,首先，先跟議員說我們的交通的確是需要改進，其次要跟您報告，就是說這個指標衡量的工具不是很準，有機會交通局長會私下跟您報告，但很重要的就是說，你看亞洲十大塞車城市臺灣占了臺中、高雄跟臺南，占了3個，你看曼谷、雅加達比我們好，印度的首都德里跟孟加拉的塞車都是我們很難想像的，但我覺得其實我們不用跟人家比，我們跟自己比，我們自己要改進，這是事實。
交通局王銘德局長,簡要跟議座說明，這個指標其實是一個平均的旅行時間，它當然會跟這個城市有沒有高快速公路有關，因為它是尖離峰都算在一起的，所以我想主要是這個原因，它其實有好多種指標，後面還有一個指標是平均的旅行速率，我們的旅行速率其實就比其他很多世界大城市都好很多，我想這個是它指標取樣，以及它計算標準的問題。
周麗津議員,好，其實我想表達的是有時候改變也不一定是有幫助的，甚至有時候會有反效果，所以我們一定要鼓勵大眾運輸，以減少私人運具的方向去努力，臺南市目前的大眾運輸只有大臺南公車而已，因為捷運還沒開始，所以要拜託交通局局長，一定要用你的專業來做出未雨綢繆的判斷，來改進臺南市的交通。
交通局王銘德局長,我們來積極努力，謝謝議座。
周麗津議員,市長，再來是臺南的三橫三縱＋1快路網，是不是應該要加快速度來推動？不管是地方的議員，或者中央的立委，大家都很關心這七條，臺61線目前只有接到安南區的台江大道，對市區真的幫忙沒有很大，簡直是把臺南市區跨過去了，我也有去看過這個路線圖，目前規劃是接安平跨港大橋走永華路至中華西路，其實我們也知道中華西路目前的路況，塞車狀況也是很嚴重，其實這個還是在研議當中，我們也可以看到這一張圖，這是我下午五點半在Google地圖截圖下來的，很多路段幾乎都是紅線，紅線就代表塞車，局長，你覺得目前這一條的路線的規劃OK嗎？（按-北外環連接安平生活圈三橫三縱＋1快速度要加快）
工務局陳世仁局長,跟議座報告，因為現在在可研階段，現階段臺61線公路局正在做曾文溪景觀大橋，等景觀大橋完成後，後續接續就是從安南區接到四草，然後進去是有幾個方案在評估，可研其實剛送件而已，有可能是從漁光島走高架或地下，然後才有剛剛講的，跨到市區裡，這個路線目前只是在可研階段，而且可研階段還沒有過。
周麗津議員,這是我得到的訊息，我知道可研還沒有過，所以想要跟局長先建議一下，這個路線可能不是很OK。
工務局陳世仁局長,我們也有這樣的考量，也有跟公路局做出這樣的一個反映。
周麗津議員,好，其實因為中華西路的塞車狀況真的很嚴重，不知道有沒有可能在西濱公路，中華西路到中華南路這個部分，可以來做一個高架快速道路，市長，這個有沒有可能呢？不然塞車的很嚴重。
黃偉哲市長,市區要做高速公路，我覺得工程上就會遇到兩個問題，第一個當然是經費，第二個是你要做高架，馬上就會碰到交通黑暗期，這個交通黑暗期如果跟捷運在開通的時候撞在一起，就會變成交通地獄期，這樣的話，民怨會很深，所以可能我們的重大工程要有一個順序。另外一個，當然就是地方上會有反彈，你看我們現在捷運綠線，很多路線都沒有辦法定案，就是你要走西門路，西門路的商家反對，說你為什麼讓我們家二樓被人家坐捷運的這樣看來看去？走夏林路，夏林路也反對，所以我們可能要謹慎的考量。
周麗津議員,市長，假如沒有解套的方法，我建議一下，臺61快速道路要接到86才可以發揮到運輸路網最大的利益，而且重點是還有延伸到高雄。
黃偉哲市長,對，效益要出來。
周麗津議員,一定要做出來，所以從西濱快速道路延伸真的很重要，可以從臺南串聯到高雄，這個部分，市長可以幫我們延伸到86嗎？
黃偉哲市長,是，我們要跟中央建議。
工務局陳世仁局長,跟議座報告，現在都已經進入可研的階段，他們在評估整個路線，其實就是一定要銜接到86，從86的新港再往高雄做連接，這裡面都已經有在做規劃的可行性研究了。
周麗津議員,所以路線的話，拜託局長，一定要把臺南市的需求、臺南市的路況，一起放入讓大家來討論，不要把會塞車的路段也加進去。
工務局陳世仁局長,當然。
周麗津議員,謝謝局長。我知道現在和緯路五段已經通車了，就是和緯路五段延伸到安平。
工務局陳世仁局長,和緯路五段延伸到安平舊城區，在去年就已經完工了。
周麗津議員,華平路也快要完成了？
工務局陳世仁局長,應該算完成了。
周麗津議員,快完成了，因為我每天都會經過，這兩項任務也是在黃市長任內完成的，所以也要感謝市長跟交通局及各個局處的幫忙，要先感謝大家才有這兩個部分，其實這個部分，做好的部分，從安南區安平這邊，可以前往中西區、北區、安南區，這個運輸的能量真的是相當有幫助，從安平區有一些居民要到南科，也都會開這一條和緯路過去，我知道原本北外環快速道路是規劃往西延伸到臺17線大港觀海橋，可是聽說受限於文賢抽水站、大港觀海橋下墩柱空間等因素，之前你們開說明會的時候，我也有到場參加，一些民眾都在反對，所以目前研議朝向先施作至北區大和路，是不是？
工務局陳世仁局長,是。
周麗津議員,市長，到了大和路之後，我們有沒有一些可以解決的方案再延續呢？
工務局陳世仁局長,跟議座報告，議座是講到安平歷史風貌園區的一個聯絡道路，其實我們也已經大概規劃完成，也就是把原來的ND8米道路也留著，然後再往鹽水溪堤岸做一個約18米寬度的道路，這裡面還包括當地民眾比較關心的停車問題，我們也會在路邊做停車位，至於他們希望能從原來的舊道路到鹽水溪堤岸上，其實我們也規劃兩個景觀天橋，要讓他們能夠通過，也能夠去觀賞鹽水溪景觀，這些部分的可行性規劃已經都大概完成，但是我們會擇期，大概等第四期中段標上網招標時，會跟地方先做進一步的溝通，看要用什麼樣的方式讓大家來取得一個共識點，然後做相關的處理。
周麗津議員,局長，有沒有可能可以延伸到和緯路、華平路呢？
工務局陳世仁局長,這條路原本就是從大港跨海橋延伸到和緯路五段，這一條路的規劃本來就是規劃要延伸到安平的舊城區。
周麗津議員,對，因為當時蘇貞昌院長有承諾說希望可以到華平路跟和緯路這個部分。
工務局陳世仁局長,對，它是到和緯路五段的延伸。
周麗津議員,所以我很希望說真的能做到那一段，真的交通可以改善。
工務局陳世仁局長,本來就是做到那一段。
周麗津議員,聽到我們局長說真的有做到那一段，我就真的很放心了。
工務局陳世仁局長,規劃本來就是有做到那邊。
周麗津議員,好。接下來，我要講在上個月第一個週末，10月5日跟6日安平舉辦了美樂蒂與酷洛米的一些活動，吸引了眾多人潮，第一個星期就吸引了將近5萬人來參加，當時在安平還有另外一個活動，就是浪人祭，我知道市長也有去參加浪人祭的活動，所以這兩天就有超過10萬人在安平，這10萬人根本就是擠爆了我們的安平，我們安平的居民都在抗議，市長，你知道他們在抗議什麼嗎？（按-2024浪人祭臺南安平連續兩天用音樂讓臺南躍上國際。活動要調配，創造最大效益，舒緩在地居民感受）
黃偉哲市長,交通。
周麗津議員,對，交通，針對交通的部分，我們整個市政府都知道那個週末有美樂蒂與酷洛米跟浪人祭這兩場活動，為什麼我們還是安排這兩場在同一個週末舉辦？不可以分配到其他週來舉辦嗎？
黃偉哲市長,謝謝議員，你給我們很好、很寶貴的建議，其實您沒有提到的部分，還包括海安路那邊，雖然那邊不是您的選區，那邊還有設計展、萬神節、萬聖趴及商圈封路的活動，整個地方也都讓我們南來北往的民眾，還有當地的民眾事實上感受到進出交通的不便，結論就是我們還是需要去分散這些地方，第一個時間上的分散，第二個地點上的分散，你也提到包括之前的週末，還有在溪北，當天一天中就有40個活動，所以我們盡量記取這個教訓，把時間跟地點疏散，避免過度集中在單一地區，造成民眾的不便。
周麗津議員,因為過往以來我們安平辦活動就真的都是人山人海，車多人也多，我也有看到報導，這個美樂蒂與酷洛米的活動是在10月5日，交通局是在10月12日才試辦接駁車，為什麼你們會在活動之後才試辦接駁車？我們安平辦了那麼多場的活動，你們為什麼不事先就有這個規劃呢？
交通局王銘德局長,報告議座，就是在事前協調的時候沒有提出這個需求，就是因為第一天的開幕活動。
周麗津議員,你是說誰沒有提出這個需求呢？我覺得這個需求是要由交通局你們自己來提出？
交通局王銘德局長,跟議座報告，市府內主要是主辦活動的單位來研擬所有的交通規劃，交通局是從旁來協助，比如說開接駁車，或者是協助周邊的這個交通管制，不過經過這幾次的活動，府城都有指示，就是未來要跨局處的來協調，不管是舉辦的時間或地點，因為各個活動所需要的管制跟申請單位並不全部都在交通局，交通局是在協助的過程當中，會被邀請去協助檢視周邊的交通衝擊，跟有沒有需要其他管制跟接駁車的幫忙，我想這部分，府城已經有指示了，我們以後會來做跨局處的協調。
周麗津議員,希望說我們跨局處的協調溝通可以融合成一體，不要各個單位就各自為政，我們臺南市政府是一體的，麻煩，拜託一下局長，這個部分要注意一下。
交通局王銘德局長,好。
周麗津議員,"下一個議題是綠鬣蜥，綠鬣蜥對臺灣原生環境是場災難，目前屏東已如「侏儸紀公園」，臺南市是不是也失控了呢？一開始是在臺南市南區的灣裡出現，可是我有看到媒體報導，今年9月份在永康祥和公園也出現了，而且出現的不是小型的綠鬣蜥，是已經長到50公分大的綠鬣蜥，50公分的綠鬣蜥算是巨大的綠鬣蜥，連東區的巴克禮公園也都有了，綠鬣蜥捕捉達人J爸上傳了一部「臺南綠鬣蜥GPS熱點大公開」影片，我們來看一下（按影片-不敢講的東西是什麼？也沒有政府願意去承認，臺綠鬣蜥已經失控，由清零轉為移除，控制數量，有沒有人勇敢站出來的說，各位我們的綠鬣蜥已經失控了，大家不願意去承認這樣子的東西，但我們可以透過今天的影片，讓你們可以理解，在臺南我們花了4年的時間，到底找到了什麼？我們第一站，你看這邊就是市區了，有沒有？這裡是我們的亞洲餐旅學校，亞洲餐旅學校以前應該是叫六信吧？我印象中是這樣子，我們現在畫面轉過來，它的旁邊這邊以前原本是可以下去的，但是現在這邊已經封起來了，所以這裡全部就變成了綠鬣蜥一個非常好的生態繁衍地方，下面的地方再過去是有河流的，你看這裡夏天時比較濕，有沒有？在過去其實是有一個不是河流，就是他們的大排水溝，從這裡看過去，你就可以發現到有滿多綠鬣蜥趴在上面，你現在看不到對不對？我跟你講，你們沒有練過，你去看一些不管是彈弓的或者是專門在抓的，他們的眼睛，其實有在抓綠鬣蜥的都看得出來，到底是發生什麼事情，我們今天就準備了這個，讓大家看看，實際上它的這個距離到底是多麼遠，然後有多麼的大隻，存活在什麼地方，從這裡看過去，真的有一隻綠鬣蜥趴在這裡，這個位置）好，影片就停在這邊。其實從影片裡，我們可以了解到外來種的綠鬣蜥族群數急速擴散，臺南市各公園已經都相繼淪陷，包括在南區的部分，亞洲餐旅的對面就是哈赫拿爾森林，市長，哈赫拿爾森林公園有沒有可能會變成綠鬣蜥生態公園？據農業局的統計至2024年9月18日止臺南市已捕捉近1萬7,000多隻的綠鬣蜥，比去年8,000多隻的紀錄已經成長了兩倍以上，最令人震驚的是即將正式開放的哈赫拿爾森林公園，已有民眾捕捉到綠鬣蜥，所以我真的很不希望綠鬣蜥一直在擴散，直到哈赫拿爾森林公園變成綠鬣蜥生態公園，我們再解決，其實這個生態已經造成臺南市很大的困擾了，之前也有詢問過農業局，你們的方案是要建議中央在同一時段大量捕捉，才能有效抑制族群的擴散。"
農業局陳仲杰代理局長,"跟議座報告，綠鬣蜥氾濫已經變成全國性問題，我們也多次跟農業部林業署建議，應該是正視並全面性的來整體移除，至113年在9月17前，臺南市已捕抓了1萬7,000多隻，當時經費已經用盡，但我們並沒有停止移除的工作，我們農業局的獵龍大隊，只要有接到民眾跟1999反映，都會立即派人出去處理，到現在我們自己又抓了123隻，現在剛好是綠鬣蜥繁殖期，感謝市長特別動用二備金100萬，讓我們能做後續全面性的移除工作，目前的進度是請專人跑行政程序預計星期三就可上網招標，希望在繁殖期內能夠遏止牠的再次蔓延。"
周麗津議員,真的不希望哈赫拿爾森林公園成了綠鬣蜥生態公園，麻煩局長在綠鬣蜥的部分要加緊移除。
黃偉哲市長,議員講得很對，綠鬣蜥為什麼會這樣氾濫？就是有人當初把牠當寵物養一養，不想養又把牠放生，造成生態浩劫，所以我覺得其實當初進口的這些，十年前、二十年前都不會成為一個問題，但為什麼現在問題出來了？就是有人偷偷養，舉一反三，我們還有哪些動物，將來可能會變成生態浩劫的？過去的這個八哥、過去的一些鳥，現在也都把我們本土種的族群消滅殆盡，還有魚虎，因此我覺得除了全國性的問題之外，我們地方政府努力在花這些錢，其實這些錢都是民脂民膏，我覺得滿可惜的，只是我是覺得剛剛那個達人他自己一邊抓在賺錢，然後一邊又在罵我們，我們會努力，但畢竟生態的控制是全國性的。
周麗津議員,這個影片是要讓市府知道臺南市的綠鬣蜥真的很多，所以我們一定要多多注意。
黃偉哲市長,是。
周麗津議員,其實哈赫拿爾森林公園還有另外一個問題在，市長，你有沒有看到你的FB關於哈赫拿爾森林公園貼文的下面有一些民眾的留言？其實裡面的留言有很多講到的都是浪浪的問題，這些浪浪的叫聲真的是非常嚇人，我白天也有去，晚上我走不進去。
黃偉哲市長,晚上走不進去？
周麗津議員,我走不進去，為什麼？我們先讓看一下這段影片，這是我去拍的，你看這個浪浪的聲音多恐怖，這是白天，那一天晚上跑完行程後，我經過公園時，想要走進去，我看到門口就有五、六隻浪浪，我還是勇敢的走下去，可是我走下去之後，看到狗已經往裡面走了，你看一下，這是當時的狀況，行人道上面是兩排燈，裡面很暗，我走不到10公尺就真的沒辦法走下去，因為我用手機拉遠就看到有兩隻浪浪在裡邊，雖然我很勇敢的想要繼續走，但浪浪已經在叫了，我真的走不進去，我很怕，也不敢跑，怕浪浪追上來，所以我就慢慢的走出來了，我想跟市長反映，哈赫拿爾森林公園內的浪浪真的很多，而且公園的環境太暗，晚上讓人家不敢走進去。
農業局陳仲杰代理局長,跟議座說明一下，報告議座，以前公園未開發完成前，當時的浪浪可能有上百隻，現在我們結合了當地的一些志工朋友，現在那邊圈養的約有三、四十隻，由我們的志工朋友在那邊管理，讓牠們不到外面來，另外那一邊有五、六隻，我們除了設置獵捕籠以外，也隨時都有人在那邊巡查，希望結合當地的志工能夠儘快捕獲。
周麗津議員,何時設置的？
農業局陳仲杰代理局長,已經都有在現場了。
周麗津議員,可是我上個禮拜白天有去，晚上只是走不進去而已，我沒有看到？
農業局陳仲杰代理局長,我再給議座地點，昨天下午我們周處長有親自到現場去，在那邊又觀察了約20幾分鐘，同時也跟志工朋友再次的強調說，希望他們協助，我們把在太陽能板下面活動的五、六隻都抓起來，因為那一邊很寬，要抓的時候容易被逃脫，希望志工能協助把這幾隻抓起來，納入我們的暫時管理所。
周麗津議員,這是你們的專業，所以麻煩局長要加快。
農業局陳仲杰代理局長,好，謝謝。
黃偉哲市長,謝謝，這個哈赫拿爾森林公園，人、綠鬣蜥、浪浪只能有一個存在，就是人了，剛剛議員提到我們有一些影響民眾市民朋友安全的這個部分，還有公園為什麼會比較暗？可能是當初有一些生態學者認為不宜裝設路燈，可是我覺得還是市民朋友們的安全最重要，所以該裝路燈、該裝監視器的、該維護市民朋友安全的、該定期巡邏的，我們都要去做。
周麗津議員,市長，因為哈赫拿爾森林公園是市區保留下來珍貴的自然樹林，大家都很希望走進去裡面，裡面的環境，我要跟你說，真的是不錯，好的，我也會稱讚你們，不好的，我們希望拿出來討論，探索這個森林秘境是為了我們的市民可以走出來，因為現場的水岸環境真的是改造的不錯，我也要跟水利局說一聲謝謝你們，感謝你們，我們的水質真的有改善了，希望能越來越好。
水利局邱忠川局長,謝謝議座。
周麗津議員,我也我希望綠鬣蜥跟浪浪問題能解決。
黃偉哲市長,就是不能讓綠鬣蜥跟浪浪占領哈赫拿爾森林公園。
周麗津議員,對，針對綠鬣蜥跟浪浪的部分，希望市府團隊能儘快來解決這個問題。接下來我想要來講公墓綠籬，其實南山公墓的綠色籬笆改造是在賴清德總統的年代就已經開始推動了，效果真的很好，我也知道安平第一公墓，最近殯葬管理所也有提出方案，我也覺得不錯，我很贊成，因為綠色的籬笆可以改善整體的環境，也兼顧到通行的需求，讓外來客覺得看到公墓沒有那麼的可怕，所以我也挑了幾種，可是決定權還是在市府，我想跟局長、市長討論一下，我們喜樹的公墓什麼都沒有，只有鐵欄杆，所以我要跟市長、局長拜託，是不是可以在喜樹公墓加裝綠籬？
民政局姜淋煌局長,沒問題，安平的部分也是由市府提出來，然後里長跟議員大家共同決定使用哪一種方式看起來會比較美化，議員提到的喜樹公墓部分，因為差不多有7公頃左右，我們找個時間去會勘臨路的部分，之後再看要用什麼方式來美化，讓地方看起來比較不會那麼突兀，這個部分我們民政局這邊來努力。
周麗津議員,好，謝謝局長，這個真的一定要做，局長看一下，現場這是已經處理好的環境，但是你們處理好了，又有人去丟，而且我覺得有一些是事業廢棄物，我有通報，你們也處理了，我怕這情形不斷反覆，造成市府的困擾、造成民政局的困擾，也造成環保局的困擾，所以這個部分就如局長講的，拜託，請加速來幫我們辦理，讓這些環境可以美化。
民政局姜淋煌局長,沒問題，這可以讓街景整體看起來更整齊，我們會馬上來進行公墓周邊的綠籬部分。
周麗津議員,好，謝謝局長。接下來，我們看一下，這是喜樹公墓旁的裝置藝術，市長，你覺得這個裝置藝術怎麼樣？
黃偉哲市長,有改善的空間。
周麗津議員,有改善的空間，其實市民也在問我這是什麼，我就說這是臺南市政府做的裝置藝術，為什麼我們喜樹的裝置藝術是這個樣子呢？是用水管做的呢？而且也沒有燈，什麼都沒有，我希望市府多用點心，我在臺南400有看到很多裝置藝術，真的很不錯，我也截了一些圖，這是臺南400地景藝術節，結合在地文化與現代藝術設計的特色而打造的藝術裝置，市長，我們可不可以邀請藝術家來我們喜樹的小漁村幫我們做一個裝置藝術在我們的門面呢？
黃偉哲市長,我很願意，就是說你剛剛看到的這些裝置藝術，有在鹽水也有在麻豆的，事實上我們都願意去做，希望喜樹這邊也能有像這種規格的，而不是看起來很粗糙的。
周麗津議員,對，那個真的很誇張，局長，你覺得那個漂亮嗎？
民政局姜淋煌局長,他這個設計有什麼意義？我實在看不懂。
周麗津議員,要問你們，你們都不知道了，我怎麼會知道？
民政局姜淋煌局長,不是，我們會後再到現地去會勘一下，因為喜樹、灣裡最近也發展的很快，所以要怎麼做公墓綠籬跟裝置藝術才能讓地方看起來比較有整體性，我們會再來努力，會勘之後，我們再做個研議，再來討論，好不好？
周麗津議員,好，謝謝局長。接下來，酒駕零容忍是我們一直喊的口號，近年來我們的酒駕相關罰則已經多次的修法加重了，針對酒駕的累犯，交通事件裁決所定期公告累犯的名單，而且還有公布照片，希望能藉此達到嚇阻的效果，但是民眾又有誰會特地向政府的官網去查閱這些名單呢？到今年9月份，臺南市已經公布了38批的酒駕累犯的名單，短短2年多就有489個人，以7月24日公布的第37批名單為例，其中有20名累犯中，10年酒駕3次以上，就有10個人了，所以以現在實施的罰則，對這些酒駕的累犯毫無震懾作用，無法有效的嚇阻，這是全國A30類酒後駕車交通事故之受傷人數的增減率統計表，看一下，今年1到7月份，全國的部分是降了10.8％，但是在臺南市相同的期間內，酒後駕車事故受傷人數不減反增，高達了13.1％，這樣的落差，市長，你懂我的意思嗎？全國都已經往下了，臺南市竟然增加。
黃偉哲市長,可以看到六都只有新北增加，但是新北增加也增加的比我們少，臺北減了31％、桃園減了24％、臺中減了17％，我們增加了13％。
周麗津議員,增加了13.1％。
黃偉哲市長,這是滿糟糕的，雖然還沒有造成很嚴重人命損失，但是受傷人數增加這麼多，這是無法接受的，所以我們會再加強，就是說蘿蔔跟棍子都要，所以你剛剛講說公告放在我們的網站，他覺得沒什麼，我們就想辦法再讓更多人看到。
周麗津議員,市長，你也了解我的意思，這些酒駕違法的行為，真的如市長所講，造成自己本身或他人的生命危險，所以針對目前的宣導方式已經過於被動，我建議將累犯3次以上的酒駕和照片公布在當事人居住的鄰里公布欄，來加強震懾的效果，利用人性愛面子的羞恥心理，讓酒駕累犯可以自我約束，就是等於說放在他們里的公布欄，讓家人、鄰居看到他在喝酒就提醒他，不然你放在市政府的網站，有誰可以知道呢？
黃偉哲市長,對，沒有錯。
周麗津議員,市長，這樣可以嗎？
