speaker,content
民政局姜淋煌局長,報告市長，安南區公所有向農會借用土地，後面停車……
黃麗招議員,現在因為在做結構補強，所以才向農會借用，農會那邊也是我帶區長去談的。
民政局姜淋煌局長,是，感謝。
黃麗招議員,未來那片土地那麼大片，後面停車位那麼方便，都可以開發；然後這裡是商業區，將來看是要興建什麼，可以興建好幾層樓，要辦公用還是要做什麼，都很方便，這部分第4屆 第2次定期會 市政總質詢  309我希望市長能有個明確的決定。
黃麗招議員,"再來談鹿耳門溪的部分。上個會期，我在此向水利局及市長反映鹿耳門溪的問題，市長也在議會向我承諾5,000 萬元的束流工，若向中央爭取不到經費的話，黃市長你有承諾這筆預算由市府編列。邱局長，目前向中央爭取束流工的預算有明確的成果嗎？"
水利局邱忠川局長,向議員報告，鹿耳門溪整治自108 年開始，我們就委託成功大學做研究，研究結果顯示，最好的工法就束流工法，不建議用土堤或導流工，這樣反而會在出海口處淤積。
黃麗招議員,你不建議在此做導流工。我自第16 屆擔任議員就一直在關心此處，我們農業局每年都編列預算在此清淤，每年都一樣，清了也沒用。有關束流工，中央給我們的回覆為何？
水利局邱忠川局長,我們已經提報水利署，水利署是這樣建議；他們說這與水環境不是那麼切合，所以我們會再重新提報。
黃麗招議員,你再提報上去的是經過修正的，還是有更好的施作辦法？
水利局邱忠川局長,內容不會變，只是科目不同，我們用水岸權就可以了。
黃麗招議員,是修改裡面的一些……
水利局邱忠川局長,是預算科目不一樣。
黃麗招議員,你送的預算科目不一樣，所以他們退回。
水利局邱忠川局長,對，主要是預算科目不同，束流工是不會變的。
黃麗招議員,還是一樣做束流工程？
水利局邱忠川局長,對，他們是尊重我們。
黃麗招議員,所以你們只是修改裡面的內容而已？
水利局邱忠川局長,內容不改，只改裡面的科目。
黃麗招議員,那這筆預算原則上是沒有問題了？
水利局邱忠川局長,是，我們有向水利署建議，他們說再報上去他們就會同意。
黃麗招議員,好，那這部分也不用再浪費那麼多錢了，澈底解決鹿耳門溪出海口的問題，這些經第4屆 第2次定期會 市政總質詢  31費可以不用編了，你看都花了多少錢。
水利局邱忠川局長,可以減少泥沙淤積。
黃麗招議員,對，減少淤積，不會每年都發生同樣的問題。我希望這筆經費能儘快到位，好不好？
黃麗招議員,邱局長，你是這方面的專家，我一向很肯定你，也要再次拜託你，請你加把勁，好不好？
水利局邱忠川局長,是，我們會再向水利署極力爭取。
黃麗招議員,好。我相信局長很清楚，海岸線一直被海水沖刷退縮，造成國土嚴重流失。海岸線退縮的問題，我相信不只臺南市發生，臺灣的海岸線可能都有此問題，以我目前的身分，我只能在此提建議。邱局長，針對海岸線退縮、國土嚴重流失的問題，你前往中央開會時，是否該提出反映，這部分還是要想辦法澈底解決。
水利局邱忠川局長,向議員報告，這部分我們與五河局、六河局都有密切聯繫，甚至在9 月15 日辦理會勘，針對整個海岸線的退縮，較為嚴重的部分，我們已經請五河局、六河局優先辦理。
水利局邱忠川局長,從八掌溪到二仁溪，整條海岸線長約69.6 公里，依「臺南市一級海岸防護計畫」，這部分屬於中央五河局、六河局管轄；還有一部分是屬於台江國家公園管理處，這部分我們在9 月15 日召開過三方會議，也會趕快來做。尤其六河局現在正在檢討臺南市的海岸防治計畫，我們已經向六河局建議，是否該施設離岸堤或突堤，而六河局也釋出善意，最近他們就會有定案出來。
黃麗招議員,原則上還是要澈底解決。
水利局邱忠川局長,是的。
黃麗招議員,也希望局長繼續關心、續續幫忙爭取。
水利局邱忠川局長,是的，謝謝議員指教。
黃麗招議員,你請坐，謝謝。接著討論野狗的問題，照片中這些都是流浪狗，牠們流浪在這附近，會挖掘魚塭堤岸，甚至挖到堤岸崩塌；牠們沒有居住的地方，會在路上追逐行人、機車和汽車，甚至襲人。我在這裡要為狗狗發聲，今天早上，我請動保處及林志英里長去尋找能收留狗狗的地方。
農業局李建裕局長,暫置區。
黃麗招議員,對，暫置區。我希望安南區的野狗、流浪狗及愛媽餵養的部分，能有較妥善的處理。
黃麗招議員,車子在路上行駛，看到的流浪狗都是成群的，這部分我曾請動保處去抓捕；捕抓後結紮第4屆 第2次定期會 市政總質詢  31完又放回去，後續還是一樣，過幾天又是如此。所以這部分我們是否該加把勁，趕快在安南區找一塊地，收留這些狗狗，我不知道其他區如何，我針對的是安南區，要趕快讓這些流浪狗有地方收容及管理。局長，你是不是該特別努力？
農業局李建裕局長,有，向議員報告，其實安南區的狗，我們去年已經捕抓超過600 隻，今年截至9 月為止，也已經捕抓超過400 隻。
黃麗招議員,但你抓回去後，需要結紮的結紮了，需要處理的處理了，最後還是又放回去。
農業局李建裕局長,我們現在也有想到解決的辦法；臺灣實施TNVR 後，不能做安寧處理，所以狗的數量愈來愈多，臺南市與高雄市交界處的流浪狗，有的也會跑到我們這邊來，所以我們現在以暫置區的方式辦理，若各區能找到地方設置暫置區，我們的經費、飼料等都準備好，與愛爸、愛媽配合，大家共同來面對、解決這個問題。如同議員所說，今天也去尋找有無適當的收留地方，我們要趕快來設置暫置區，才有辦法解決目前的困難。
黃麗招議員,你看這整個魚塭堤岸都崩塌，魚都跑光光了，漁民的損失誰來賠償？他們也是很無奈。可以將魚塭堤岸挖到崩塌也很不簡單，當然這挖到最後會整個都崩塌，才過一夜就崩塌了，這真的不得了。另外，追逐機車和襲人的部分，多少人因此受傷或喪命，你們是否能再積極一點，趕快去找地方來解決這個問題。
農業局李建裕局長,這是生命安全問題，我們一定會積極來辦理，感謝議員再次提醒我們。
黃麗招議員,好，這部分我再拜託你。
農業局李建裕局長,這是應該做的工作。
黃麗招議員,這件事是很可怕的，幾隻流浪狗有辦法在那裡挖到整個魚塭堤岸都崩塌，也很不簡單，我希望安南區的狗狗暫置區能趕快處理好。請農業局也透過里長幫我們尋找理想的地方，其實應該也可以往焚化爐附近尋找，我聽說當地的里長有意見，其實那個地方都沒有人居住，為什麼不能？
農業局李建裕局長,那裡早期我們有去看過，有一些是城西焚化爐要改善的空間；有一些是保安林，林務署那邊有些意見。其實很多地方我們都積極尋找過，但有時候因為地方上有些聲音，造成後面無法繼續，所以在此也向各位里長和民眾呼籲，我們不會找一個位於住宅區旁的地點來設暫置區，但這是大家要共同面對，早晚都要解決的問題。
黃麗招議員,講個笑話；有個里長反映說他被狗追，他回去拿棍子反追，結果被開了1 張罰單，被你們開了1 張罰單。
農業局李建裕局長,第4屆 第2次定期會 市政總質詢  31這應該是有人檢舉。
黃麗招議員,所以他也是很無奈，那天才說出這件事。
農業局李建裕局長,這應該是有人檢舉。
黃麗招議員,所以這問題要趕快解決。
農業局李建裕局長,我們積極來辦理，感謝議員。
黃麗招議員,謝謝，請坐。市長，我已經說得差不多了，但我在此要感謝你……
黃偉哲市長,等你這句感謝等很久。
黃麗招議員,我不是已經講了嗎？安南區長安里活動中心重建案，因為去年原物料……
黃偉哲市長,上漲。
黃麗招議員,"原物料上漲，所以今年有追加2,000 多萬元的預算，也感謝你讓不足的部分到位，可以把活動中心一次性完成，在此特別感謝你，這是第2 句了，感謝你。"
黃偉哲市長,應該要做的，謝謝。
黃麗招議員,感謝你，第3 句了，這樣有收到嗎？
黃偉哲市長,有。
黃麗招議員,你請坐，謝謝。今天我的質詢就到此結束，謝謝黃市長帶領的市府一級主管及團隊，還有感謝電視機前臺南市民的收看、新聞媒體記者及臺南市議會的同仁，謝謝主席，謝謝。
主席王家貞議員,謝謝黃麗招議員的市政總質詢，我們休息到11 時30 分。
主席王家貞議員,向大會報告，在請陳秋萍議員質詢之前，我們先以熱烈的掌聲，歡迎日本藤枝市議會訪問團前來拜會臺南市議會。謝謝邱莉莉議長、林志展副議長，以及議會同事一起陪同。歡迎日本藤枝市役所的議長、議員們及各部會的局長、幹事們來參訪，謝謝你們，歡迎各位。接下來我們把時間還給市政總質詢，請陳秋萍議員，時間50 分鐘，請。
陳秋萍議員,感謝主席還有秘書長，以及市府團隊黃偉哲市長、方秘書長、各局處室主管、新聞第4屆 第2次定期會 市政總質詢  31媒體先進、議會同仁及電視機前的市民好朋友們，大家好。今天是秋萍第4 屆第2 次定期會的市政總質詢。市長，上個會期我與你探討過西灣里滯洪池雜草叢生，我們要趕快改造整個水資源環境的議題，你也很爽快，沒有絲毫的……
黃偉哲市長,其實那個地方很好，因為那時候還沒下雨，所以要趁乾旱的時候趕快去做。
陳秋萍議員,雨季很短，所以乾的時間比較久，我要求你設置水資源公園，你也快速不加思索地答應了。在此，我肯定你，感謝市長對永康人的用心。我一開頭就誇獎你了，不用等很久。大家都有看到我將要質詢的內容，水利局局長，你接到市長的指示後，以最快的速度與本席接觸，探討未來對整個水資源環境的改造；如何治水、防水、利水、活水，達到最大效益。還有，人與水的串聯是永續的目標，希望我們都能朝此方向去走。
陳秋萍議員,我們用最快的速度探討出了三個方向；一是改善池底鋪面，同時能減少雜草叢生；二為增加多元化利用空間，注入遊憩休閒場域；第三則是加強亮點特色，結合街頭藝術景點及亮點意象。這是你們給本席的規劃，這些規劃確實不錯，我看到有池底的籃球場及兒童遊戲區，此外，街頭廣場的亮點意象，這類藝術裝置的部分，屬於你們的還是工務局的？
水利局邱川局長,我們會將池底的部分做好，這部分已經開始在規劃設計中，包括下面3 座籃球場及兒童遊戲區在內……
陳秋萍議員,是，還有滑板車道。
水利局邱忠川局長,對，最重要的是池底……
陳秋萍議員,好，就是這些。我覺得還需要再注入一些活潑的元素，本席建議在地景設施部分，可以使用的就不要浪費，可利用地形、地貌來打造，比如溜滑梯，可以打造磨石子或滾輪的溜滑梯，都是色彩活潑、亮麗豐富的。還有攀爬設施，我們可廢物再利用，利用再生能源做攀爬的遊具，你覺得呢？
水利局邱忠川局長,非常好，我們目前就是往這方向正在做。
陳秋萍議員,好，我們就往這方向去做。請問局長，我們這邊是不是少了些什麼？
水利局邱忠川局長,"現在講的是經費的部分，初估起來約需3,500 萬元左右，因為目前還未設計出來，設計出來之後我們再來……"
陳秋萍議員,"大約是3,000 多萬元？"
水利局邱忠川局長,"3,500 萬元左右。"
水利局邱忠川局長,第4屆 第2次定期會 市政總質詢  31陳議員秋萍：
水利局邱忠川局長,那什麼時候可以開始動工？我想知道期程，因為我們永康市民也非常期待。
水利局邱忠川局長,我們要先把預算書做出來。
陳秋萍議員,好，預算問你沒有用。市長，你覺得呢？
黃偉哲市長,謝謝陳議員。西灣里滯洪池周邊的使用，貴區各位議員先進都有不同意見，有人說要在滑輪溜冰場後面那塊空地，有人說要在……但我們經費只能在同一次。
陳秋萍議員,好，市長，等一下我會和你探討這部分。你經費才要挹注一次，這一次是滯洪池底還是含有公園的部分？沒關係，我再與你探討。
黃偉哲市長,這我們要思考。
陳秋萍議員,市長，有少東西，少了什麼？確實這東西的必要性非常高。市長剛才說到的滯洪池，北側緊鄰著溜冰場、消防分隊，後面則有一塊公園，這塊公園也是我們永康區議員都非常關心的，現在是不是要打造特色公園？若結合滯洪池是更加完美的，你現在說是一次性的經費而已……
黃偉哲市長,我是怕會重複。
陳秋萍議員,不會，設置上是可以避開的，還有停車空間不足的問題，根本沒有停車空間，永大路、公園路，那次我們去參加……
黃偉哲市長,您這樣說停車場的話，我覺得我們可以補足、互補，如果只是特色遊具的話就排除。
陳秋萍議員,市長，那次參加溜冰場啓用典禮，我們才少少的人，到那裡後車子都沒地方停了，所以停車空間勢必是非常重要的。回到上面的經費問題，你什麼時候要編列經費？
黃偉哲市長,經費的編列與設計相關聯，要設計好才有經費。
陳秋萍議員,最起碼規劃費要先進去，還是這種的不用規劃費？
黃偉哲市長,對，規劃費我們要先……
陳秋萍議員,規劃費什麼時候要進去？
黃偉哲市長,越快越好。
黃偉哲市長,第4屆 第2次定期會 市政總質詢  31陳議員秋萍：
黃偉哲市長,越快是什麼時候？我是覺得當下就要編列下去。
黃偉哲市長,當下？
陳秋萍議員,對，當下。
黃偉哲市長,我要先盤點二備金還有沒有剩，因為今年防疫用蠻多二備金的。
陳秋萍議員,所以要用第二預備金？
黃偉哲市長,對。
陳秋萍議員,如果沒有二備金的話就是明年初？
黃偉哲市長,如果今年的二備金沒有了，就用明年的二備金。
陳秋萍議員,明年初，好不好？就這麼處理，永康市民們都很期待，大家都聽到了。邱局長，再次給予你肯定，對你的辦事速度予以誇獎，每個公部門的人員，都應該像你這般積極，你請坐。
水利局邱忠川局長,謝謝議員。
陳秋萍議員,市長，我剛才有告訴你要未雨綢繆、超前部署，這個停車場非常重要，你也說非常重要。我希望各局處若在規劃設計任何案子，都必須把停車問題也考慮進去，不要建設成為一個亮點之後，人潮來了卻沒有停車空間，後面要再解決就太慢了，民眾若罵是罵誰？市長，罵是罵你。所以各局處下次有規劃案時，要先把停車空間考量進去。
陳秋萍議員,"市長，埔園里和大灣里的活動中心，為什麼我還要再講一次埔園里？因為你已經答應我。去年我與局長都有去看了地點，市長也曾參加過埔園里辦公處所舉辦的活動，他們每一場親子活動或是里民活動都非常大型，都是1,000 多人或2,000 多人的規模。姜局長，你也去過，也了解吧？"
民政局姜淋煌局長,是。
陳秋萍議員,他們沒有活動中心，無法辦代間學習及親子課程，這是非常可惜的，每次都得去向別人租賃，這也成為里辦公處的負擔。那邊0.1 公頃可以興建的容積只有45%，建蔽率15%，等於只有45 坪而已，勢必不夠。我想請教都發局局長，這塊公保解編的公園用地，能否變更為機關用地？
都市發展局徐中強局長,第4屆 第2次定期會 市政總質詢  31這是公設專案通盤檢討，若在重劃財務可行的情況下我們願意，因為現在案子都剛好報到內政部，正在審議中，還來不及……
陳秋萍議員,對，正審議中，若可以的話，我們可以變更為機關用地，是否能夠趕快補件上去？
都市發展局徐中強局長,對，我們把這些資料補上去，然後趕快來……
陳秋萍議員,再不行的話，市長，我在永康區中山路與自強路口，也就是埔園里的中心點，找到一塊綠地，因為機關用地的建蔽率……
黃偉哲市長,那是公有地嗎？
陳秋萍議員,對，它的建蔽率可以到60%，那邊面積有0.04 公頃，可以蓋地坪70 幾坪，若能用這塊綠地來變更，又能保有公兒用地，我覺得這是兩全其美。因為是綠地，所以可以變更為機關用地，它的建蔽率及容積率就可以較高，地坪可以蓋70 幾坪，72、73 坪，市長你覺得呢？
黃偉哲市長,我願意保持可能性，兩個都可以，但是要快點決定，因為越慢蓋就越貴。
陳秋萍議員,那我們就用這塊綠地，又能保有……
黃偉哲市長,給我一點時間評估好不好？
陳秋萍議員,評估多久時間？
黃偉哲市長,評估到年底以前。
陳秋萍議員,年底以前？
黃偉哲市長,年底以前決定，然後開始規劃。
陳秋萍議員,年底以前公保解編……
黃偉哲市長,如果二備金還有剩，規劃費就留下來；如果沒有剩的話，明年1 月1 日規劃費就直接……
陳秋萍議員,直接投進去，好，謝謝市長。
民政局姜淋煌局長,我向議員報告，我會請永康區公所儘速評估這兩塊地，看情形如何再向議員報告，第4屆 第2次定期會 市政總質詢  31我們會儘速來處理。
陳秋萍議員,OK，我們就年底，不然就是年初，其實也差不了多久。但我要強調的是，公保解編已經在內政部審議了，如果補件太慢我怕來不及，應該年初就會審議到我們永康區的部分了，局長，是不是這樣？
都市發展局徐中強局長,報告議員，時間上應該來得及。
陳秋萍議員,OK，市長，拜託速度上不要拖延。再來看一下我們大灣里活動中心用地，上個會期我也向市長講過，大灣六街這塊公兒用地有0.1 公頃，我這裡有大灣里500 多位里民的連署書，代表他們非常期待這座活動中心就蓋在大灣里，又是位於中心點，能方便老人家前往，不用再到別的里參加活動，到別的里真的不合理，這裡是最好的地點。它的面積也是0.1 公頃，可以興建的面積只有45 坪，也不大，是否可以變更為機關用地，再合併使用它後半部的0.03 公頃，總共差不多就有將近百坪土地，這都是公保解編可以彈性處理的土地，都發局局長，這樣可以嗎？
都市發展局徐中強局長,可以，我們會與地政局及民政局協商，財務可能要重新分析、調整，如果可行的話，也會儘快提送內政部做變更。
陳秋萍議員,市長，你覺得這樣可以嗎？
黃偉哲市長,應該都可以，只要不是需要另案徵收土地都可以。
陳秋萍議員,可以，所以變更為機關用地，合併在一起。
黃偉哲市長,我的原則是，用地取得不要再花錢徵收。
陳秋萍議員,就是合併在一起。市長，你要有一個概念，任何重劃都是要有本錢的重劃，你們花在一些道路、水溝的經費也一樣，只是我們用抵費地標售後拿回本錢，這樣你知道吧？
陳秋萍議員,所以我們就往這方向執行，好不好？
地政局陳淑美局長,向議員報告，若這個地方有公有土地，也可將其優先指配作為機關用地。
陳秋萍議員,公有土地，但是一定要能併在一起，就是變更為機關用地後要合併在一起，不然要怎麼興建？沒辦法興建。
地政局陳淑美局長,沒錯，要整體的規劃。
陳秋萍議員,市長，這也要在年底之前確定，因為要趕速度，你說只要土地不要再另外多花錢就第4屆 第2次定期會 市政總質詢  31OK，你也允諾了，會後我會將這500 多份大灣里里民的連署書轉交給你。
黃偉哲市長,議員，你要不要現在拿給我？記者在那裡等。
陳秋萍議員,好。
陳秋萍議員,永康全民運動館又停擺了。陳局長，你也知道我要講這個議題，為什麼又停擺了？
陳秋萍議員,從2021 年5 月14 日市長承諾要興建，到目前為止，我所看到只是1 張A4 紙，1 張平面的紙。你都知道我要問這個問題，我也一直很關心，你還是只有1 張紙。上個會期6 月9 日那天，市長還承諾要加碼，你有規劃了嗎？
體育局陳良乾局長,有，現在已經在做細部設計了。
陳秋萍議員,好，你都說你已經規劃了，為什麼我又再拿出來說，因為我一定要為永康市民追蹤；到底什麼時候發包？什麼時候動工？你本來說今年年底要動工，現在卻還沒有。
陳秋萍議員,陳局長，我知道你辦全運會很辛苦，我遇到你時，也跟你說要加油，如果人手不夠就向市長要人，不然我們替你向市長要人。人員編制不足時就去討要人力，不是做東漏西，全部漏掉或停擺，你就只能辦一件事情而已，在公部門做事不是這樣的。
體育局陳良乾局長,明年1 月1 日，市長已經答應讓我們增加人力了。
陳秋萍議員,照理說，我今天應該很惱怒，因為我在你們工作報告時也問過這個問題，你跟我說已經在發包了，不要以為我什麼都不懂，傻傻的，你說已經發包，建築圖在哪裡？
體育局陳良乾局長,12 月底就會完成細部設計。
陳秋萍議員,你那時候都跟我說已經完成也發包了；發包，就是可以準備動工，結果現在還無法動工。市長曾發過新聞稿說後年就要完工，那是全民的運動場域，我們所有永康市民都非常期待。這1 億元的經費，你到底如何規劃，最起碼要讓我了解。雖然你沒來服務處，但你一樣可以將資料交給我，卻都沒有。我想請教研考會，今天主委不在由專委代替回答，議員質詢的內容及市長所承諾的事項，你們到底有沒有列管？
陳秋萍議員,研究發展考核委員會王專門委員珠環：
陳秋萍議員,報告議員，市長的承諾案件我們都有列管，議員非常關心的永康國民運動中心發展案，我們都有列管。最近這次，體育局在回應方面可能有點疏漏。
陳秋萍議員,有沒有追蹤？這本來你們就得去追蹤，才知道體育局對於議員提案及爭取的事項有沒有結論。你們要追蹤才知道，以後要注意，知道嗎？
陳秋萍議員,研究發展考核委員會王專門委員珠環：
陳秋萍議員,是。
陳秋萍議員,第4屆 第2次定期會 市政總質詢  31陳議員秋萍：
陳秋萍議員,好，你請坐。
體育局陳良乾局長,報告議員，體育局會加緊腳步。
陳秋萍議員,你要如何給我承諾？何時要動工？
體育局陳良乾局長,預定12 月底完成細部設計，明年3 月之前招標，然後動工，這是我們的進度。
陳秋萍議員,這是你的進度，希望一切都很順遂。我想請教你，要讓一切都很順遂的話，整個規劃要非常完善，是不是這樣？
體育局陳良乾局長,對。
陳秋萍議員,你要做OT 案，也要有廠商來投標；不管做什麼標案，只要有完善的規劃、足夠的經費挹注，廠商就會有興趣。你們這些部分都周全了嗎？你一直這麼說，我也告訴過你，不要講一講都在空中飛「有有有，我們要招標了……」，問題是若規劃不好，建商不來投標呢？我跟你說過，1 億元經費與2 億元經費的設計，是非常不同的。
體育局陳良乾局長,對，所以我們規劃在第二期時增加羽球館的部分。
陳秋萍議員,好，局長，球場要多元化，羽球館本來就一定要放進去了，還有排球、籃球及桌球是不是？遊戲區等一下再講，這是在講場館內，還有，韻律部分也很重要，比如你們設計了溜冰場，我覺得很好，一定要保留。說明會時，你要好好地向地方民眾說明清楚。
體育局陳良乾局長,是。
陳秋萍議員,場館外，加碼的1 億元以外，就是特色共融公園，你要怎麼規劃？比例是多少？
體育局陳良乾局長,那裡有500 多坪，我們會依經費規劃來做設計，如剛才提到的排球場、籃球場、韻律教室及多元羽球館等。
陳秋萍議員,我說的你都要放進去，都是必備的場館；也不算是本席說要放進去的，這些項目本來就屬於全民運動館的必備條件，是不是這樣？
體育局陳良乾局長,對。
