speaker,content
施余興望Tjakumay Tagaw 議員,其他各縣市的社福卡發放日期比我們早，發放點數也比我們早，人家的系統都沒有問題，我們的系統問題特別多。
社會局盧禹璁局長,它們當初在做的過程當中也是……
施余興望Tjakumay Tagaw 議員,有沒有修改？你有沒有去問過？怎麼修改？你有沒有與各局處討論過？
社會局盧禹璁局長,有與其他縣市討論過並問過價格。
施余興望Tjakumay Tagaw 議員,因為時間不多，國民運動中心是最近才剛蓋好的，你在採購驗票機時候，你有沒有想過將來可能會用到老人福利卡？所以各局處間在做事情都沒有跨局處的協調、溝通，就先做，有問題再來說，是不是這樣？
社會局盧禹璁局長,第4屆 第3次定期會 市政總質詢 972沒有，做之前會先溝通，例如會先與體育局溝通好所需條件是什麼，再來做系統的架接。
施余興望Tjakumay Tagaw 議員,好，謝謝。時間不多，我要講原住民族聚會所，我想現在臺灣都市原住民人口持續攀升，現居住於都市地區的原住民族人口比例已經超過原原住民族的地區了，這是昨天的新聞，原民會的曾主委赴內政委員專案報告「都會區原住民族、客家族群、新住民權益保障措施與精進方案(113 年至116 年)」，將以四年10 億元打造都市地區原住民文化傳承的場域，這是昨天的新聞。主委，這是非常好的消息。
原住民族事務委員會白惠蘭主任委員,向議員報告，有爭取中央的經費。
施余興望Tjakumay Tagaw 議員,"它有規定該地區原住民人口要達到1,500 人以上且希望土地也是公家土地，土地是比較沒有問題，所以根據以上條件只有永康區人口是符合規定的。"
原住民族事務委員會白惠蘭主任委員,"是，要1,500 人。"
施余興望Tjakumay Tagaw 議員,而且永康及其周邊原住民人口加起來超過全市原住民人口數一半以上，最好的地點是永康砲校，所以要向市長爭取永康砲校遷移後的建築物……
主席蔡宗豪議員,謝謝施余興望議員，現在請謝舒凡議員，時間10 分鐘。
謝舒凡議員,非常感謝主席。黃偉哲市長，本席就教你一個問題，本席在市政總質詢時所提出的議題，市政府重不重視？
黃偉哲市長,會重視。
謝舒凡議員,會重視，會重視不就代表市長你會去要求權責局處去落實與民眾的溝通，並傾聽地方的聲音來安排會勘，進而達成共識。
黃偉哲市長,這是一定的。
謝舒凡議員,這是一定的嗎？
黃偉哲市長,要追蹤的部分，研考會把市長在議會中所做的答覆及議員的訴求來列管。
謝舒凡議員,你們會跟各局處問完之後給一個答覆，對不對？
黃偉哲市長,應該要這樣，理論要這樣。
謝舒凡議員,第4屆 第3次定期會 市政總質詢 973理論，應該也就是要這麼做。
黃偉哲市長,體制上要這樣做。
謝舒凡議員,體制上要這麼做。工務局局長，本席要就教你一個問題，之前在5 月29 日本席在市政總質詢時提出學甲多功能教育園區聯外道路要拓寬12 米，這件事情你非常的清楚？
工務局陳世仁局長,是。
謝舒凡議員,因為上屆我也問過你，去年進行會勘時，他回答我上層沒有交代，今年時你們回答我什麼？你們回答我說，議員你在5 月29 日的質詢非常重視，6 月6 日立即安排現勘。
謝舒凡議員,我就跟我同事說工務局不錯，這次要誇獎他們一下，6 月6 日就要安排會勘，但不好意思找遍了會勘紀錄，我本人也打電話到學甲公所農業及建設課詢問6 月6 日會勘是否有收到邀請？結果他們說也沒有，如果沒有的話請問你們是找誰會勘？你沒有會勘卻又回答我6 月6 日？
工務局陳世仁局長,向議員報告，這是找顧問公司去先做初步的現勘。
謝舒凡議員,好。局長，本席就教你，我知道你會這麼回覆我，可是在去年的時候就已經進行第一次會勘了，到今年的6 月6 日你們進行第二次，問題在於應該要去傾聽地方上的需求，你這樣子做，時間要再拉多長？你要再拉多久？
工務局陳世仁局長,我再向議員報告，可能是在擬函的時候，不應該是寫為會勘，正確名稱是內部的勘查。
謝舒凡議員,你回覆這樣不是找球給我打嗎？我就會問什麼時候來會勘？為什麼沒有接到消息？
謝舒凡議員,上次是請示玉皇上帝、王母娘娘，這次會勘又不找我們，我們是很不得工務局的尊重。
工務局陳世仁局長,沒有，這只是與顧問公司去做勘查工作，因為要了解包括整個線型要怎麼用？高度大概多少？
謝舒凡議員,可是局長都非常清楚的知道這件事情有其急迫性，既然有急迫性，為什麼不要一氣呵成？6 月6 日邀請我們及區公所會勘，將問題都一一講出來，讓規劃公司回去進行規劃，這樣很困難嗎？
工務局陳世仁局長,這個案子因為它有那麼多的經費，所以必須要另外招標，只是說先用開口契約的廠商幫忙做個初步了解，大概需要多少的經費、長度要多少？
謝舒凡議員,所以它了解完之後又要安排下一次會勘。
謝舒凡議員,第4屆 第3次定期會 市政總質詢 974工務局陳局長世仁：
謝舒凡議員,要用它先去爭取經費，然後才會有適當顧問公司來……
謝舒凡議員,這樣子的時間是不是拖長了？
工務局陳世仁局長,是因為沒有錢找顧問公司去做規劃設計。
謝舒凡議員,了解，可是地方上要的是一種尊重，你來會勘時也至少尊重一下吧，這會很困難嗎？
工務局陳世仁局長,不會。
謝舒凡議員,第二個問題。市長，你稍坐一下，我先跟局長講完，上次本席在市政總質詢講完，講到你們的公園管理科，它有找你們的廠商去看，可是也沒有叫我們，到現在我還不知道你們到底修繕了什麼，你很莫名其妙？我到底哪裡跟你們有代溝？我跟你們局處好像有一點代溝，以往每次講的都要透過你們的副座或是透過局長來向我回覆目前工務局做到哪的進度？局長，這樣子合理嗎？局裡的承辦、科長都在做什麼？
工務局陳世仁局長,我向議員報告，你5 月29 日總質詢，我在5 月30 日下午就去現場，去了解一下華宗公園裡哪些東西需要改善，我直接就請它們針對需要更改的去進行改善。
謝舒凡議員,局長，但上個禮拜還有家長持續反映，到昨天我還將民眾反映給我的問題再傳給區公所，你沒有來找我們，到底要怎麼把民眾的問題反映給你們？不是很奇怪嗎？難道是我們很恐怖你們沒辦法來找會勘？
工務局陳世仁局長,不是，因為有些東西做現勘的時候，先要自己去了解。
謝舒凡議員,那要怎麼把民眾的聲音反映給你們？
工務局陳世仁局長,其實只要你跟我們聯繫，都會把議員提供的相關議題或問題非常重視地來處理。
謝舒凡議員,市長換到你，講我也講了，問題我也反映了，可是會勘都不找我們，怎麼會有這種狀況？
黃偉哲市長,這個部分事後會再研議，基本上他們自己工程上的工程專業勘查與地方溝通的一個會勘，可能要做一個……
謝舒凡議員,是不是要更加的落實？
黃偉哲市長,我的意思是它們自己工程之間的專業勘察可能沒有通知地方，但是它們跟地方溝通第4屆 第3次定期會 市政總質詢 975的會勘應該要通知地方。
謝舒凡議員,然後我也希望工務局你可以針對我剛剛所提到的……
黃偉哲市長,我跟議員報告，反正與地方會勘的部分一定要讓各位……
謝舒凡議員,就是落實，可以把地方上的聲音反映給你們，可以進行改善進行規劃，這樣的話事情不就可以處理得很快嗎？為什麼要多次地去處理這件事，局長，我希望你可以針對這點做改善一下，謝謝，麻煩你。
工務局陳世仁局長,好。
謝舒凡議員,OK，水利局局長，本席想要就教你，從縣市合併後，從賴清德總統到黃偉哲市長任內學甲的治水工程做得非常好，也改善了頭港排水、永隆溝排水到將軍溪排水，可是目前來講頭港排水的支流—北學甲也需要水利局，是不是可以允諾本席，在中央可以將之列為優先重視的地方治水工程，去年的時候秀昌抽水站完工，明年的工業區抽水站也要完工，這兩個工業區的抽水都是排入北學甲排水，所以在兩個抽水站完成後，北學甲排水就非常的重要，局長，你怎麼看？
水利局邱忠川局長,這個已經提報計畫了。
謝舒凡議員,多久會有消息？
水利局邱忠川局長,已經提報水利署，現在就是前瞻的計畫，之後再看後續怎麼樣。
謝舒凡議員,希望列為學甲、北門的重點治水工程。
水利局邱忠川局長,當然，因為這與抽水站有關係，早就把它列入重要計畫裡面。
謝舒凡議員,也希望在偉哲市長最後這兩年任內，一起努力把北學甲的治水完成。
水利局邱忠川局長,分段來做。
謝舒凡議員,OK。好，我再延伸到下一個議題，北學甲延伸後就會去注意到鹽原排水，市長？
水利局邱忠川局長,這個也是一樣，都有提報計畫。
謝舒凡議員,我知道你們有提報計畫，目前是由北門延伸到學甲做治水，可是目前你們只到玉港里而已。
謝舒凡議員,第4屆 第3次定期會 市政總質詢 976水利局邱局長忠川：
謝舒凡議員,對。
謝舒凡議員,市長，本席要建議你，我每次參加學甲區公所座談會時就會看到中洲里林清發里長非常辛苦，他擔任十屆里長，十六年裡有三分之一的時間都是為了鹽原排水做努力，所以是不是該重視地方里長的聲音？目前來講，做到北門玉港里，到學甲就會行經光華到中洲的話還有3 公里，是否與地方上座談並優先處理，市長？
黃偉哲市長,會積極在做，而且事實上在議會會期結束之後，就可以去列席行政院院會，會積極向行政院經濟部水利署來爭取。
謝舒凡議員,好。局長，目前來講北學甲、鹽原排水要列為……
水利局邱忠川局長,都有提報計畫。
謝舒凡議員,可是有提報沒下來也是沒用。
水利局邱忠川局長,就是中央一直沒有錢。
謝舒凡議員,局長，不要哭窮哭窮，哭窮什麼事都不用做，遇到問題應該……
主席蔡宗豪議員,謝謝謝舒凡議員，現在休息10 分鐘，休息至10 時31 分再繼續開會。
主席蔡宗豪議員,繼續進行市政總質詢-自由發言。現在請朱正軒議員質詢，時間10 分鐘。
朱正軒議員,謝謝主席。在此要向交通局及市府團隊就教，A1 事故讓大家非常難過，今年度6 月12 日在永康也發生一件遺憾的事，這件的態樣與上個月在王行路、中正北路口發生的態樣有點類似，一樣是直行的機慢車，面對要右轉的砂石車，雖然機慢車已經在砂石車前，但因機車速度慢導致砂石車右轉時把機車拖進車底，造成遺憾。我覺得還是要有些作為讓交通更安全，去年大型車A1 事故就有19 件，行人A1 事故就有20 件，我相信市長、局長對這樣的情況都非常難過。我也知道市長在交通變革上一直很用心，所以我希望在交通部分可以更努力，臺南的城市交通文化有些小細節可以逐步做起，我簡報中下方這張圖，因為日本是右駕，所以其左轉相當是的右轉，也就是現在討論大車右轉的遺憾事件態樣，所有日本的大車底下都會貼上這樣的標示，當其右轉時會有暫停動作，請後方車輛要注意，我在右轉時會先在路口暫停，目的是什麼？是為了能看到機慢車和行人，局長，臺南市有沒有辦法在這上面做些努力？
黃偉哲市長,議員，我簡短佔用你的時間回應一下，像經過十字路口時大家都講停、看、聽，或過平交道時也要停、看、聽，這個意思也代表在轉彎時也要停、看、聽的意思，類似這第4屆 第3次定期會 市政總質詢 977意思，這次會期也非常多議員提出交通事故的發生率及死亡率相較於其他縣市都是較高的，是一路從合併以來都是較高的，但現在若與之前相比是較低的，但不能以此滿足，因為還是比別人高，其實還是很難過。現在想到黃仁勳瘋、蘇姿丰瘋，就是AI 瘋，希望能用AI 來減少A1，怎麼樣用AI 減少A1？就是以人工智慧一起來做重要路口分析，把有限的資源放在重點上，這是可以做的。
朱正軒議員,謝謝市長。包含硬體部分誠如剛才市長講的AI 該如何輔助，還有城市的交通文化，我當然知道大家覺得在路口減速或暫停會影響到後面的車，可能交通壅塞的情況會加劇，但如果這變成交通文化，在路口停等不是因為不停等、不禮讓行人會被罰幾千元，而是因為我已經有這個心，在道路上大家都有機會變成行人，有心尊重行人後就會慢慢變成城市文化，大家自然而然在路口時會減速，至少要確認有沒有行人或機慢車。廖局長站起來是不是有什麼要說明？
警察局廖宗山局長,這點我來補充報告一下，我有請交大大隊長針對轄內所有客運公司、貨運公司的大客車及大貨車加強宣導，希望它們在右轉或直行時遇到旁邊有機慢車或行人時要特別慢、特別注意，不要再發這種意外。
朱正軒議員,除了加強宣導外，現在大車在左轉或右轉時會有一些警示聲，而新的車輛若車邊有東西靠近時駕駛會收到警示，但為什麼有些大車不裝這種東西？或者其實有要求裝設？
交通局王銘德局長,向議員報告，監理站也在道安會報的團隊內，這些營業大貨車的駕駛管理會與監理站來合作，從源頭來管理。
朱正軒議員,對，管理是一部分。
交通局王銘德局長,去年在路口不停讓的罰責提高後，都有定期在路口稽查客運，因為客運直接歸臺南市公共運輸處管理，這部分會加強努力；第二是有關大貨車硬體的部分，例如視野輔助系統或轉彎的警示器在法規都有明定，驗車時都需要查驗，至於你剛剛提到這些設備為什麼沒辦法發揮成效或如何再精進，會再與中央探討。
朱正軒議員,其實在每期A1 事故會議中都會檢討到底是哪個環節出問題。
交通局王銘德局長,是。
朱正軒議員,雖然說態樣看起來很像，可是問題還是在這臺車本身，當然也要呼籲機慢車朋友看到大車一定得要離它非常遠，像我自己若騎機車時看到大車一定會離得非常遠，因為你永遠沒辦法確定他看不看得到你。
交通局王銘德局長,是，根據這些事故的分析，比較高的比例還是在駕駛人的問題，有關你剛提到的如第4屆 第3次定期會 市政總質詢 978車內的提醒或駕駛人要養成習慣在路口要停……
朱正軒議員,現在講的這個方向，其實在大車後方可以貼警示，是否能建議中央？利用這樣的警示提醒後方車輛，大車在右轉時一定要注意一下有沒有行人或機慢車。
交通局王銘德局長,是，因為各大客運業都為監理所站管理，會與監理所密切合作，因為他們都是道安會報的成員之一，會……
朱正軒議員,我想這些事件都讓我們非常難過，都是一條生命，一個17 歲的女孩發生這樣的遺憾，拜託市府團隊多努力。
交通局王銘德局長,是，謝謝議員。
朱正軒議員,這也要向交通局請教，照片中這是A1 事故的路口，你可以注意到該路口有許多路肩空間可以運用，上次在業務報告時有提到高速公路側車道是一快一慢，路肩空間是夠的，若能變成二個混合車道的話，直行車與右轉車就能分流，這樣更好，否則右轉的汽車與直行機車一直產生衝突，這件事也很感謝交通局，交通局也有去丈量過了，路幅確實夠，如高速公路的側車道由北向南右轉中山南路臺20 時會變成二個混合車道，就是以車向分流的方向設計，這個路口拜託局長評估一下。
交通局王銘德局長,好，謝謝議員，逐步來努力，路肩的使用涉及住戶，我想路口的部分優先來處理，比較沒有爭議。
朱正軒議員,好，局長這部分再拜託。
交通局王銘德局長,謝謝議員，一起來努力。
朱正軒議員,再向廖宗山局長請教一下，有關王行路與中正北路的那起A1 事故，是右轉大車與直行機車交織所產生的遺憾，可是又在附近設置測速照相，我想這二件事不一定有直接關聯，今天這起A1 事故不是因為臺1 線上的超速所造成的，民眾就會有疑問是否每次遇到A1 事故後的檢討方向就是設置一支測速照相在那裡，所以我也要拜託警察局審慎地評估這件事，可以針對A1 事故的肇因……
警察局廖宗山局長,每次A1 事故的發生都有深切去檢討該如何去改善這樣的狀況。
朱正軒議員,好，謝謝局長。市長，你也一直在對這些國際大廠招手，所以它們可以進駐臺南，但是面對能源需求的問題，尤其是有些媒體在散播不正確的資訊說臺灣缺電，把電線跳脫等問題簡化成缺電，如果是缺電的話是沒辦法把電線跳脫修繕好後就能立即恢復供電的，所以有這些錯誤資訊，但有一資訊還是要注意，就是臺南市近幾年來因為大南方計第4屆 第3次定期會 市政總質詢 979畫有意識地把高科技產業帶來臺南，所以臺南的用電量現在已經是全國第一，甚至達到79%。
黃偉哲市長,工業用電。
朱正軒議員,對，其中有79%是工業用電，但臺南自己發電量只有25%，也就是每四個電只有一個是臺南自己發電，三個要靠別人。
黃偉哲市長,你講得非常對，為什麼要靠別地方的人用愛發電、用媒發電、用核發電給我們，自己不發電，我覺得這是過去長久下來造成的。
朱正軒議員,市長，近幾年來南科的產值已經遠超於竹科，而且每一年的差距一直拉大，這都是你任內發生的事情，所以市長在引進產業及交通革新上一直有看得見的成績。
黃偉哲市長,推動能源自主的方向不變。
朱正軒議員,能源自主，我想在綠能這塊很重要，雖然綠能在臺南被汙名化但我相信市府團隊一定會繼續努力，將藏汙納垢的地方解決，因為綠能是爭取國際大廠進駐的重要指標，包含能源自主率也必須要提升，希望市長可以積極處理，我知道會有些民意壓力但仍要積極處理。最後時間要拜託市長，永康國小需要興建活動中心，還有一旁的永康公所……
主席蔡宗豪議員,謝謝朱正軒議員，現在請尤榮智議員質詢，時間10 分鐘。
尤榮智議員,感謝主席。市長及各局處長，今天是本席10 分鐘的自由發言，現在雨正在下，梅雨季即將來臨，六甲及後壁區一期水稻倒伏面積約達300 公頃以上，以前用地下水灌溉的都先倒伏，為什麼？因為去年休耕雜草、稻草混入土壤後就有肥料了，之後又再施肥往往水稻會受不了就倒伏，但現在有個問題，因這二天下雨無法收割的情況下稻穗都發芽了，這樣要怎麼處理？局長。
農業局李建裕局長,向議員報告，上個禮拜我有講到，若因下雨稻米倒伏時先將田裡的水排乾，另外農會這邊也有割稻機支援，也會與農糧署協調中、北部的割稻機來支援。
尤榮智議員,不是割稻的問題，都在下雨無法收割，從早下到晚，中間也沒有停歇，每天日曬不到1 個小時也不會乾，如果再繼續下雨導致發芽，公糧不收、輾米廠也不收的話要怎麼處理？
農業局李建裕局長,因為青割搶收的話也沒辦法繳公糧，所以也是兩難，農糧署有個政策是全部收割後若損失超過二成會啟動救助。
尤榮智議員,第4屆 第3次定期會 市政總質詢 980沒關係，再來要關心的是穗稻熱病的問題，都說「吊穗」(臺語)，這有理賠？以前是農業部保險的，現在要怎麼辦，農會也沒辦法理賠，這樣怎麼處理？保險還有用嗎？
農業局李建裕局長,臺南約到六月中、下旬會全收割完畢，農糧署就會計算農民收割的數量與上期相比是否差二成以上，若差二成以上就會啟動。
尤榮智議員,局長，農民都說農業部在圖利保險公司，發覺這樣的問題就可以理賠，到時候檢討起來，有「吊穗」(臺語)或沒「吊穗」(臺語)的你也不知道，這你要特別注意一下。
農業局李建裕局長,是。
尤榮智議員,"再來是這次財損的部分，本市有龍眼、荔枝，因為二月高溫受損可申請補助，每公頃6 萬2,000 元，玉荷包、糯米荔枝、玫瑰紅荔枝等都是10 萬元，但發現一個問題，那裡的農民玉荷包栽種3 公頃，初審沒有過，我的服務處有發文請農糧署及公所農業相關單位至現場會勘，3 公頃地有的長不出來，有的有長出來，結果他們只拍有長出來的照片，剩下長不出來的沒去拍，農糧署說受損率超過50%，超過20%就能申請補助不是嗎？"
農業局李建裕局長,是。
尤榮智議員,但這卻無法申請，你們應該教育公所相關審查作業，農民就是怨無不怨少，政府既然有財損補助你就要讓農民通過申請才對，你們要教育一下，好不好？
農業局李建裕局長,是，我知道。
尤榮智議員,一月至四月是火鶴花產季，六甲最多，外銷日本高達40 萬枝，澳洲也有8 萬枝，比去年同期成長六成一與二成三，臺灣火鶴花臺南市佔出口約六成，尤其澳洲出口量佔總量的97%，約25 萬枝。你們推廣得很好，市長也很忙，為了AI 人工智慧的進駐沒有到菲律賓，這也是為了的大建設打拚，這是非常好的。圖上這是日本熊本，市長也親自前往站臺行銷芒果、鳳梨，農產品經過行銷就容易售出，容易售出後農民就能將價格調高，讓農民覺得一年來的辛苦種植得到回報，像市長到日本熊本、北海道推廣行銷，而副市長也到大阪推廣的農產品，這是很好的事，有推廣行銷，農民就會覺得栽種這些農作物後有政府幫忙推廣，銷售價格就會更好，這是很重要的事，包括農漁會的產品，經過媒體報導後才能把好東西推廣出去，這很重要，希望農業局能再加強努力。
黃偉哲市長,會再加強努力，像照片中站在我旁邊的是新加坡的部長，他也有來參加。
尤榮智議員,"是，媒體報導後我就給予你肯定，你對農民很認真，也常常在召開行銷記者會，一直都做得很成功，本席在此誇讚你。再來是消防隊官田分隊新建駐地案，因為原址太小，沒有一個消防分隊這麼小的，打火兄弟是最辛苦的，出勤後回來根本沒有地方休息，只第4屆 第3次定期會 市政總質詢 981有辦公空間而已，非常辛苦，現在新的駐地也開始在興建。消防隊官田分隊預定選址在官田二鎮，總經費1 億2,000 多萬元，那天我有向市長建議，爭取納入114 年至117 年度預算，市長，你不能延後，今年就規劃，明年編預算動工，不然你任期到2026 年時可能就要到部會當部長，你從縣議員到立委做了那麼多年，市長也做快六年多，你的經驗及經歷，對於農民到科技你是無一不知曉的。"
黃偉哲市長,向議員報告，五年半，還未六年。
尤榮智議員,沒有滿二年就要改選，是不是這樣？
黃偉哲市長,儘量不要這樣。
尤榮智議員,若滿二年臺南市就不用改選了，就能派到中央。
黃偉哲市長,這樣市民朋友也不會高興。
尤榮智議員,但我認為你的經驗可以在上層為農民爭取福利。
黃偉哲市長,沒有完成任期就離開會被人攻擊。
尤榮智議員,以前都是一些落選的人在擔任部長，而你是名正言順的選上，戰戰競競從頭到尾連任也沒有斷過。
黃偉哲市長,現在說回官田消防隊。
尤榮智議員,"好，1 億2,000 多萬元有沒有問題？"
黃偉哲市長,會努力，成功不必在我，但啓動要在我，會努力，你說是否在今年先編列規劃費，盤點一下經費是否可以支應，再與消防局討論。
尤榮智議員,"市長，1 億2,000 多萬元而已不會太多，因為這是有急迫性的需求，我在官田警消做副團長，所以我可以聽到打火兄弟們的聲音，他們的需求很迫切。"
黃偉哲市長,你不是在六甲？
尤榮智議員,我也在六甲擔任顧問，都是我的選區，為什麼我關心打火兄弟們，因為他們義無反顧在救火，出生入死為了百姓們。
黃偉哲市長,是，我非常感謝。
黃偉哲市長,第4屆 第3次定期會 市政總質詢 982尤議員榮智：
黃偉哲市長,所以你要儘量，不要說都沒有。
黃偉哲市長,趕緊來檢討一下。
尤榮智議員,好，儘量促成。
