speaker,content
李中岑議員,我希望既然當下有人發出檢舉的狀況，我們就必須去處理。
黃偉哲市長,對。
李中岑議員,不可以等到新聞都爆發了，全民都知道了。
黃偉哲市長,我要跟你解釋。
李中岑議員,市長才說有這件事，我們有處理。
黃偉哲市長,新聞不是聖經，有些記者也有私心，所以這個報導不是事實。
李中岑議員,不是，那我想問一下，我們到底是從何時開始啟動調查？
人事處沈德蘭處長,報告議員，我們接到申訴書以後就馬上啟動調查。
李中岑議員,什麼時間？
人事處沈德蘭處長,5 月 31 日收到。
李中岑議員,今年的 5 月 31 日嗎？
人事處沈德蘭處長,去年的 5 月 31 日。
李中岑議員,調查的結果到底是如何？為什麼調查了一年到現在沒有一個報告。
人事處沈德蘭處長,人事處的調查不是最終調查，我們把調查結果送給社會局。
李中岑議員,我希望已經一年的時間了，針對這些被加害的受害者，我們要趕緊還他們一個公道，因為已經一年的時間了。
黃偉哲市長,議員，我相信我們溝通管道是暢通的，所以你這樣講，我覺得有必要跟你澄清，事情有調查有結果，但是根據性騷擾防治法，這個結果只能通知當事人兩造。
李中岑議員,市長，為什麼會這樣詢問？因為他是公眾人物。
黃偉哲市長,法律規定的。
李中岑議員,但是它的調查結束，那這件案子結束了嗎？我詢問一下，案子結束了沒？
黃偉哲市長,案子結束了。
人事處沈德蘭處長,人事處這邊結束了，移給社會局。
李中岑議員,沒關係，那你給我們單位一份資料。
人事處沈德蘭處長,資料按照規定是要保密的。
李中岑議員,最後我們要呼籲，不分性別的朋友，不管在什麼職場上，如果真的被性騷擾，被職場霸凌，一定要勇敢說出來，不要讓加害者變本加厲，我們三位議員也歡迎所有被傷害的這些朋友來檢舉，我們一定會幫你把這些加害者公諸於世。
蔡育輝議員,市長，在講賣燒肉粽的事之前，我跟大家提醒一下，有的事情我在議會時都有說過，不是沒說，有的人明明就是出事才離開，你怎麼不敢說易俊宏出事情，性平調查的結果就是真的，是不是事實也沒有你們的事情，市長。
黃偉哲市長,結果不能公開講。
蔡育輝議員,我就說有出事，不然沒出事發生他為什麼要離開？說什麼傻話，對不對？如果有人要介紹給你，你也不要全收，有的在新營區被打到跑來市府這裡，我不說那個人的姓名，中岑剛才有說，你們自己沒有嚴查，到處遛鳥，被新營人打了好幾次，有人介紹給你們還是收，本來在議會質詢我是不想說，你把中岑說成這樣，我聽了很不爽，你知道嗎？
黃偉哲市長,不要不爽，我一定……
蔡育輝議員,我放影片給你聽好不好？我在議會質詢過，那位遛鳥俠我有說過，你們要說老實話，他是考試進去市政府沒出過事情，他過去隨便遛鳥被人家拖去打，你知道嗎？今天要承認我不是沒有講過，罵一下燒肉粽，放一下燒肉粽，工作報告說的。（這不能唱完整首，會出事情）今天列席的官員都要老實點，不然資料放出來，沒證據我是不會在議會亂說的。（吃肉粽絕對不可以配啤酒，容易拉肚子）最近端午節要到了，大家注意一下，吃肉粽不可以配啤酒，因為啤酒過去在臺南縣政府包很多工程，我都知道，我不說而已，因為那個單位跟我關係不錯，老實說，都去圍標，市政府我不知道，縣政府很多，因為他們的親戚錯綜複雜，如果要資料我晚點說給市長聽，我為什麼要提出來說？民進黨就像王家貞說的，很多豬哥、骯髒和扭曲，我在臺南縣的時候，有人向我檢舉，他晚上都找人去唱歌，唱了之後又不付錢，還會對沒結婚的上下其手，沒錢還要向人借錢坐車回去，現在在某一間醫院當顧問，衛生局從 100 年到現在開了 3 張罰單，到底有沒有像門神？
蔡育輝議員,衛生局，從 100 年到現在才 3 張罰單，每間醫院都開了幾十張，只有這間例外。
衛生局蘇世斌局長,沒有，一視同仁。
蔡育輝議員,今天電視轉播，你當然要說一視同仁，他是公關室的主任，坐下。為什麼我要替他出氣？被人恐嚇，酒後隨便打電話，立委跟他道歉，我最看不起他說一連串謊話，說他的 Line 被盜用，市長，他都有拜託你幫忙，你不要以為我不知道，都有人檢舉，你當然說沒有，我晚點再說給你聽。說到肉粽傳奇，市政府單位有問題，你知道臺南市現在環境保護局廢棄物管理科做一般有毒廢棄物，他當約聘僱時，你知道他喬了多少工程嗎？
蔡育輝議員,晚點我再說給你聽，和你沒有關係，和賴清德有關係，和你沒關係，我有說過，環境保護局一個當大官的，家裡的人過世，賴清德點主，兩個議員，其中一個林宜瑾，另外一個我不說，當陪賓、招待，公祭送的花圈、花籃我沒看過那麼大的，說要升他為副局長，我說這個人在郭再欽的身邊都是在做壞事，在賴清德任內，104 年先在什麼工廠，後來又換一間，那些都說過了，不能說和市長沒關係，你的形象因為兩個人受損，這個是我最想不透的，這種在世界上敢說謊話的人真的天下無敵，他明明就肇事，肇事之後居然去和兩個患者，他卻說一個，我昨天求證過是 2 人，一個比較嚴重，一個不嚴重，撞到頭破血流、骨折，那是他說的不是我說的，跟他們和解，他喝酒後撞人，不過他不承認有喝酒，還有去照顧對方到凌晨 4 點才去警察局做筆錄，市長，你看這臺車撞成這樣，輪胎破掉、前面保險桿脫落，現在要說重點，環境保護局最後提出證明說那天他公出沒有填寫車輛派用單，市長，我請教你，你有沒有坐過公務車？你的車有沒有保險？
黃偉哲市長,有，怎樣？
蔡育輝議員,如果出險會不會報案？
黃偉哲市長,保險公司應該就會報案，沒有報案就不能申請保險。
蔡育輝議員,你們說那天肉粽的那臺車是公出。
黃偉哲市長,你說哪一年的事情？
蔡育輝議員,你們內部說的，100 年。
黃偉哲市長,100 年。
蔡育輝議員,不是你當市長，沒關係，你大方回應沒關係，他當機要秘書開車出去，政風處說有填單公出，有公出為什麼不報案？不報出險自己修理？為什麼要這樣？這樣不是很奇怪，剛才新聞處說遛鳥俠的那臺車是公出，公出為什麼不去給人家修理？局長，向我檢舉的，就是他當機要秘書開始，每臺車都被他開進開出的去替林宜瑾處理事情，局長，你們都說調查不到消息，什麼都沒有，他說去醫院照顧人、Line 被盜用。局長，你說給我聽看看是怎麼回事，為什麼他開公務車出事不用保險處理，自己付錢，你在議會說他自行處理，為什麼？你說啊。
環境保護局許仁澤局長,後面是他自己去修理的，他自行付錢的。
蔡育輝議員,市長，你同意送調查局再重新調查嗎？
黃偉哲市長,公務車都只有保強制險而已，撞到人才會……
蔡育輝議員,你不要亂說，市政府的車不是只有保強制險而已。
黃偉哲市長,你聽我說完，如果有保其他加重的部分。
蔡育輝議員,那臺車保很多險，不要因為他姊當立委、議員，我覺得警察局有稍微放水，但是沒證據，怎麼說？發生事情馬上通知，很多次我都被報肇事逃逸，我和人擦撞之後，我錢給他走之後被報警，也都馬上找我做筆錄，你們可以在下午 5 點出車禍，到凌晨 4 點還找不到人。放那張酒測值 0.14，你看 107 年 4 月 12 日下午 3 點半肇事，警察局有移送臺灣臺南地方檢察署，酒測值 0.14，0.15 是屬於公共危險罪，我不敢說警方有問題，有看電視或報紙的要注意聽，我不知道有沒有用特權，所以民進黨要稍微注意一下，不要拿到政權後就和以前差很多，提醒你們，環境保護局長，你們要怎麼處理？公務車私用有沒有承認？還是我要再放紀錄出來？
環境保護局許仁澤局長,那時候是有派車。
蔡育輝議員,有派車怎麼會出車禍不敢報保險出險？為什麼不敢？你說給我聽看看，剛才市長和新聞處長說的，說公務車出險都有報車險，為什麼沒有報？說給我聽啊！市長，我覺得很奇怪，過去都沒有紀錄，不過這臺車確實有派用單，到底是事前還是事後才填寫？政風處，可以送臺灣臺南地方檢察署重啟調查嗎？
政風處高伯陽處長,因為這件肇事逃逸……
蔡育輝議員,我跟你說，我提供證據給你，公務車私用一整年，這是貪汙，雲林縣一個消防局長開車載老婆就以貪汙罪起訴，你知道嗎？你們都要放水嗎？有沒有放水？
政風處高伯陽處長,我們那時候就有調查，他是合法使用。
蔡育輝議員,好啦！你們調查都沒結論，我會不知道沒結論嗎？
政風處高伯陽處長,結論當時是合法的。
蔡育輝議員,處長，你跟我說出車都有紀錄，可就只有那天有紀錄，剩下整年都沒紀錄，我聽了想不開，你很明確回覆公文那日確實有派車單，但是這幾年都沒紀錄，你覺得百姓會相信嗎？這麼剛好有那一張你知道。
政風處高伯陽處長,報告議員，我們資料是他當天有派車單，沒有其他日子沒有派車單。
蔡育輝議員,派車單，前一日後一日都沒有派車單，都沒有紀錄，只有這一天有紀錄，明確回復我有派車單，明明就是掩護，說謊也讓人信服一點。
政風處高伯陽處長,我們都有派車。
蔡育輝議員,整年都沒有紀錄，只有那一天有紀錄，確定有派車單，今天電視轉播出去會不會有損你的形象？
政風處高伯陽處長,報告議員，當時我們質疑的是有沒有派車。
蔡育輝議員,我現在要和你爭論，不相信我再拿資料給你看，不要讓你們漏氣，我很信任政風處，不過你來這裡之後每件事情都沒查到，都沒查到半項，我跟你說真的，都是要靠別人檢舉。
政風處高伯陽處長,我們有儘量查。
蔡育輝議員,好，我再拿給你看，環境保護局職員向我檢舉的，你知道嗎？因為肉粽在裡面太惡劣，在議會裡面恐嚇或辱罵女性，我才會替她打抱不平，不然這件事情會被爆出來？市長，對你不好意思。(做為老市長，今天回到臺南，心情很沉重，對於臺南市發生的一切，我也很痛心，所以我在這裡，我希望市長站起來、立委站起來、議員都站起來，深深一鞠躬向臺南市民道歉)。對市長比較不好意思的是為什麼？嚴重折損你的威望，因為你是民選的，賴皇帝說的我不太想聽，他叫你站起來是為什麼？郭再欽是在他身邊的人，但是他沒有叫主委站起來，我今天說的是他沒有叫主委站起來，他叫市長、立委、議員站起來，沒有叫主委站起來，民進黨的主委做了什麼壞事，我晚點說給你聽。第二，我覺得賴皇不對，現在什麼民主時代，郭再欽是他一手牽成的，是潘新傳介紹給你認識，不然郭再欽在臺南縣，就已經把那間公司的爐碴，不是我說的，陳鋕銘檢察官寫的，後壁區爐碴，你應該知道是哪個國民黨議員跑到民進黨，勾結，郭再欽處理之後就介入議長選舉，從第一屆到第四屆都介入，我有證據，不是沒有，我只是不想害人、不想說，你知道嗎？市長，我覺得賴皇不能叫你起來，你是民選的，他是當行政院長失敗後再回來當黨主席，名望比較高而已，他憑什麼叫議員、立委、市長站起來？我覺得對你不尊重，也覺得沒面子，對你不尊重，這是我的想法，他自己都沒事，全部都是別人的事，你看看，他說國民黨最沒有民主的 DNA，最沒有民主的 DNA 是他，他不到議會開會，當時我在議事廳說了好幾天都不進來，我問主席，臺下沒幾個人，蘇金安局長，你有沒有來？沒有來吧，你們這些老臣都沒有進來，就只有我站在這裡說話，也不知道要說什麼，你們沒有來我是要說什麼？市長沒有來，總質詢總不能我自己一個人說，因為說了也沒意思，全世界民主國家就他最沒資格說「民主」，不要為了當選而不擇手段說那些有的沒的，沒意義，我反而比較欣賞黃偉哲，要被唸就被唸、要被罵就被罵，你們是執政黨，我們是在野黨，我監督你們，不對就是要說，這才合理，這才是民主政治，民進黨可以批評我蔡育輝，我什麼做不好你們可以批評我，你的主委做不好我也要批評，像肉粽這件事屬實我也會批評，這才是民主政治的進步，對不對？我也拜託市長，民進黨不要隨便宣傳我在柳營區要設焚化爐，我當時是說，環境保護局長也可以做證，新營護鎮里的里長說要做好道路、環境汙染要處理好，可以創造就業機會，在新營區後鎮要設，因為一日不到 450 噸，我沒有說要在重溪，你們這些民進黨議員都去隨便宣傳我主張在柳營重溪設焚化爐，我沒有這樣說，環境保護局長我有這樣說嗎？我有說要設在哪裡嗎？
環境保護局許仁澤局長,沒有。
蔡育輝議員,我主張溪北，因為一日不到 450 噸，所以不要都設在臺南市，溪南或溪北設一個，才會符合成本，當然要和居民溝通，要把道路拓寬、沒有汙染、有回饋，謝謝。
李中岑議員,我補充一下，蔡議員說的。市長，剛剛那 3 位曾經在市府工作過的同仁，市長我也知道你有很多無奈，像蔡育輝剛才說的，人家請你站你就站，人家請你用你就用，有很多人把不好的東西推給你。
黃偉哲市長,你請我站我也站。
李中岑議員,把人推進來臺南市政府，我希望真的要審慎評估，看這個人是不是適合，是不是妥當。
黃偉哲市長,我可以很負責任的跟你說，羅先生是考進來的，易先生是人家介紹的，是機要級的沒有錯。
李中岑議員,對，我的意思是有很多事情跟狀況，你有很多無奈，就是你不知道的情形下，去任用到這個人員，結果他造成的問題和困擾，就是臺南市政府必須要承擔。另外一個部分，很多人會說男性會性騷擾女性，其實有很多女性也會去性騷擾男性，我們時有耳聞，有很多女幕僚，為了要上位去當民意代表，她也會去犧牲自己的身體、靈魂來討好上司，讓她未來可以參選，雖然這個很少數，但是我希望大家要自己做好職場的立足點，不要靠什麼關係，我覺得很不妥當，我希望當議員就是要有議員自己的本質，不要做一些不當的行為跟手段。
蔡育輝議員,市長，還有一些燒肉粽的事，開車不喝酒，喝酒不開車，肉粽節不要喝啤酒，喝了會拉肚子，要吃西瓜或竹筍湯，我沒說完繼續講，不是燒肉粽，環境保護局要注意聽，很多張圖都是圍事的，以前圍事的，李坤煌議員以前和一個立委在這裡說環境保護局怎樣，所以你們都不相信他會喝酒嗎？喝酒後很多酒後亂性，如果要檢舉，新營區有一位里長的女兒就是在環境保護局，她跟我講的，我會後再跟你說是誰，來調查看看，好不好？這樣明白嗎？新營區有一位在環境保護局上班，處理什麼事情？當初環境保護局硬凹，李坤煌在議會時也說過，我有替他說，裡面這位現在不在職的都去喬給自己人，打壓別人，過去的紀錄你知道嗎？
環境保護局許仁澤局長,我不知道。
蔡育輝議員,不知道，我下次再說。這臺車你知道吧，我說過，你們需不需要我拿資料？需要證明嗎？他開了一整年，如果我拿出證據來，市長要怎麼負責任？你們都說沒辦法查，我把它拿出來誰要負責任？你跟我說誰要負責任？政風處，誰要負責任？你們查不到，環境保護局查不到，我可以拿出證明這段時間他當環境保護局機要秘書的時候，這臺車都是他在開，開回去他的家，我有在他家拍到照片，這要怎麼處理？你說給我聽，時間到了，你要說啊，不然今天要質詢什麼？說一些刺激的，不然聽了會想睡，你說啊！
政風處高伯陽處長,我們看那時候的車輛管理辦法，是不是符合使用的規定。
蔡育輝議員,我本來要叫那位主管來，但有人說不要，局長，當初的辦法是怎麼說？市政府的時候怎麼訂定？
環境保護局許仁澤局長,公務車出車一定要申請，要填里程數、使用的情形，假日如果……
蔡育輝議員,連那臺車的用油紀錄都沒有，資料剛才有顯示肉粽開那臺車去做私事，有在他家的照片，你們要怎麼處理？告訴我，公務車私用，都做私人的事情，替議員處理事情，去哪裡調解卻說環境保護局的事情，你們要怎麼處理？告訴我。
環境保護局許仁澤局長,照規定辦理。
蔡育輝議員,照規定怎麼樣做？他現在又不在那裡，照規定？
環境保護局許仁澤局長,當時怎麼規定，我們就怎麼處理。
蔡育輝議員,人就不在那裡任職了，所以我剛才說要送臺灣臺南地方檢察署查看看，你說不要，要不要？如果我是你們，我就敢送臺灣臺南地方檢察署，因為你們都說沒事情、沒問題，所以才要送臺灣臺南地方檢察署，不然你們是要替他掩護嗎？我可以提出證明，要不要？
蔡育輝議員,讓你們送件，好不好？你們移送好不好？怎麼都那麼安靜，剩下 2 分鐘。
政風處高伯陽處長,報告議員，如果是有證據的話我們願意辦，但是我們目前查是沒有。
蔡育輝議員,好，我拿給你，請你拿去辦，不要每次我檢舉一大堆都沒消息，我檢舉那麼多，我說陳凱凌你都不相信，到最後還不是。
黃偉哲市長,議員，我向你報告，如果你手中有證據，我們歡迎。
蔡育輝議員,你這樣才像真正的市長，今天總質詢有轉播才有那種氣魄，說黃偉哲不會袒護過去不良的。
黃偉哲市長,你叫我起來，我就起來，你沒叫我站起來，我也站起來。
蔡育輝議員,我沒有叫你站。
黃偉哲市長,我要說的是公事公辦，你提供資料給我們，我們會整理後移送。
蔡育輝議員,政風處，你知道吧。
黃偉哲市長,檢送。
蔡育輝議員,環境保護局長，性騷擾的要怎麼處理？他現在不在那裡，你要送嗎？在環境保護局任內發生的。
黃偉哲市長,性騷擾的話，第一個他現在不是本府的同仁，如果有牽涉到本府任職的期間，警政相關單位會調查。
蔡育輝議員,安南區當公關主任。
黃偉哲市長,調查的結果，法律上該怎麼做就怎麼做。
蔡育輝議員,醫院都說照規定辦理，結果那間醫院都沒有被開單，100 年到 112 年才開出 3 張單，都說依法辦理，都這樣處理門神，是說我覺得那間醫院也沒什麼用處，議會說他那麼不好，還是不辭退他，也不發一個新聞稿，我忘記他是賴清德當市長用的人，所以他不會辭退他。
黃偉哲市長,也不是這樣，因為現在這間醫院是公辦民營。
蔡育輝議員,私人的我不多說，如果我是那間醫院的所有人，我一定會說不要用這個人，形象不好，大家一直批評，說他的 Line 不見，說他肇事逃逸去照顧那個患者，撞到兩個卻說一個，每天喝那麼多酒還騷擾女性，他姊的關係真的那麼厲害，民進黨形象也受到影響，遇到賴清德也跟他說稍微注意一下，不要把民進黨的形象搞壞，小時候我的鄰居都叫我要投民進黨，說國民黨欺負臺灣人，現在民進黨執政有比較好嗎？
黃偉哲市長,你又沒有投過民進黨。
蔡育輝議員,我沒有，但是我鄰居都叫我投民進黨，因為閩南人族群都說民進黨是臺灣本黨，清廉、勤政、愛鄉土，我們要投給他們，王家貞說豬哥、骯髒、扭曲、隨便。
黃偉哲市長,不會。
蔡育輝議員,事情都發生了，拿到執政的權力。
黃偉哲市長,如果我們錯了，我們會道歉。
蔡育輝議員,這樣說就對了，我的時間到了，休息一下，王家貞要獻花，我收一下她的花，時間到了，等一下再說。
黃偉哲市長,你說婦女會送花嗎？
蔡育輝議員,他們要預祝我可以當選婦女會理事長，時間到了，休息一下。市長要不要一起來？
主席沈震東議員,謝謝蔡育輝議員、蔡淑惠議員、李中岑議員，休息 10 分鐘。
主席沈震東議員,繼續請蔡育輝議員、蔡淑惠議員、李中岑議員發言，時間 100 分鐘。
蔡淑惠議員,衛生局，局長，是不是有提供一些臺南市民免費心理諮商的服務？
衛生局蘇世斌局長,是，一年有兩次。
蔡淑惠議員,一年有兩次，是一個人兩次？
衛生局蘇世斌局長,一個人。
蔡淑惠議員,一個人最多只有兩次免費的諮詢。
衛生局蘇世斌局長,有需要的時候可以再增加。
蔡淑惠議員,可以增加幾次？
衛生局蘇世斌局長,沒有限制，看他的情況。
蔡淑惠議員,沒有限制，一年有多少人可以免費諮商？你說一個人兩次。
衛生局蘇世斌局長,一個人兩次。
蔡淑惠議員,你是開放 100 個人、200 個人、300 個人，還是 50 個人就截止？
衛生局蘇世斌局長,沒有設限。
蔡淑惠議員,沒有設限，那總經費多少錢？
衛生局蘇世斌局長,這個主要是諮商心理師來協助，只要有人事費用就可以了。
蔡淑惠議員,衛生局自己設立的諮商心理師嗎？不是診所？
衛生局蘇世斌局長,是心理衛生中心，再加上外面合約的診所。
蔡淑惠議員,對，外面合約的診所就要付錢，對不對？
衛生局蘇世斌局長,那個是由計畫來支付。
蔡淑惠議員,對，我就問你計畫內編制多少錢。
衛生局蘇世斌局長,詳細的數字我要查一下。
蔡淑惠議員,局長，你這樣回答不太專業，因為我問你一個人最多幾次，你說兩次。
衛生局蘇世斌局長,兩次沒錯。
蔡淑惠議員,如果特殊狀況可以再加，一定會有總人數，因為有經費的概算，多少米煮多少飯，多少錢可以做多少事，這個我們很清楚，對不對？
衛生局蘇世斌局長,如果是自己的諮商心理師，就沒有這個問題。
蔡淑惠議員,對，我現在問你，自己的諮商心理師有多少人？
衛生局蘇世斌局長,應該有 4、50 個。
蔡淑惠議員,4、50 個，外面診所的心理治療室，我們一年給他們多少經費？
衛生局蘇世斌局長,抱歉，這個數字我要查一下資料。
蔡淑惠議員,你請後面的同仁給你資料，我們等一下再詳談，好不好？
衛生局蘇世斌局長,好。
蔡淑惠議員,教育局，局長。
教育局鄭新輝局長,議員好。
蔡淑惠議員,市民需要免費諮商，老師需不需要？
教育局鄭新輝局長,老師也需要。
蔡淑惠議員,老師也需要，臺南市老師、代理老師、園長、校長，一共有多少人？
教育局鄭新輝局長,大概 1 萬多個人。
蔡淑惠議員,1 萬多個人，如果以我們的資料查詢，在 111 年是有 120 萬的經費，110 年有 50 萬的經費，是不是？表示老師的心理諮商需求量越來越多，所以經費也越來越多，是不是這樣？
教育局鄭新輝局長,是有在增加。
蔡淑惠議員,可不可以請教一下，老師一個人一年可以諮商幾次？
教育局鄭新輝局長,特約的機構一個人一年可以有 4 次。
蔡淑惠議員,一年只有 4 次。
教育局鄭新輝局長,"我們可以補助 6,400 元。"
蔡淑惠議員,"6,400 元。"
教育局鄭新輝局長,"因為一次大概 1,600 元。"
蔡淑惠議員,好，局長，一共有多少間特約的心理諮商所？
教育局鄭新輝局長,目前來講，公開勞務採購的話，是有一家。
蔡淑惠議員,只有一家，為什麼只有一家來？
教育局鄭新輝局長,因為是公開提供的服務，過去受到的評價，公開徵選，獲得的諮商所。
蔡淑惠議員,公開徵選就只能一家，不能多家？
教育局鄭新輝局長,我們也不排除。
蔡淑惠議員,你們不排除。
教育局鄭新輝局長,未來如果需要。
蔡淑惠議員,所以你的意思是勞務採購標只有寬欣心理治療所的人來投標，其他的廠商沒有興趣，還是有很多家來投標，我們遴選之後只有寬欣適合？
教育局鄭新輝局長,這個部分，如果未來確實是可以採用。
蔡淑惠議員,你不要跟我說未來。
教育局鄭新輝局長,目前沒有，就那一家。
蔡淑惠議員,只有那一家來投標。
教育局鄭新輝局長,這個部分我要了解投標過程。
