speaker,content
吳通龍議員,所以我為什麼提到外面大家說這是惡法，因為不合理，第二點則是原有的都不見了，這讓百姓非常反彈，我手上這張沒有放上去，等一下局長你們去討論一下是什麼原因。
地政局陳淑美局長,會後再向議員洽詢。
吳通龍議員,我希望你們給我一個圓滿的答覆，讓我可以對所有地主有個交代，這些地主覺得他們的地是高低不平的，甚至魚塭你也劃成農1，隔壁平坦的地卻是農2，我希望你們可以有個合理的解釋。
地政局陳淑美局長,好，再向議員洽詢資料。
吳通龍議員,或者該如何去補好，這樣不合理，百姓們的想法是這樣。
地政局陳淑美局長,現在兩個局也在加開會議，專門針對人民陳情案件逐一檢討。
吳通龍議員,好，謝謝。
主席蔡宗豪議員,現在休息到11 時30 分再繼續開會。
主席蔡宗豪議員,繼續進行市政總質詢-自由發言。請趙昆原議員、李偉智議員共同質詢，共用時間20分鐘，趙議員請。
趙昆原議員,感謝主席。今天由我和偉智議員共用時間質詢，先在這裡誇獎一下觀旅局，你是歷屆觀旅局局長中表現最好的，我請教一下，荷蘭村從臺南縣蘇煥智當縣長時用心努力，接續由賴清德市長八年，再來黃偉哲市長也近六年的時間，都沒有延續性，一個荷蘭村第4屆 第3次定期會 市政總質詢 994規劃後卻放在那裡荒廢，還好你上任後願意接受地方上的建議並溝通，這整個規劃我想讓你用幾分鐘說明一下。
觀光旅遊局林國華局長,"謝謝議員對荷蘭村的關心，一直以來對硬體及軟體都有提出具體的建議，去年在整體規劃上提出硬體9,000 萬元、軟體3,000 多萬元的水映南瀛計畫，5 月20 日經觀光署初步審核通過，接下來會進行會勘，會勘後便可核定。"
趙昆原議員,好，市長，真的感謝你，你有聽進去也有心去做，荷蘭村的水域觀旅局局長也很用心去測量水深6、7 次，到底能否在此行駛船隻從事觀光？局長很用心，局長，現在應該有結論了吧？
觀光旅遊局林國華局長,向議員報告，市長也非常關心，這個水域除了灌溉功能外，也可以規劃水上遊憩活動，第一階段的獨木舟活動已在1 月開始。
趙昆原議員,好，這留待後續再來見證，聽你這麼說以後我也替柳營民眾感到高興，市長，感謝你。
黃偉哲市長,不敢，我也去荷蘭村好幾次了。
趙昆原議員,我和你當朋友至今我一直想辦法為你創造機會，不要讓市長在任期間在溪北地區都沒留下半項建設，我相信這會有遺憾。
黃偉哲市長,是。
趙昆原議員,局長，將軍吼活動幾年了？
觀光旅遊局林國華局長,如果有正式加入煙火的話是三年。
趙昆原議員,三年。
黃偉哲市長,從我上任時就開始做了。
趙昆原議員,有嗎？那時候將軍吼有像將軍吼嗎？局長，從開始與你溝通擴大舉辦，讓大家知道臺南有做將軍吼活動至今三、四年，一年一年地增加節目。
黃偉哲市長,一天變二天，又有煙火。
趙昆原議員,局長，我稱讚你具有遠景。
黃偉哲市長,第4屆 第3次定期會 市政總質詢 995議員，很感謝你的建議，這部分很成功。
趙昆原議員,在溪北留下將軍吼活動，若能再將太陽能船落實在荷蘭村行駛，市長，我相信溪北民眾絕對為你豎起大拇指，不光是我稱讚你而已，真的再向你說聲感謝。
黃偉哲市長,不敢，要落實。
趙昆原議員,局長，你有聽到吧，市長交代要落實，我希望在年底前能夠實現，感謝你。
觀光旅遊局林國華局長,會再努力，謝謝。
趙昆原議員,局長，荷蘭村的四周環境只有樹而已，環境不是很好，照片中的風車也還未開始運作，希望能再儘速規劃，請你們團隊要動起來，配合太陽能船的行駛，將過去虎頭埤的經驗用在荷蘭村上，如此可為溪北這個觀光景點帶來可觀人潮，好嗎？感謝你。接下來請教經發局局長，柳營科技園區正式成立後現在所有的工廠有幾間？
經濟發展局林榮川局長,你說總家數嗎？
趙昆原議員,總共幾間？是不是65 間？
經濟發展局林榮川局長,是。
趙昆原議員,有65 間進駐嗎？
經濟發展局林榮川局長,是。
趙昆原議員,你們列管的煙囪有幾支？市長，你真的要看一下。
經濟發展局林榮川局長,煙囪的部分有16 支。
趙昆原議員,16 支？
經濟發展局林榮川局長,有向環保局申請的。
趙昆原議員,沒有申請的算不算違章？
經濟發展局林榮川局長,有的還未到管制量。
趙昆原議員,好，這都先帶過。我再看你們的作為，我手上的資料是派人去看的，65 間工廠，列第4屆 第3次定期會 市政總質詢 996管的煙囪有164 支，市長，難怪你上次看到時會驚訝怎麼那麼多，164 支煙囪，有6 支超過40 公尺，40 公尺有多高？煙囪出來的氣體足以飄到後壁區，那些毒氣有可能飄散到後壁。
黃偉哲市長,是。
趙昆原議員,有6 支，目前正在申請中的還有2 間工廠，局長，對嗎？
經濟發展局林榮川局長,這個部分……
趙昆原議員,不是你們的業務嗎？
經濟發展局林榮川局長,許局長較清楚。
趙昆原議員,你們的部分就是在環境部，當時柳營科技園區是環境部核准的對嗎？都沒有聽地方上的意見，也沒有到地方上召開說明會，這裡要做再利用的工廠，要將有毒氣的工廠移到臺南柳營科技園區，是不是這樣？所以現在才會有這麼多鄉親出來抗議，局長，我相信你也能感受到，第一場抗議你就有聽到鄉親們的心聲，甚至民進黨的議員隔天就來找市長說這座公家的焚化爐不可以興建，市長，現在要興建一座公家的焚化爐，我剛才說的那些是私人的，是不是有議員針對要興建公立焚化爐乙案來找你，你也答應不會興建了？我在此正式詢問局長，一個工業區的設立一定要興建焚化爐、掩埋場及汙水處理廠嗎？
經濟發展局林榮川局長,向議員報告，現在環保法規規定工業區要自己處理。
趙昆原議員,對，市長，你輕易地答應民進黨的議員說不興建，那些議員馬上告訴當地民眾，如果這座焚化爐真的無法興建會被經濟部廢止環保科技園區嗎？這件事你們要去注意，我先提醒你們。
黃偉哲市長,好。
趙昆原議員,市長，你這麼輕易的說出去，這座焚化爐就停下來，這責任就換你要去承受，對嗎？
趙昆原議員,甚至我在此建議你，若要興建焚化爐要先到地方召開說明會，我建議由你出面來說明比較好，不要讓那些得標廠商來說明，這樣說服力會比較差，市長，你要親自出馬一下嗎？
黃偉哲市長,我們的但書是地方上若不同意，它們就不能繼續推動。
趙昆原議員,不能推動，這座焚化爐不興建，可以嗎？私人的設置那麼多，但公家不做可以嗎？
趙昆原議員,這是我要問你們的，局長，可以嗎？
趙昆原議員,第4屆 第3次定期會 市政總質詢 997經濟發展局林局長榮川：
趙昆原議員,向議員報告，按法規應該要設置處理設施，但設施的部分之前也有承諾要與民眾溝通，有共識後再進行會比較好。
趙昆原議員,環境部准許工業區後，你們總量管制下到底有多少？之前有沒有超標？這些資訊你們也要讓民眾知道。
經濟發展局林榮川局長,好。
趙昆原議員,我替你們思考後續的路該怎麼走，至少你們要有心去處理。
經濟發展局林榮川局長,向議員報告，當時送環評時也包含焚化爐的量，目前工廠的這些總量還沒超過。
趙昆原議員,還沒超過，請將數字給我。
經濟發展局林榮川局長,是。
趙昆原議員,我若可以在地方上幫你們講話，我就幫忙講，數量是到底多少？現在有影響的是多少？好不好？
經濟發展局林榮川局長,好。
趙昆原議員,請教局長，目前這幾間主要生產的產品是什麼？
環境保護局許仁澤局長,現在與環保相關的應該有九間。
趙昆原議員,"局長，你既然有提到，剩下的由我來說，市長請你聽一下。九間事業廢棄物處理廠，有六間甲級的，三間乙級的，每個月垃圾處理量是4 萬8,900 噸，由各地運來柳營，市長，這個量可不可觀？柳營難道是垃圾的故鄉？4 萬8,900 噸由六間甲級處理廠專門處理有害廢棄物（廢酸鹼液、廢有機溶劑）"
趙昆原議員,"，每月處理許可量1 萬3,500 公噸，兩項加起來有6 萬多噸，代表各地有6 萬多噸的垃圾運到柳營環保科技園區，你說柳營人怎麼不緊張、不惶恐？市長，你說這樣會不會緊張？如果要興建這座公家焚化爐導致民眾出來抗議，你們要能接受並同理百姓們的苦楚，你們一定要接受。"
經濟發展局林榮川局長,是。向議員報告……
趙昆原議員,警察局局長，如果繼續針對不好的廠商予以抗議，算環保流氓嗎？
警察局廖宗山局長,若有犯罪行為才會辦理。
警察局廖宗山局長,第4屆 第3次定期會 市政總質詢 998趙議員昆原：
警察局廖宗山局長,好，不要在抗議還被抹黑我向人拿錢，人家不給我才變成環保流氓。我在此藉此機會向環保局局長說，這麼多垃圾進到柳營環保科技園區，如果這座焚化爐興建了，聽說有幾噸？
經濟發展局林榮川局長,80 頓。
趙昆原議員,一年80 噸？光焚化柳營工業區的只有80 噸嗎？這座焚化爐只有焚化柳營的還是會焚化全臺灣所有的廢棄物。
經濟發展局林榮川局長,全臺南市。
趙昆原議員,確定嗎？合約要寫好。
經濟發展局林榮川局長,整個臺南市。
趙昆原議員,你們現在以柳營科技園區為基準，接下來包括臺南市其他工業區，這樣有多少噸廢棄物會進來？你數字要弄清楚，改天辦說明會時才能向百姓們說明，好不好？
經濟發展局林榮川局長,是。
趙昆原議員,"像我就有錯誤的想法，想說現在外面運進來的就有3 萬8,000 多噸了，若這座公家焚化爐興建好後再運4 萬噸進來的話柳營豈不成為垃圾的故鄉。"
經濟發展局林榮川局長,沒有，沒那麼多。
趙昆原議員,好，希望是這樣，我也希望你們把資料整理好。
經濟發展局林榮川局長,是以柳營工業區為主，再來則是臺南市的。
趙昆原議員,面對柳營區這些居民，期待工業區能創造就業機會，結果你看這樣的情形誰敢去，工廠製造有毒氣體，這樣出外的遊子敢回來工作嗎？我請教勞工局局長，你們曾到柳營科技園區檢查嗎？像這樣的問題需要介入嗎？如果工廠內產生的東西會影響勞工身體時需要注意嗎？
勞工局王鑫基局長,若影響到裡面工作員工的身體健康……
趙昆原議員,那邊成立至今曾去檢查過嗎？不曾，局長，請多費心一下，這要注意。接下來請教一下衛生局局長，PM2.5 會對身體造成什麼影響？
趙昆原議員,第4屆 第3次定期會 市政總質詢 999衛生局李局長翠鳳：
趙昆原議員,PM2.5 若進到人體內對肺部會造成很多影響。
趙昆原議員,影響什麼？你要說清楚，民眾才聽得懂。
衛生局李翠鳳局長,好，對腦部而言可能導致失智，還有議員剛所說的中風；在肺部可能產生肺阻塞性疾病、支氣管炎，嚴重的話會有肺癌，其他全身性的影響如進到血液中還會有肝、腎方面的影響。
趙昆原議員,柳科這些排放廢棄、毒氣的煙囪，衛生局有沒有做好準備？有沒有想要幫周邊的柳營百姓們做健康檢查？還是你們有較好的政策可以來保障民眾？
衛生局李翠鳳局長,現在有推動行動醫院，都可以做免費的檢查，肺部檢查等等，會特別來盤點柳營居民使用的情況，如果還不夠的話可以再多辦幾場。
趙昆原議員,希望你們多用心，因為民眾的生命財產安全都被這些煙囪左右，唯一能保護我們的只剩下你們了，是不是？
衛生局李翠鳳局長,我們會努力。
趙昆原議員,只剩下你們可以保護，唯一的依靠就是你。
衛生局李翠鳳局長,感謝，會努力。
趙昆原議員,為我們多留意一下。教育局局長，你知道重溪國小在哪裡嗎？
教育局鄭新輝局長,我知道。
趙昆原議員,在哪裡？
教育局鄭新輝局長,柳營。
趙昆原議員,柳營的哪裡？
教育局鄭新輝局長,重溪。
趙昆原議員,柳營環保科技園區在哪裡？跟我無關，我不知道？
教育局鄭新輝局長,我是不曾去過，當然你有在關心，重溪國小校長也有反映空氣……
教育局鄭新輝局長,第4屆 第3次定期會 市政總質詢 1趙議員昆原：
教育局鄭新輝局長,你不曾聽過重溪國小的校長、老師向你反映學生減少嗎？為什麼會減少？空氣汙染，是不是？
教育局鄭新輝局長,是，有在說。
趙昆原議員,一整天都有臭味，學生沒辦法在那裡唸書，校長都沒告訴你嗎？校長沒有向你建議嗎？都不敢？
教育局鄭新輝局長,有，有在說。
趙昆原議員,有說，你們有動作嗎？
教育局鄭新輝局長,規劃與環保局、經發局實地去實測，議員所關心的空氣不好的部分該如何去改善……
趙昆原議員,重溪國小學生減少，老師也多有怨言，我希望局長能親自去關心那些孩子，到底臭到什麼程度？會不會影響身體？在此也慎重要求經發局局長，你今天在此做個決定，重溪國小每一班可以馬上安裝空氣清淨機嗎？有沒有辦法？
經濟發展局林榮川局長,向議員報告，之前有和廠商協調，他們有提供一些資源，會來協助……
趙昆原議員,有沒有要做？你不要跟我說到廠商，你是和廠商有勾結嗎？
經濟發展局林榮川局長,向議員報告，這會來改善，和教育局一起來面對這個問題。
趙昆原議員,要馬上解決，不然後面的說明會可能都不用開。
主席蔡宗豪議員,事後請局長補充資料給趙議員，20 分鐘時間到了，快樂的時間總是過得很快，謝謝趙議員。接下來請郭鴻儀議員質詢，時間10 分鐘。
郭鴻儀議員,謝謝主席。首先我要請教都發局局長，都發局通盤檢討的時間，看起來好像不是每三年內或五年就會做一次通盤檢討的動作？
都市發展局徐中強局長,對。
郭鴻儀議員,在仁德的部分有仁德都市計畫、文賢都市計畫、臺南交流道與都會公園四個區，但107 年完成的文賢都市計畫目前有沒有做通盤檢討的打算？因為地區發展的形態，現在臺南仁德區人口逐年增加，而且地方通盤檢討的必要性也很高且需求性也很高，我希望局裡應該除了現在正在做的仁德區現行都市計畫整併的專案通檢外，希望在此次專案通第4屆 第3次定期會 市政總質詢 1檢裡順便把文賢都市計畫再做一次通盤檢討，因為地方有需求且也有做的必要性，局長？
都市發展局徐中強局長,向郭議員說明一下，這次整併是希望把主要計畫與細部計畫拆分，至於法令上規定的通盤檢討應該不衝突……
郭鴻儀議員,是不是要做？
都市發展局徐中強局長,應該不衝突，所以……
郭鴻儀議員,不衝突的話就趕快做。
都市發展局徐中強局長,好，研究一下來同步進行。
郭鴻儀議員,地方上給我的聲音是有這樣的需求及必要性，好不好？
都市發展局徐中強局長,來研究一下辦理。
郭鴻儀議員,好，請坐。農業局及環保局，請問一下農廢的主管機關到底是農業局還是環保局？
郭鴻儀議員,農業局的部分，現在這些農作使用的廢塑膠膜(黑膜)非常泛濫，而且清潔隊是不收這樣的東西，這樣的狀況下，包括現在關廟鳳梨園中，從園中看過去有非常多的黑塑膠膜，都參雜在土壤中，其材質除了PE 外還有PVC，PVC 在2023 年7 月後被列為汙染材質，它是禁用的，這樣的情況下是否會汙染土壤？
農業局李建裕局長,我先向議員報告，分成二部分，之前有農民反映這個問題時，我第一時間有請環保局及環境部資源……
郭鴻儀議員,你的第一時間是多久之前的事？
農業局李建裕局長,約三個星期前，有請它們來協助，包括關廟、學甲。
郭鴻儀議員,我向局長報告，現在全省都會面臨這樣的問題，除了黑塑膠膜外還有其他農作廢棄物，如樹枝等等，環保局是不會去清運這些東西的，這樣的狀況下量會非常多，你看現場隨時都會看到黑塑膠膜在土壤裡，對於能進入人體裡的農作物而言是非常不好的，我建議臺南市可以學習屏東，屏東在潘孟安縣長任內做了很好的事，他山之石可以借鏡，用專案去處理農廢，包括樹枝、PVC 布或黑塑膠膜等等都可以處理，可以回收的就回收，因為這些黑塑膠膜不會有人要，不是堆置就是燃燒，這有可能丟到垃圾車裡嗎？環保局會不會去收？不可能吧！沒有專案這樣做，是不是請農業局及環保局研究看看？學著跟屏東一樣，定時、定量，它們是有限制數量的，還有一個集中場來做分類及處理，是不是可以這樣做？市長，是否可以這樣做？這是好的政策。
郭鴻儀議員,第4屆 第3次定期會 市政總質詢 1黃市長偉哲：
郭鴻儀議員,我們來規劃這個部分。
郭鴻儀議員,臺南市是一個農業大市。
黃偉哲市長,雖然我們的鳳梨產量是屏東的一半，但會積極來處理。
郭鴻儀議員,不是鳳梨而已，市長，不光只是黑塑膠膜而已，還有一些果樹的樹枝、農作物的廢棄物，現在有在收生質廚餘……
黃偉哲市長,像麻豆文旦，來研議一下。
郭鴻儀議員,研議一套機制，讓農民不再傷腦筋，可以集中的就集中，對環境也比較好，好不好？
郭鴻儀議員,兩個局橫向聯繫一下，訂定一個辦法、機制來處理。文化局局長，我們的宮廟博物館辦得有聲有色，今年新豐區裡有兩間宮廟分別是山西宮及仁德大甲慈濟宮，其實很可惜，在大甲慈濟宮裡有很多特別的文物，這張照片是山西宮，山西宮以民間的力量當時花了600 萬元去做了陳列展覽館，將文物保存得非常好，這些都是古物，對下一代來說都是寶，但其並沒有對外開放的時間，連導覽員等都沒有，也沒有任何培訓動作，我建議文化局一定要去做培訓，否則光是有這樣的展示館卻沒人進去看，開放的時間也不多，這可以與廟方好好去協調。
文化局謝仕淵局長,是，宮廟博物館最重要的部分是如同議員所說的擁有很好的文物，但沒有組織及培訓機制，我們的資源很好……
郭鴻儀議員,如果沒有就趕快去做，好嗎？
文化局謝仕淵局長,現在宮廟博物館就是在做這件事。
郭鴻儀議員,好，既然有這樣的活動及選拔，舉個例如大甲慈濟宮內有陳秋山老師、陳壽彝老師等泥塑、彩繪、木雕、剪黏等作品，這些都是活的，是現在進行式的博物館，但有一點讓我覺得納悶的是現場沒有解說牌也沒有解說人員，什麼人知道有這些東西，去到那裡連頭可能不敢抬起來。
文化局謝仕淵局長,所以宮廟博物館活動就是要輔導宮廟來做這些。
郭鴻儀議員,像大甲慈濟宮就很特別，把現代、近代的人物都畫上去，非常特別的一間廟，有機會請各局處首長可以前往參觀，市長我也邀請你去看看。但其展示燈光灰灰暗暗地可能沒人看得懂是什麼東西，但其內容非常精彩。局長，有空的話我再帶你去看，裡面還有非常多的寶貝，這些寶貝除了要予以保護外也要讓市民朋友一起參與、觀賞，讓下一代第4屆 第3次定期會 市政總質詢 1都知道這些文化及文物，好嗎？局長。
文化局謝仕淵局長,是。
郭鴻儀議員,水利局局長，現在仁德汙水下水道如火如荼一直在做，而且進度也非常快，現在已經到第九標，一路走來我發現施工時，不知道包商是抱持怎樣的心態，挖挖補補之後現場的狀況非常不好，希望水利局真的要要求包商的施工品質，包括維護鋪面，本來是抿石子，結果是用簡單AC 去回復，不要未蒙其利先受其害，民眾現在非常反感，未來的接管率可能會有逐年不同意的情況。局長，另一件是中正路汙水管的主要幹線，中正路的住家完全都沒有接管，是因為管線的關係或排水溝的關係你們不能做，但總不能永遠都不做，這些還是要做，你們還是要與工務局協調，排水溝的部分必須去改善提供汙水下水道的接管，否則的汙水接管率永遠接不上。
水利局邱忠川局長,這已經有在想辦法。
郭鴻儀議員,有想辦法，工務局有沒有與你們協調？
水利局邱忠川局長,有，有與工務局協調，這部分看是否先破壞一段排水溝，讓我們汙水管線通過了之後，會再做一個……
郭鴻儀議員,局長，時間很短暫，我希望你趕快，從仁德中正路一段至三段的兩側住家完全都沒有接管。
水利局邱忠川局長,剛才議員有說過，旁邊都是管線……
郭鴻儀議員,不管怎麼都要處理，管障還是要排除。
水利局邱忠川局長,現在有想到……
郭鴻儀議員,你們有想過，要怎麼做你們要趕快去做，好嗎？
水利局邱忠川局長,是。
郭鴻儀議員,不然花那麼多錢結果主要幹道……
主席蔡宗豪議員,謝謝。接下來請林美燕議員與李文俊議員共用質詢時間20 分鐘，請開始。
林美燕議員,謝謝主席。市長，有個老議題要與你探討，本席與議會同事們都講過好幾次，但都沒有做，可這真的是一個非常重要的議題，在我去年6 月2 日總質詢時再次提出要設置第4屆 第3次定期會 市政總質詢 1青年局，那時我有提到只有臺中市與臺南市沒有設置，臺北市正在籌備當中，新北市、高雄市及桃園市都已經有設置，臺中市與臺南市還是沒有。今年6 月1 日臺北青年局成立，它們真的落實成立，高興的當成喜事一樣慶祝，青年局局長所發表之內容讓我非常感動，他強調青年局將全力協助青年築夢，必強化青年公共參與，規劃讓青年透過多元管道參與市政規劃，近一步了解公共政策的多元面向，並將青年意見實際成為局體政策。
林美燕議員,讓青年參與市政，讓年輕人知道政府在做什麼，且也幫助他們尋找個人職涯的方向，現階段哪幾個縣市沒有，新北市、桃園市、高雄市及臺北市都已經成立，臺中市一樣還是青年發展科，臺南則是在研考會下設置青年事務科，我想我們動作真的比較慢，市長，臺南青年局什麼時候能夠成立？
黃偉哲市長,這部分請容我再想一下，因為以臺中市來說，它們可以設的局處就比臺南市多，它們都沒有設，但不是設了就……
林美燕議員,要比好的，不是比壞的，市長。
黃偉哲市長,對，你講得沒有錯，在能力範圍內儘量去做，像你剛提到的，二年前剛設立了體育局，之前也成立原住民事務委員會及客家事務委員會。
林美燕議員,而且你也看到體育局成立後的成績展現。
黃偉哲市長,運動成績，還有主辦全國運動會。
林美燕議員,真的非常棒。對青年領域要加強，各局處都要加強，希望青年局的成立能夠提供年青人的創業基地、貸款並降低其就職門檻，還有可以提供職業……
黃偉哲市長,還有在社宅上有撥出一部分給年輕朋友。
林美燕議員,這還是需要透過青年局來告知年輕人，他們才知道，而且也能開辦許多課程，讓年輕人獲得培訓使其在職場上更具競爭力，現在是地球村的世界，不只在國內競爭，更要與國外人才競爭，所以再次催生臺南市青年局，趕快！不要做最後一名，不要還在這裡討論的時候臺中市就已成立，不要做末段班的學生，市長，憑你的能力我相信是可以做到的，好不好？
黃偉哲市長,會努力。
林美燕議員,應該是可以的，這部分我要積極一點。
黃偉哲市長,好，會努力。
