speaker,content
主席郭鴻儀議員,本席宣布本日會議開始，臺南市政府黃偉哲市長、方秘書長、各局處首長、新聞媒體各位女士先生、本會各位同仁，以及電視前關心臺南市市政的好朋友，大家早安，大家好。今天是11月4日，星期一，也是本次定期會第16次會，上午議程為市政總質詢，議員質詢順序為蔡宗豪議員、周麗津議員及副議長林志展，其中林志展副議長以書面質詢，每位議員質詢的時間為50分鐘，不再延長時間，首先請蔡宗豪議員質詢，時間50分鐘，蔡議員請。
蔡宗豪議員,謝謝主席。市長、各局處首長還有線上看直播的市民朋友，大家早安，大家好，市長，你吃飽了嗎？先給你一顆水煮蛋。
黃偉哲市長,好的，水煮蛋比較健康，謝謝議員。（合照）
蔡宗豪議員,請教市長一個問題，關於臺南市政，你最關心的一件議題是什麼？
黃偉哲市長,其實是交通還有治安，每次發生交通事件，不管是在臺南或是在外縣市，其實都滿揪心的。
蔡宗豪議員,好，市長，今天我想要問一下，你平常有沒有看報章雜誌的習慣？
黃偉哲市長,都有在看，像是我們地方的新聞。
蔡宗豪議員,有在看天下雜誌、遠見雜誌、壹週刊等等的嗎？
黃偉哲市長,都會看，壹週刊已經沒了。
蔡宗豪議員,對，就是類似這種周刊，我想跟你討論的第一個議題是臺南市的治安，遠見雜誌2024年的縣市總體暨永續競爭力調查有弄出一個排名，你有看到嗎？你有關心到臺南市嗎？（按-臺南永續競爭力大退步，治安治理要加強。主要退步指標為治安及治理永續）
黃偉哲市長,有。
蔡宗豪議員,有，那你有注意到臺南市是全臺灣第17名嗎？我們的治安是六都最後一名，你有看到嗎？
黃偉哲市長,我也覺得很不好。
蔡宗豪議員,你也覺得很不好，然後呢？
黃偉哲市長,我不知道它那個指標的主觀跟客觀因素是什麼，因為有時候前一年很好，第二年突然變得不好，那可能是主觀因素，但我覺得不管是主客觀，我們自己都要檢討。
蔡宗豪議員,遠見雜誌主觀的評比？
黃偉哲市長,主客觀我們都要檢討。
蔡宗豪議員,OK，那你覺得未來會不會退步？
黃偉哲市長,我們一年之間就降了7名。
蔡宗豪議員,全臺灣就22個縣市，我們第17名，對不對？反省一下吧！再來這個是TPOC臺灣議題研究中心，剛剛你說那是主觀，這個我想就是一個客觀，針對黑金跟治安在網路的討論聲量，臺南市是狠甩六都的其他縣市。（按-槍聲響不停府城變腐城，「黑金」與「治安」網路討論聲量臺南市已超過23萬則）
黃偉哲市長,我有特別注意到，我也知道這一家媒體，我不做揣測，但是我們願意去檢討，這是應該的，而且您剛剛這上面的標題寫說多與政治掛勾，這部分應該要讓司法及檢調把中間的政治掛勾揪出來。
蔡宗豪議員,好，所以今天如果我放的照片是政治的言論，那可能是一些政治的攻防、政治的攻擊，但我想大家都在看直播，都很清楚我放的是遠見雜誌，還有議題中心給的答案，針對臺南市的治安問題，這個要怎麼撇都撇不掉。
黃偉哲市長,TPOC臺灣議題研究中心跟遠見雜誌是不一樣的媒體。
蔡宗豪議員,市長，我覺得你們要好好反省一件事情，就是剛剛講的，我相信全臺灣各地方都有所謂的社會人士，難免會有一些治安事件，但是大家看看臺南市這幾年來，很多的治安事件都是跟政治人物相關，甚至是跟民進黨相關，我們在這邊不是要拿同事的私事作為議題，但像前漁會理事長，這也算是一個社會會關注的人物，這樣子的重要事件，當時卓榮泰院長說要列為最緊急最重大，後續呢？（按-臺南市治安警鐘響起，中央袖手旁觀，卓榮泰院長七月說林士傑槍擊案列最緊急重大事件處理，至今兇手仍逍遙法外）
黃偉哲市長,我也期待議員您的想法是針對客觀的，而不是政治攻防，這您剛剛提到的，但是針對客觀的部分，我覺得中央刑事局已經全力介入來偵辦，之前如果您有注意到，我有注意一個訊息是這個兇嫌現在不在境內，所以我覺得中間當然是有預謀，至於預謀的動機是什麼，還不敢釐清。
蔡宗豪議員,我現在不是跟你討論個案的後續，其實你上任六年來，非常多的政治事件，不管是議員候選人的服務處被開槍，甚至是民進黨籍的重要人士也被開槍，等等的治安事件，你知道為什麼我要送你一顆雞蛋嗎？
黃偉哲市長,我知道你是不懷好意的。
蔡宗豪議員,我送你剝好的蛋殼，代表什麼？臺南市民不要「彈殼」啦！您上任這六年來，治理臺南市四個字「讓子彈飛」，警察局局長，您辛苦了，你上任這三個月的時間，臺南市這麼多的治安事件，人家說新官上任三把火，我沒有要求局長像中央一樣做什麼打詐國家隊，做這種口號的事情，我只希望警察局要針對治安的部分，當然這不是你來一天就能夠改變的，因為你來的時候臺南的治安，不管是從遠見雜誌也好，還是從臺灣議題聲量也好，都是一個事實，臺南在黑金跟治安這個議題上已經是受臺灣關注了，所以希望局長，我們要拿出一些威嚴，不要再讓這麼多的治安事件發生，好不好？
警察局林國清局長,是，沒問題。
蔡宗豪議員,局長加油！市長，辛苦了！
黃偉哲市長,謝謝。
蔡宗豪議員,就一個要求，今天已經是11月4日了，再2年就是您卸任的日子。
黃偉哲市長,2年再多一點。
蔡宗豪議員,你能不能在2年1個月的時間內，不要再有政治性的治安事件發生？
黃偉哲市長,本來就不應該有，不管任期還有多久。
蔡宗豪議員,可以答應全臺南市民嗎？
黃偉哲市長,你是說不要讓它發生，那你應該把全臺南市這些有治安背景的分子，都應該把他們……
蔡宗豪議員,市長，好好聽我講，我說政治性的治安事件，是尤其是黨內的同志，好不好？有沒有辦法注意一下？
黃偉哲市長,你講的對，但是每個人都沒有辦法替其他人的行為負責，每個人都應該為自己的行為負責。
蔡宗豪議員,是，但你身為大家長，你在甩鍋嗎？
黃偉哲市長,甩鍋？我不懂。
蔡宗豪議員,你要給市民一個保證，我們要安居樂業、安全的城市，不行嗎？
黃偉哲市長,這是我們應該做。
蔡宗豪議員,對，所以請你答應我們市民，這麼簡單的要求有過分嗎？
黃偉哲市長,我答應朋友們，我一定會嚴格來做好治安，但是每一個政治人物心裡面是怎麼想的，包括你現在是怎麼想的，我都不敢知道。
蔡宗豪議員,市長，政治人物會有所謂的開槍等等的事件，很多都跟重大的利益有關，不管是光電等等這些重大的利益，不要再讓你們黨內的同志，甚至是藍、綠、白，我希望市長針對這件事情要來做一個嚴格的把關，好不好？
黃偉哲市長,沒錯。
蔡宗豪議員,不要有官商勾結的事情再發生，不要有局長再被抓去關，可以嗎？
黃偉哲市長,不應該有。
蔡宗豪議員,謝謝市長，請坐。接下來，我要討論的議題是臺南市最近新剪綵的這個停車場，市長，你有沒有印象我們什麼時候去剪綵的？
黃偉哲市長,剪綵？
蔡宗豪議員,正生公園(體三)地下停車場，位於永華國民運動中心北側。
交通局王銘德局長,7月。
黃偉哲市長,那個時候是。
蔡宗豪議員,開幕剪綵，市長，這個要感謝中央撥了8.3億給臺南市。
黃偉哲市長,我們有自備款。
蔡宗豪議員,當然有，總工程經費8.3億，裡面的金額大部分是中央撥下來的前瞻預算，這要感謝中央，市長，您自從開幕去了一次之後，後面還有再去過這個停車場嗎？
黃偉哲市長,我私下有去過一次。
蔡宗豪議員,那你覺得怎麼樣？
黃偉哲市長,還是有很多該加強的地方。
蔡宗豪議員,譬如什麼地方？
黃偉哲市長,譬如地下二層，它的整個工程過去延宕滿久的，現在也還在保固期，還有一樓的公園，我覺得有些髒亂的地方還是要整理得更妥善一點。
蔡宗豪議員,好，我們的目標都是希望把它可以做到最好的一面，尤其現在臺灣設計展的主要停車場在美術館之外就是在正生，還有水萍塭跟海安路都有接駁的服務，但是我這幾天真的是接到滿多訊息的，我們花了8.3億，這樣的品質要8億嗎？停車場的路面不平，而且才剛完工。
交通局王銘德局長,跟議座報告，這個案子還是……
蔡宗豪議員,局長，我還沒有問你，我一下，我圖面還沒有Show完。市長，你說你有去地下二樓，你沒有感覺到你的車子很晃嗎？
黃偉哲市長,沒有。
蔡宗豪議員,地下停車場的路面完全不平，2024年臺南市的工程品質是這樣子的，你是在跟我「裝痟的」（臺），8億做成這樣？
黃偉哲市長,這樣沒有人把任何人「裝痟的」（臺）工程品質不當，本來就應該要去改善。
蔡宗豪議員,對，但是你們已經開幕了，已經歡迎大家來看了，結果完工的品質是這樣子的，Hello，現在那麼多人去那邊停車，廠商如果甩鍋怎麼辦？所以這個是因為最近車流量很多，大家停一停就變這樣，會不會這樣解釋？我不知道，但是你們不要讓人家覺得臺南市的工程好像很好混水摸魚，8億耶！市長，你有去停過臺南市一些百貨公司的地下停車場吧？你有看過這種品質嗎？
黃偉哲市長,我沒有去百貨公司。
蔡宗豪議員,你沒有去百貨公司，你跑攤時沒有去過晶英酒店、你跑攤時沒有去過南紡夢時代裡面的二樓？
黃偉哲市長,我在一樓就下車了。
蔡宗豪議員,OK，那你可能不知道我們停地下室的人的狀況，這是新建好的樣子，而且還要8億？
黃偉哲市長,我會請交通局針對這個施工品質要做最高標準的檢驗，我不知道當初他們是怎麼驗收完成。
交通局王銘德局長,報告議座，這個我們列為驗收缺失的改善項目，為了要因應設計展，在大範圍的停車格位其實停車狀況是良好的，所以我們要增加停車供給範圍。
蔡宗豪議員,現在B2幾乎所有的路面都是像我講的這樣，我跟大家講，講難聽一點，我開車下去地下室時，我真的會以為這是臺灣設計展番外篇，帶你來到月球表面，晃、晃、晃。
交通局王銘德局長,報告議座，這個地下停車場因為開挖的面積非常的大，那當初這個地方地下水的水位也非常的高，所以在施工過程當中為了止水的部分，其實花了很多的心力，那當然我們沒有在推卸責任，廠商是務必要把這一些漏水的問題來做改善，否則我們會在合約裡面來處理，這個部分，我們會針對施工品質來檢討，因為這個案子還沒有驗收完成，還在驗收階段。
蔡宗豪議員,好，我相信局長的專業，也要給大家時間來做改善，而且現在臺灣設計展還在進行當中，文化局局長，設計展到10日吧？OK，我們給貴市府一個月的時間，從這個月10日開始算，到下個月12月10，能不能改善完成？
交通局王銘德局長,完成工程的改善，或許有一些可能。
黃偉哲市長,到年底好不好？因為年底還有很多活動，我們把時間算得充裕一點。
蔡宗豪議員,可以，市長說到年底12月31日，局長有困難要講。
交通局王銘德局長,我們積極來處理。
蔡宗豪議員,就是要求你們要來限期改善，謝謝局長，請坐。接下來，市長，有一件事情我想要稱讚你一下，針對親子樂活的部分，現在臺灣其實是一個很進步的國家，不管是在同婚也好還是任何議題上都非常前衛，所以我有看到你在生育獎勵金上有這樣很棒的補助，而且同志家庭收養嬰兒也有被納入生育獎勵金的範疇內，市長，你知道這個吧？
黃偉哲市長,我知道，我只是要說，如果你的重點是在生育獎勵金的提高，我覺得那個一點用處都沒有。
蔡宗豪議員,不是，你可能要聽我稍微跟你敘述一下我的想法，我覺得這是一個很棒的議題，因為其實真的會去做領養的族群，可能就像圖片上面放的一樣，就是男性跟男性的同志家庭，因為女性現在可能有一些精子銀行，所以不會有期限的問題，就是延長申請期限的問題，今天男性的同性家庭，可能要去領養嬰兒時，沒有辦法一定可以找得到180天以內的，其實像苗栗、新竹其他縣市，他們針對生育獎勵金申請期限都是超過180天，所以這個議題，希望市長我們要做就要做到位，這個生育獎勵金當初出來的時候，有很多同志朋友都覺得很棒，但是後來跟他們一起研討，發現有點可惜，美中不足。
黃偉哲市長,誠如剛剛議員所說的那最後四個字，跟我想的一樣，要足，就是既然當初會有所謂的延長為180天，可見原來更短，那它延長到180天時也是思慮欠周，所以是不是可以參考先進的國家或其他的縣市，延長到一個合理的部分，讓他們可以找到合適的出養的孩子。
蔡宗豪議員,對，因為這2萬元的生育獎勵金，可能就是針對尿布、奶粉錢這些部分，我還沒有當爸爸，但是聽人家講嬰兒三歲以前都還需要用到奶粉、尿布這些，所以我覺得這也是鼓勵同志家庭，他們今天有心要去領養一個小孩的時候，不要有180天的限制，把這個時間拉長。
黃偉哲市長,放寬一點。
蔡宗豪議員,放寬一點，金額你要調整，未來我也期待，但是針對這個日期，希望市政府可以來做。（按-擴大收養期間，爭取更多同志伴侶受惠，開放同志伴侶收養至兩歲以下的幼兒）
民政局姜淋煌局長,跟議員報告，其實延長180天，其他縣市中也有縣市是沒有延長的，我們是考慮到時間如果延到太長的話，對於申報戶口都是一個界線，所以這個部分我們也會參考其他縣市。
蔡宗豪議員,其他縣市做得到，臺南市沒有理由做不到。
民政局姜淋煌局長,我們的條件比其他縣市還優，我們還是有討論的空間，沒問題。
蔡宗豪議員,是，儘量來爭取，我會寫兩歲以下，因為全臺灣最久的應該是苗栗，但我不知道局長的小孩是幾歲斷尿布的，兩歲以上？
民政局姜淋煌局長,兩歲以上。
蔡宗豪議員,我想要寫三歲，但是當然要看你們的財政來討論，還有你們對同性這些家庭的友好程度到哪裡，180天真的太短，是要去媽媽坐月子的地方，把人家的嬰兒抱走，是不是？
民政局姜淋煌局長,嬰兒出生之後要馬上去申報戶口。
蔡宗豪議員,我知道，所以希望你們的美意可以做到位。
民政局姜淋煌局長,沒問題，我們會再研議。
蔡宗豪議員,那針對同志的部分，我想要詢問一下，我們協同同志收養的媒合機構有哪一些？（按-臺南體現多元價值，配套措施是否完善）
社會局盧禹璁局長,其實收養的媒合機構，不管是同志或非同志，我們都是在家扶基金會。
蔡宗豪議員,OK，針對這個問題，我想要請問一般人或同志去領養孤兒，後續你們會追蹤嗎？
社會局盧禹璁局長,程序都是一樣的，前面是整個評估程序，後續是收養程序，收養之後的後續追蹤程序都是一樣的，不管同志或非同志都是一樣。
蔡宗豪議員,最後的訪視跟頻率是怎麼樣？
社會局盧禹璁局長,定期一個月會去追蹤一到二次左右，看看孩子過得好不好。
蔡宗豪議員,為期幾年？
社會局盧禹璁局長,為期約三年之內。
蔡宗豪議員,好，局長，針對育兒指導，這也是貴局的業務，對不對？（臺南市免費提供每年最多36次育兒指導員到宅服務，同志伴侶是否同樣享有？）
社會局盧禹璁局長,對，這也是社會局的。
蔡宗豪議員,對，每年有36次育兒指導員到宅服務，同志伴侶是否也同樣享有？
社會局盧禹璁局長,同志或非同志都是一樣的。
蔡宗豪議員,OK，謝謝局長。下一個議題，在新竹有一個很特別的AR園區，他們有做一個親子的AR公園實境公園，其實這應該是有富含一些教育意義的，因為我知道教育局也有在做AR的實境體驗，市長，現在科技在進步，是不是可以評估不做一些硬體的設備，來做一些電子化的內容，讓家長和孩童可在假日時，到一些公園做AR的實境體驗，譬如寶可夢就是類似這種呈現方式，市長，是不是可以納入我們的討論並規劃？（按-新增親子景點親子教育，假日放風SO EASY。評估大型公園內增加AR實境主題，配合共融型遊具吸引親子觀光）
黃偉哲市長,這個可以思考，您剛剛剛提到的AR實境主題很好，但你也知道，我還是必須很誠懇的告訴你大型公園很多是戶外的，如果在室內的比較可行，因為戶外比較容易被破壞，你還記得我們臺灣設計展這次最新的新聞嗎？在西市場內就有小朋友很頑皮，用石頭把古蹟的玻璃給砸破了，雖然那個玻璃已經換新，家長也出來道歉了，我就覺得這個破壞力，可能在戶外比較難處理，那如果在室內，譬如說在您的選區，臺南公園底下的兒童教育館，在那裡面可以設置，會比較好。
蔡宗豪議員,好，這是一個選項，市長，我知道你剛剛擔心的原因，那當然選址就很重要，到戶外走走，有樹又有草叢，我覺得這樣是最接近大自然的，然後透過科技的結合，其實場地如果選得好，就不會有這些煩惱，不會有什麼打破玻璃這些等等的，所以也就像市長剛剛講的，場地的大小、場地的位置，這些都滿重要的，所以未來後續如果有機會的話，再請臺南市政府跟上。
黃偉哲市長,跟議員報告，我們來盤點現在各個公園，哪一邊的場地是比較適合。
蔡宗豪議員,那可能也要寫一些程式，就是我剛剛講的，因為AR是一個實際體驗，也需要做一些規劃。
黃偉哲市長,合作一些裸視3D的。
蔡宗豪議員,對，謝謝市長。接下來這個我想應該是全臺南市民都很關心的議題，就是針對綠線捷運進市區的部分，其實我只有兩大問題要詢問，因為今年年初的時候，有看到交通局找好了所謂的顧問公司，你們的新聞稿也寫得很清楚，預計年底會完成修正作業並提報交通部審查，第一個問題就是你們可行性研究的這些資料，貴府討論完之後，能不能如期在今年年底送到中央？
交通局王銘德局長,跟議座報告，除了原來的高架方案之外，我們有請顧問公司評估是不是有部分可以做地下化的可行性，因為這樣的可以服務到人口較為密集的區域。
蔡宗豪議員,我不先詢問內容，我們先討論時效性的問題，因為拖越久，成本就越高。
交通局王銘德局長,是，方案初步已經研擬出來了，那我們當然會跟市府各局處先討論，接下來會跟府層來報告，如果方案定案之後，我們會跟地方召開說明會來做說明，另外，最後也要送到議會來同意，我們還是以年底前完成確定的方案為目標。
蔡宗豪議員,好，謝謝局長，要來跟你詢問細項的部分，大家都知道高架的可能路線了，未來在火車站那邊會蓋一個新的站點，一路從平實園區過來，從小東路到北門路，再到公園北路，到公園北路要右轉西門路，就是明德國中校門口的T字路口，這裡我們有討論過，這個轉彎那麼小的直徑會不會有問題？
交通局王銘德局長,所以高架方案裡面第一個路廊的選擇，最後有共識的是這個方案，不過這個方案會面臨到您剛剛提到的公園北路轉西門路，這個轉角會侵入到民宅禁限建的範圍，所以這個部分勢必到時候需要有一些……
蔡宗豪議員,東側還是西側？
交通局王銘德局長,東側，因為它是右轉，到時候可能會侵入到東側這個角落的土地所有權。
蔡宗豪議員,那這部分也是我們評估的項目之一？
交通局王銘德局長,我們會把不同的方案，它可能要面臨的問題，跟後面要解決的困難，會一併來呈現，再跟市府來報告。
蔡宗豪議員,另外，如果不走高架，走地下好像就是會用潛盾的方式？
交通局王銘德局長,是，潛盾工法。
蔡宗豪議員,潛盾會遇到什麼困難嗎？能不能先讓市民知道一下？
交通局王銘德局長,潛盾的問題，第一要有出土跟入土的地方，因為出入的地方一定會有阻隔，下地之後，大部分就還是走在公共的道路上，如果穿越民宅會需要屋主同意地下權，所以除非萬不得已，不會去穿越私有土地的下方。
蔡宗豪議員,評估下來是會可能會穿越到私人民宅的下方？
交通局王銘德局長,除非萬不得已，比如轉彎時，我剛剛提到的那個轉彎，如果需要侵入一點點民宅，因為我們是地下化對他的建物不影響，但我要取得他讓我使用地下權的同意，所以我們在研擬地下化方案的時候有幾個原則，第一個是適當的找到出土跟入土的地方，第二個是希望地下化的這一段盡量將轉彎的次數減少，直截一點把里程數縮短，這樣子地下化的經費不會那麼高。
蔡宗豪議員,好，經費兩個比起來，這一段會比較高？
交通局王銘德局長,以高架跟地下的里程數同樣的看，地下化的經費會比較高。
蔡宗豪議員,好，譬如你經過忠義路、府前路，大家都知道，像我們服務處門口原本以前就是一個大水溝，所以在施工上，會不會有一些困難點？
交通局王銘德局長,潛盾大概是在地下十米左右，所以是地下的三層樓以下，當然如果要越過南鐵地下化會更深，所以需要調查周邊土地的使用情形，當然潛盾深度已經避開了文資的遺址部分，所以比如議員剛剛提到的水文或是其他的部分，顧問公司都會來做充分的調查。
蔡宗豪議員,好，因為這個是我們比較擔心的安全問題，當然我們也期待它可以更方便，都做了，那可以更便民，也可以使用量更高，但是當然關心的就是交通黑暗期，這過程當中，你們的評估會怎麼來做一個配套措施？
交通局王銘德局長,如果是走潛盾，要下去工作井的地方會占掉道路的面積，中間在推進時，其實不太影響，除非是站點的位置，站點位置可能是要明挖，所以潛盾施工期的交通影響是比較小的。
蔡宗豪議員,潛盾影響比較小，那我大概了解，謝謝局長，那就希望可以如期在今年年底，因為大家都知道現在是物價上漲的時代，你拖一天，物價上漲一天，好不好？
交通局王銘德局長,好，我們會儘速來跟府城報告。
蔡宗豪議員,好，謝謝局長，請坐。針對交通，局長，你們好像有得金擘獎，對不對？
交通局王銘德局長,是，最近財政部公布我們第二期智慧停車的計畫。
蔡宗豪議員,這滿棒的，市長，你知道臺南市有得到這個全國唯一的獎項嗎？
黃偉哲市長,得到金擘獎，跟議員報告最新的消息，我們教育的部分，也得到教育部數位教育的獎項。
蔡宗豪議員,好，要跟大家鼓勵一下，但是得獎是一個名。
黃偉哲市長,不得獎會被罵，會被人家講第17名。
蔡宗豪議員,這是事實，擺在眼前，針對得獎的部分我們希望能叫好也叫座，局長、市長，我們看這裡，臺南市現在應該是唯一有做路邊充電樁的，我想對於開電車、油電混合車PHEV等的車主，是一個很便利的事情，但是設備好都沒有人用，WHY？我們要去深入的檢討一下原因，那當然所謂的充電市場很多的比較，什麼人知道它的好壞？就是使用者知道價格的比例，對不對？所以這邊要跟市長說，其實我覺得臺南市算非常棒，我們這個可以做辨識的系統Acer應該是全臺唯一吧？
交通局王銘德局長,其他縣市也逐步在建置。
黃偉哲市長,智慧停車柱。
