speaker,content
蔡宗豪議員,智慧停車柱，我們非常厲害的地方在這裡，但又多一個充電，我來形容給大家聽，我今天如果開電動車，要在臺南市的路邊停車格做充電服務，一個小時的停車費用30元，充電費用一分鐘1元，一個小時充電的停車費規費30元，加一個小時的充電費用60元，總共是90元，充電一個小時，這不是快充，是慢充，可能是J1772 ，因為我本身開油電混合車，所以我大概知道內容，那算下來，我們的電能效率，一個小時應該是可以充到7度電，但是不一定每輛車都可以完全的收到7度電，像有些實際充進去的可能就3度、4度，先不討論度數，我們就先討論，如果以一個小時可以充7度來講，以90元換算，一度電要12.85元，所以這部分其實是遠高於市場行情，在議會門口的民間充電柱，一度電只要7元，那在百貨公司的可能只要8元、9元，臺南市的遠高於行情，這樣子的話，就很可惜，因為花了這麼多的錢在做這個建設，可是沒有人使用，常態性閒置，大家可以看一下左邊，這是臺南市的使用率，很差，這是9、10、11這三個月的使用率，非常的差，很可惜。
黃偉哲市長,跟議員報告，目前為止，各縣市的充電樁好像也都使用率不高，我們當初也是站在服務的性質。
蔡宗豪議員,市長，不好意思，這邊先跟你說一下，因為之前我有個新聞，我覺得對臺南市來講很可惜，好像就在說我們是全臺灣最不友善的。
交通局王銘德局長,可不可以容我解釋一下？
蔡宗豪議員,我就是在幫你解釋了，因為他們比較的是公有停車場內的充電，臺南市獨樹一格，我們是路邊停車就有充電樁的服務，我們不一樣，很多縣市現在才要跟上，要學我們，像臺北市現在要把路邊的充電樁送標檢局審，來看一度電有沒有辦法真的達到一度的標準。
黃偉哲市長,是不是一度電真的有充到一度，就像加油一公升是不是真的有到一公升。
蔡宗豪議員,對，所以其他縣市還在邁進當中，但是我們很可惜，就是我們有這麼好的建設，所以我這邊想要提出來，也想要給市府建議，不然閒置在那邊，真的很可惜，因為畢竟充電費我們是委外跟Azure來合作，不可能讓廠商不賺錢，一分鐘收1元，一個小時60元的電費，市府當然也有分潤，但是這是其次，主要是建議規費可以調整，或者是做一個優惠規費的部分，當初為什麼要求停車一個小時要30元？20元是一般停車，但是你如果是停在所謂的電動車車格，它為了要做一個保護的機制，不希望人家來占用，所以後來有改成30元。
交通局王銘德局長,應該是不充電的時候才30元。
蔡宗豪議員,對，不充電也是要收錢，所以我們要杜絕民眾霸占，但是我們有最好的設備，這個Acer可以做辨識，會辨識車子有沒有停在這邊充電，所以未來如果假設規費要做優惠或減免，讓這些路邊停車格充電樁多增加使用率的話，你們的辨識系統可以知道這輛車有沒有在充電。
黃偉哲市長,請議員給我10秒鐘來跟你回答這個部分，這個部分我們來檢討，我承諾檢討這個部分，就是說費率的合理性問題，可不可以給10秒鐘讓局長跟您報告，現在的狀況是不是這樣子？
交通局王銘德局長,謝謝議座，我想規費的優化，為了要鼓勵使用，我們會遵循市長的指示來處理，容我跟議座解釋，其實電動車為了要推廣它的普及，充電樁的建設工作是現在進行碳排政府的主要工作之一，可是在停車位上設充電樁只是其中的一部分，因為停車格還是屬於公共的資產，不管是路邊或者是公有路外停車場，其實主要是要提供民眾停車服務。
蔡宗豪議員,我非常認同。
交通局王銘德局長,所以目前優先推動在停車格上設充電樁的工作，其實是希望能夠很快的普及，可是它還是停車格，目前電動車的比例其實它會跟油車來競爭這個停車空間。
蔡宗豪議員,可是它比較不同的是，這個充電區是不希望讓不是開電動車的民眾來用，要有區別。
交通局王銘德局長,所以我們在選擇停車格設置充電樁時其實非常謹慎，會擔心它會不會排擠掉油車的停車服務。
蔡宗豪議員,這我認同，停車本來就要搶停車位，但是我講的是使用的部分，還有費率的問題，當然就是進一步調整，否則閒置在那邊沒有人用，很可惜，所以才會針對規費提出建議。
交通局王銘德局長,理解，第二個，我要跟議座解釋，就是我們在停車格上設充電的服務其實是要提供額外的服務，因為他主要的目的還是停車，他不會僅為了充飽電就來市府的停車格上充電，因為要多付一筆錢，他如果要充飽電，可以到類似議會這邊民間經營的，因為它就不是停車格，所以只收停車充電費，不收停車費。
蔡宗豪議員,我了解你的意思，可是現實面就變成我們的使用率非常的差，那建設的成本都投入了，我們希望可以讓它最大效益化，局長，謝謝，請坐，因為後面還有別的議題，你們研議一下。
交通局王銘德局長,是，我們會依照市長的指示。
蔡宗豪議員,市長如果願意，大家可以就規費來討論，再看後續的效果怎麼樣，未來如果他願意來試辦一年、二年是沒有規費的，就是收充電費，因為使用者付費，你來充電一定要收錢，你要停在這邊，一個小時收60元，合理，那這個時候，我們再來看一下在試用期的效果怎麼樣。
黃偉哲市長,對，我們願意去檢討這部分，充電樁車格是用來停車充電的，不是用來擺設用，所以我覺得我們會想辦法用種種的操作方式來提高它的使用率。
蔡宗豪議員,當然使用者付費，我們一定還是要維持這個想法，謝謝，針對這個部分告一個段落。接下來的議題是跟體育局、民政局相關，每一區都有一個所謂的全民運動中心，民政局局長，你對民政比較了解，在螢幕上你看得到的區域，在大臺南原市區中，有沒有哪一個區域沒有全民運動中心？
民政局姜淋煌局長,中西區、北區嗎？
蔡宗豪議員,中西區有。
民政局姜淋煌局長,北區？
蔡宗豪議員,北區，好像真的找不到，所以這是滿可惜的地方。
民政局姜淋煌局長,中西區有。
蔡宗豪議員,對，中西區有，就在中華西路附近，也非常的近。那全民運動中心，包括規劃中、招標中、新建中的，都沒有北區，所以我會想要在這邊做一個建議，那當然這個部分也要有適合的位置，尤其是在市中心地真的很難找，對不對？大樓林立，我們有注意到也很關心的就是九六新村，都發局局長，九六新村都更案是不是已經招標出去了？（按-北區尚無運動中心，九六新村應評估･社宅結合社區型運動中心･若無合適地點是否可盤點閒置空間運用？･九六新村可否結合圖書館及現代化市場增加居民便利性？）
都市發展局徐中強局長,對，上個月招標已經決標了，預計在年底會簽約。
蔡宗豪議員,好，那在簽約的過程中，我們可以討論一下，就是未來九六新村要蓋的是社會住宅？
都市發展局徐中強局長,再跟蔡議員說明一下，九六新村本身是都更，它是附帶用容積獎勵，跟其他的公辦都更案會取得社會住宅……
蔡宗豪議員,對，它有社會住宅在裡面，對不對？
都市發展局徐中強局長,對，但大部分還是……
蔡宗豪議員,我了解你的意思，你看像這個是淡水，他們的社會住宅有結合圖書館，很棒，因為社會住宅裡面的人一定很多，相對的使用率應該也會好，供公眾使用，也是一個很棒的規劃，再來，他們結合全聯開在這個社會住宅內，我覺得這也是一個很有意思的服務，社會住宅內本來就已經有確定的人數在裡面，提供大家一些可供公眾使用的場館、場地，在可規劃的範圍內，這不是一個很好的想法嗎？所以我就想來想去，有人問我，我們北區都沒有全民運動中心，所以我才會想說是不是可以評估看看？未來在九六新村的社會住宅內可不可以來做一個這樣子的公眾空間？
都市發展局徐中強局長,蔡議員，九六新村總面積約2公頃左右，要蓋一個社區的活動中心可能比較難。
蔡宗豪議員,不是，是運動中心。
都市發展局徐中強局長,這個我們再來評估看看，我們現在社會住宅是以社會福利設施為主，全民運動中心可能不見得完全可以算是社會福利，因為我們現在都是跟社會局合作。
蔡宗豪議員,體育局局長，請教你，全民運動中心算不算社會福利，運動，它的收費價格都是滿福利。
體育局陳良乾局長,都是同一個價位。
蔡宗豪議員,對，都是滿福利的價格，局長，再麻煩你們思考看看。
都市發展局徐中強局長,這個定義上還是有一點差異，我們再來評估看看好了。
蔡宗豪議員,不然局長，你有辦法想到北區的其他地點嗎？
都市發展局徐中強局長,那一天我們有去看過小北棒球場，那邊有一些是比較沒有用到的空間。
蔡宗豪議員,棒球場？
都市發展局徐中強局長,棒球場的後面那一邊有一塊，但是這個牽涉到未來建築法規的問題。
蔡宗豪議員,好，我希望可以大家研議一下，像我剛剛提九六新村這個地方，我為什麼沒有說要比照人家做圖書館？因為旁邊就是二中，對面的圖書館很近，那全聯、市場，那附近也有很多的傳統市場，所以我沒有特別提到，是因為這樣，所以這部分希望市政府可以來規劃一下，局長請坐。下一個議題是跟體育相關的，就是針對滑輪溜冰這個項目，我每一次的總質詢都有詢問，大家都知道東京奧運，有關心體育項目的人就有發現，有多了一項滑輪溜冰滑板，那滑板又分Park跟Street，就是有街道跟公園，那對於這一個新的項目，臺灣還沒有完整的比賽用地。
體育局陳良乾局長,體育場後面那一塊極限運動場正在規劃，現在已經在設計了。
蔡宗豪議員,市長，跟你報告一下，針對奧運滑輪溜冰新增的項目，中央計畫在全臺打造六座新的場地來培育選手。
體育局陳良乾局長,而且我們臺南的成績不錯。
蔡宗豪議員,非常好，像杭州亞運全臺灣17面金牌裡面，有7面是滑輪溜冰，所以我們應該要珍惜這些選手，給他更好的場地，那大家都知道，其實在永康有一個新設的場地，但很可惜，因為建築物的關係，沒有辦法做一個所謂的遮蓋，單項體育總會對於滑輪溜冰，他們也很關心，也很主動的幫選手來請命，也找了一些相關的設計單位，他們有請人家來畫這些圖片，針對花式溜冰場、曲棍、Park滑板溜冰場、Street滑板溜冰場，希望能做一個園區的概念，那為什麼要這樣做？除了給選手最好的場地之外，當都聯結在一起時，就可以做一個太陽能遮板，讓全世界的選手來臺南比賽時不會因為下雨而不能比賽，這是希望可以做到的地方，現在臺南市的滑輪溜冰場在哪裡？
體育局陳良乾局長,就是現在的永大滑輪溜冰場。
蔡宗豪議員,然後安平的叫什麼名字？
體育局陳良乾局長,國平溜冰場，是競速的。
蔡宗豪議員,OK，在國平路跟什麼路？
黃偉哲市長,健康路。
蔡宗豪議員,不是健康路，是國平路跟平通路，那一塊很大的地是國產署的用地，市長，你也知道，其實要做一些公共設施，要找地真的很困難。
黃偉哲市長,對。
蔡宗豪議員,那這邊有一個現成的國產署的學產用地，我們至少可以跟中央申請，就是我們要一個撥用，後續再來討論現有的用地。
黃偉哲市長,您方便告訴我在你的選區裡面。
蔡宗豪議員,不在我的選區內，是在安平，但是它使用率非常的高，因為它是一個完整的比賽用地，包括地目都是。像花式溜冰場，在東寧路那邊，它是公園用地，所以就只能讓民眾當作公園運動什麼的，你再讓選手去練習，也不可能排他，所以這邊如果可以做一個好好的規劃，你看到圖片右下角這是現有的這場地，那上面就是他們希望可以規劃來做曲棍球還是花式溜冰，因為花式溜冰本來在東寧路有，可是它是公園用地，而且旁邊都是樹，每次要比賽就要花一大堆經費，這一次我們審的預算內就有經費在做。（按-臺灣滑冰創佳績，盼無比賽級場地）
黃偉哲市長,跟議員報告，你也知道，原先六信那邊……
蔡宗豪議員,你說的是亞洲餐旅的那塊地，市長，我覺得這個部分也需要來講一下，亞洲餐旅現在有跟國產署認養，對不對？
黃偉哲市長,他們現在有跟國產署租。
蔡宗豪議員,沒有，不是租，是認養，現在市政府有規劃，到底是亞洲餐旅比較重要，還是臺南市的體育選手比較重要？市長要評估一下，今天不要說亞洲餐旅，任何一個民間單位要認養，市政府要規劃，我們合理的來做撥用，來為這些選手作為場地，不是剛剛好嗎？你現在跟我說有競爭還是有什麼？
黃偉哲市長,地是國產署的，需要國產署同意。
蔡宗豪議員,你跟亞洲餐旅是有什麼關係嗎？你有投資亞洲餐旅嗎？還是你有什麼金主在那邊嗎？我想沒有吧？
黃偉哲市長,沒有。
蔡宗豪議員,確定沒有？
黃偉哲市長,我確定沒有。
蔡宗豪議員,那為什麼我們不能合理的跟它提出撥用？你們跟中央提了嗎？
黃偉哲市長,我是希望大家能夠多討論。
蔡宗豪議員,當然要討論，但選手不能等，中央的錢，我也不知道會不會去蓋別的地方，好不好？體育總會這麼用心，這些選手這麼擔心，你們還不放在心上。
黃偉哲市長,就是放在心上很揪心，才要去協調。
蔡宗豪議員,你就只是講，我們已經講了快半年了，我們從8月就會勘那個場地，後來得知中央可能會有這個計畫。
黃偉哲市長,8月會勘到現在是2個月。
蔡宗豪議員,不只，我們是7月還是8月會勘的，反正已經過好幾個月，很久了。
黃偉哲市長,不管是2個月還是半年，其實我們都要努力的去找到合適的場地，因為上個星期也有臺南縣原來溪北的議會同仁，說滑輪溜冰場都放在市區內，難道他們都不需要？所以我們也在思考需要去做。
蔡宗豪議員,那我不知道你剛剛講的議員，他們那邊有沒有適合的場地，但是這邊就是一塊現有很讚的一塊國產署的地，可以來做一個世界滑輪之都臺南滑輪園區。
黃偉哲市長,你連名字都取好了，滑輪之都。
蔡宗豪議員,這名字不是我取的，就體育場來看，局長，你不感到窩心、感到驕傲嗎？有沒有覺得很棒？來臺南用我們的場地，看到臺南。
體育局陳良乾局長,我們的選手在全國也好，在國際也好，都有非常好的成績，明年的全中運把滑輪溜冰當作選辦項目，也是因為我們重視。
蔡宗豪議員,對，那麼重視，所以你今天要表示支持，市長來跟中央要經費，我們才能夠如期來做，對不對？
體育局陳良乾局長,體育局一定會努力的去協調。
蔡宗豪議員,謝謝，那就可以了，謝謝局長，那希望可以趕快撥回之後，趕快送計畫給中央，我們全臺南市這麼多立委，市長，我們這麼多東西都是林立委爭取的，其實我們有很多立委在中央，臺南很多的代表可以為我們發聲，我想體育應該不分藍、綠、白。
黃偉哲市長,當然。
蔡宗豪議員,所以市長你要有魄力一點，當然趕快去跟亞洲討論，是認養不是租借，誰都可以來做認養，但是今天市政府要規劃，我已經講得很清楚，我們是供公眾使用，市長，謝謝你，儘快來處理，希望三個月內給我們一個答案，謝謝。
黃偉哲市長,好。
蔡宗豪議員,"接下來這個議題要跟衛生局局長討論，先感謝局長，針對上一期提出六十五歲以上臺南市民免費骨質疏鬆檢測，其實這是很好的政策，可替民眾省滿多錢的，一次檢測好像將近1,000多元，因為我們也看到美國這個研究，好像是說聽力嚴重受損的族群罹患失智的風險比一般民眾高五倍，這個是對的資料來源嗎？"
衛生局李翠鳳局長,對。
蔡宗豪議員,你們的行動醫院其實做得非常好，也非常的紮實，但是我想長輩一趟路都已經到行動醫院了，是不是可以讓他做更仔細、更完善的項目？當然你說行動醫院整個在進行的時候可能會有一些噪音，還是有一些聲音，這部分我們能不能來克服然後再予以補助？
衛生局李翠鳳局長,目前的話，對於我們在檢測失智的項目當中，就包含了聽力，確實聽力跟失智是有一些學理上的關聯，那目前在行動醫院，我們在辦的時候常常都會借地方或者是學校的大禮堂，因為它需要環境比較大，但是人數很多，確實我們試驗過在那裡做，但是你會發現效果不好，是因為環境。
蔡宗豪議員,環境的關係。
衛生局李翠鳳局長,"聽力檢測就有一定的環境要求，所以目前我們跟140家醫療院所合作，今年到10月已經做了將近2萬6,000位民眾，其中也有發現11％的異常，也都做了轉介，將來有沒有可能去克服行動醫院這裡的一些環境上限制，能夠讓他們也在那個部分做，因為目前一年行動醫院大概是做3萬位，目前我們結合140家醫院也做了2萬多位，其實沒有差很多，但是我們也希望未來如果能夠克服環境，我們也可以做。"
蔡宗豪議員,好，因為其實大家都知道長輩的占比很高，尤其是臺南市的占比在全臺灣是很高的。
黃偉哲市長,我們的老年化是六都裡面占第三。
蔡宗豪議員,所以我覺得針對長者的一些福利，場地的因素還是要去克服的。
黃偉哲市長,謝謝，跟議員補充，我們這一次中央衛福部的健康城市評比，臺南市也獲特優。
蔡宗豪議員,很棒，我們會得獎都是因為有局處首長努力在一些建設上，當然需要市長支持。
黃偉哲市長,需要議會的支持。
蔡宗豪議員,一定都要，所以大家一起來加油，局長，針對這個項目再拜託，爾後，如果有再想到一些新想法，我還是會再給你建議，那也希望讓臺南可以更好，謝謝大家，我的總質詢到這邊告個段落，謝謝。
主席郭鴻儀議員,謝謝，好，謝謝蔡宗豪議員，現在休息到10點30分，再繼續進行市政總質詢。（休息）繼續進行市政總質詢，現在請周麗津議員質詢，時間50分鐘，周議員請。
周麗津議員,謝謝主席。市長、方秘書長、各局處首長，還有媒體各位好朋友、電視機前所有的鄉親好朋友，大家早，大家好，今天是由麗津來做市政總質詢。市長，你也知道今年是臺南400年，我也知道臺南400年占整體臺南市的預算很大一部分，我也知道臺南是文化古都，有多元化的族群，所以在這個土地上互動交流都是必要的，也希望能讓大家看到臺灣的臺南，所以今天想跟市長，還有市府團隊一起來討論一些相關問題。這次是本席今年第二次的質詢，在第一次質詢，就是今年初定期會上，市長和局長們，你們記不記得有跟麗津承諾過什麼事呢？希望不是風中的承諾，一吹就不見了。
黃偉哲市長,不會，大約是在冬季。
周麗津議員,好，市長，我也相信你交辦的事情，我們的首長都做得到。
黃偉哲市長,我很誠懇的跟你說，我們不管在議會詢答，您來告訴我們或其他議員來告訴我們，我們研考會都會去追蹤，但是如果有進度落後或甚至我們已經做出決策了，結果首長不遵辦，或底下的公務員同仁，他把你當作耳邊風，這是有考紀問題的。
周麗津議員,好，我要請教交通局跟社會局，在上個會期，本席有談到小黃公車和愛心計程車的部分，市長當時也說可以，這個部分我們會來研議，研議已經過半年的時間了，研議的方案現在有結果了嗎？請交通局先回答。（按-小黃公車跟不上，愛心計程車來幫忙。啥時來幫忙鯤喜灣的長輩？小黃公車來幫忙，阿公阿嬤外出免煩惱）
交通局王銘德局長,跟議座報告，小黃公車的部分，應該是說公共運輸的路線，如果有需要、有需求，我們就會研擬適當的車型跟路線運作方式，有關喜樹這個部分的公共運輸，我們在這一次整體路網調整裡面，除了會新增去高鐵比較直截的大車路線外，也會開闢喜樹灣裡新的社區路線，現在就是優先使用九人座的小型巴士來服務，如果這個部分可以滿足，因為小黃公車有座位數的限制，現在只用在溪北以及山區、海線的服務，我們會來探尋這個需求，然後研議一個比較適當的營運模式來提供服務，公共運輸的服務是我們要優先滿足的，這個我們會儘快來處理。
周麗津議員,局長，你們已經研擬半年了？
交通局王銘德局長,路線的部分會先有社區公車。
周麗津議員,社區公車，我知道有，可是我要小黃公車。
交通局王銘德局長,好，我們再跟議座討論它營運的模式，是不是能夠滿足在地的需要，當然定線定班。
周麗津議員,沒有需要嗎？
交通局王銘德局長,跟議座報告，我們的小黃公車當然有它的好處，可以有預約的服務，這個預約的服務要看路線的安排跟要去的目的地，是不是能夠來做一個搭配，因為小黃公車主要是把他載到主要的服務中心。
周麗津議員,局長，我覺得你們的效率真的很差，本席的助理在10月24日有詢問過處長，這個都有紀錄在，詢問處長說：「請問我們之前有關心過小黃公車到鯤喜灣舊部落的部分」，那處長也馬上回答我說：「是否有，明天我馬上跟科長稍微確認一下」，他也說你們有在討論，他也跟我講，我不會說謊，我也很老實的跟你們講，他跟我講最近年底的時候很忙，我也說你沒有先走一步，怎麼會知道遇到什麼困難呢？我說，希望你明天討論之後，馬上跟我說，那今天已經11月4日了，10月24日號到11月4日，經過了20天，處長，連一個消息都沒有給我？
交通局王銘德局長,謝謝議座，這部分我回去馬上跟處長來要求，我想我們請公運處再跟議座來回報，以及做後續方案確定的討論。
周麗津議員,要個資料真的有這麼困難嗎？總質詢是我們的權利，跟你們的要資料，為什麼這個樣子呢？
交通局王銘德局長,跟議座抱歉，這個我馬上回去要求，我們會跟議座立刻來做回報，以及擬定後面的推動方案。
周麗津議員,因為我覺得你們研擬了半年，會不會太久？其實鯤喜灣都是一些長輩，他們真的很有需求，不然我不會在總質詢這麼重要的時間一直來強調，這些長輩的孩子平常在上班，他們要去醫院或要去哪裡，一定是要靠著公車，為什麼你們做事都這個樣子呢？
黃偉哲市長,議員，我跟您報告，這個我可以這樣承諾，好不好？就是我們年底以前來規劃，然後明年開始實施，會給你一個期程。
周麗津議員,局長，有聽到市長的回應了吧？
黃偉哲市長,當然中間會有兩個變數，第一個是中央要核准補助，第二個就是我們要規劃來得及，所以可能會在明年初或明年中，好不好？
周麗津議員,好。
交通局王銘德局長,謝謝議座，我們會依市長的指示，也會跟議座來討論，了解在地長輩的需求來規劃合適的服務，我想像小黃公車在其他區域的服務都非常成功，沒有說這裡不可以，我的意思是說我們需要來探求服務，來研擬一個最適合在地需要的公共運輸服務形式，這個我們再來處理。
周麗津議員,希望能聽從市長的指示。
交通局王銘德局長,是。
周麗津議員,好，我也想跟市長說，小黃公車，既然你已經決定了，在愛心計程車的部分，上個會期，社會局局長你也有說過，臺南市政府有在研議愛心計程車了，是不是？
社會局盧禹璁局長,其實愛心計程車是放在長照接送服務裡面，這個長照接送服務目前有一百多輛車，但是計程車加入的比較少，我們分析原因是給計程車的利潤比較低，所以我們已經研議好，最近就會簽署通過，會增加給計程車的利潤，吸收計程車也來加入長照車隊。
