speaker,content
黃偉哲市長,好。
尤榮智議員,這是二、三年前在官田，臺南專利研發的消防水帶電動清洗收捲機，這可以說是獨創有專利的，市長，當時也都在現場，打火兄弟長期以來滅火救災的辛苦，若遇巷道所需要使用的水帶會越長，若是大馬路就不用，為什麼不能讓別的分隊也使用？電動水帶的設置要多少費用？
消防局李明峯局長,幾萬元，向議員報告，今年開始新購的車子都將此系統列為必要配備，以後會慢慢引進。
尤榮智議員,這能減輕消防人員後勤整治水帶的工作。
黃偉哲市長,像這樣的設備會趕快配置。
尤榮智議員,應該要做的就要去做。
黃偉哲市長,用二備金來支應。
尤榮智議員,這不用太多經費。
黃偉哲市長,對打火兄弟們會有直接的幫助，提升其工作效率。
尤榮智議員,不用歸隊後要捲、要吊還要洗，很麻煩。
消防局李明峯局長,是，謝謝議員，新的車子都已經列入配備中。
尤榮智議員,這應該加強一下，因為也有人在反映。
黃偉哲市長,主要是設備只要幾萬元就能處理。
尤榮智議員,幾萬元而已，也沒幾個分隊，這應該就能做到，感謝市長的支持，局長，你就以此目標繼續努力。
尤榮智議員,第4屆 第3次定期會 市政總質詢 983消防局李局長明峯：
尤榮智議員,是，謝謝。
尤榮智議員,謝謝。
主席蔡宗豪議員,謝謝尤榮智議員。接下來請穎艾達利議員質詢，時間10 分鐘。
Ingay Tali 穎艾達利議員,謝謝主席。市長，這次會期其實滿多同事都講到一件事情，就是府會之間彼此的尊重，特別是什麼？比方今天質詢的東西、問政的東西、提案的東西，進度是不是要主動的跟我們講，而不是一直追，這件事講多久了？改變了嗎？是因為你的施政魄力有問題，其它28 個局處首長不鳥你還是怎麼樣？
黃偉哲市長,跟局處首長的感情都很好。
Ingay Tali 穎艾達利議員,溝通是有問題的嗎？還是這些人不是你的人，是別人的人。
黃偉哲市長,誰的人都是國家的人。
Ingay Tali 穎艾達利議員,包含今天講的互相尊重，但你臺南市政府有尊重地方的議員嗎？文化局今天下午要辦一個活動，不到2 個小時前打電話給我，問我要不要參加？好，千趕萬趕到現場之後簽到的紙張上面沒有的名字，你call 我們要當什麼？是小芸嗎？是愛佳嗎？
黃偉哲市長,這個不行。
Ingay Tali 穎艾達利議員,不行，這種事情發生過多少次？觀光旅遊局之前講過，觀光旅遊局改了，現在就像打地鼠一樣，接下來是文化局跳出來，還有之前就講過，再問什麼東西，關心什麼議題其實是平常就要溝通的，對不對？一個禮拜前你不要找我，結果到今天早上政風處還七早八早打電話給我，問我今天要問什麼？這個不叫溝通，市長，這叫做作弊，來問題目的是不是？希望你府層拿一點魄力出來，把你的局處首長管好，懂得什麼叫尊重，假日也是儘可能不打電話去吵到任何一位局處首長，這是大家彼此的尊重，可以嗎？市長。
黃偉哲市長,對，政務官也都沒有分假日的。
Ingay Tali 穎艾達利議員,當然也沒有分假日，但是我尊重你們，可能需要休息或需要陪伴家人的時間，這可不可以做到？市長。
會努力的，Ingay Tali 穎艾達利議員,謝謝市長。文化局請坐。我請教一下市長，臺南市有多少身心障礙人口？知不知道？
會努力的，Ingay Tali 穎艾達利議員,第4屆 第3次定期會 市政總質詢 984黃市長偉哲：
會努力的，Ingay Tali 穎艾達利議員,大概佔總人口的8%吧。
社會局盧禹璁局長,報告議員，將近有10 萬人。
Ingay Tali 穎艾達利議員,"現在將近10 萬人，約9 萬9,000 多人。市長，我請教一下你覺得身心障礙的這些人士能夠做些什麼工作？"
黃偉哲市長,因為他不同的障礙別，可以做的不一樣……
Ingay Tali 穎艾達利議員,你現在可以想到的，你的印象中所想得到的。
黃偉哲市長,如果是肢障，也許可以做文書工作，視障者可以做的東西也不一樣，聽障者所能從事的活動也不一樣。
Ingay Tali 穎艾達利議員,這樣講很模糊，但這就是目前的刻板，我再請教一下市長，市長不好意思這不是什麼詛咒，假使你今天是一個身心障礙人士，假使你28 個局處會首長是身心障礙人士，你們能不能去想像說在你日常的生活中甚至要應徵工作時會碰到多少的困難？這可以理解，可以想像嗎？
黃偉哲市長,當然將心比心，是儘量用同理心來……
Ingay Tali 穎艾達利議員,我覺得是想像不到。
黃偉哲市長,也許沒有辦法周全，但是出發點會想到。
Ingay Tali 穎艾達利議員,而且會很多刻板，會覺得說我眼睛怎麼了、我手怎麼樣我就只能做什麼工作。
黃偉哲市長,對，當年也是這樣子。
Ingay Tali 穎艾達利議員,所以這就是為什麼我在業務詢答時有拜託勞工局、社會局、衛生局及經發局一起來做一件事情，就是職務再設計。
黃偉哲市長,我同意，因為不要用自己的想法，就認為別人應該怎麼樣，就當年政府要替蘭嶼的原住民蓋在國宅的意思一樣。
Ingay Tali 穎艾達利議員,我知道，這個案子我特別去查過你之前在立法院的詢答記錄，這個我知道。我的意思是說臺南市政府要主動地去幫忙，而不是在現在的職種當中找到那些坑，然後塞人進去，不是這樣。為什麼要經發局？就是希望能夠透過與公司行號的接觸過程當中……
Ingay Tali 穎艾達利議員,第4屆 第3次定期會 市政總質詢 985黃市長偉哲：
Ingay Tali 穎艾達利議員,你是說職務工作內容再設計？
Ingay Tali 穎艾達利議員,職務內容再重新調整，for 身心障礙者，他們難道不是勞動力嗎？不能一天到晚他們要去做餅乾呢？不能一天到晚只叫他們去洗車吧？這件事情我當時講了，只有社會局回應我，我希望經發局一起幫忙，經發局鳥不鳥？不鳥，衛生局鳥不鳥？衛生局也不鳥，不關它的事情，衛生局現在只做防疫工作而已。勞工局應該要做職務再設計，這個課程訓練怎麼樣去推到公司行號裡？勞工局做了嗎？沒有。勞工局現在忙著告訴大家愛心修繕多好多好。
黃偉哲市長,但也不能只focus 在愛心修繕。
Ingay Tali 穎艾達利議員,當然，一直講除了互相尊重外，老問題就是彼此的橫向聯繫你們到底做了多少？這件事情反覆在講，方秘書長都被我講到耳朵長繭，我相信你也去要求，可是局處首長有鳥你嗎？還是因為看到你再做二年就不是市長？怎麼約束？
黃偉哲市長,會加強約束，你剛剛提到的就用考核制度來約束。
Ingay Tali 穎艾達利議員,麻煩一下，職務再設計真的要推出去，我希望針對身心障礙者的職務再設計做好之後，接下來也可以針對原住民重新再設計職務，而不是說你就是去環保隊，你就去就學校花園工……
黃偉哲市長,還有族語老師。
Ingay Tali 穎艾達利議員,很多，應該是有很多的，講到族語老師，算了，不要跟你講，浪費我時間，這個教育局也不管，跟他講要如何導入業師制度他也不要，他跟你講法規現在就是這個樣子。再來，你們兩位都請坐，資料給我就好，提供你們的做法。再來，當這些身心障礙者碰到經濟生活困頓的狀況，兩個交乘之下其實會有很多很多的困難，在就業上的困難，在生活上的困難，單單跳脫所謂醫療費用來看，我在業務詢答時也講過，很多的人可能因為疾病問題需要有必要的醫療行為，但他不見得有能力去支付，而且這些項目可能是目前健保或者商業醫療保險不承保的。所以我拜託衛生局是不是能夠呈請中央，試試看來找官股銀行辦一個低利的擔保貸款，讓其能夠支付醫療費用，然後中央政府再補助低利貸款的利息，這樣等於是變相的讓患者可以用無息方式去分期償付醫療費用。
黃偉哲市長,那你願意去努力，但銀行在意的是壞帳的問題。
Ingay Tali 穎艾達利議員,沒有錯，這個問題很清楚知道，但我想說這部分就是要麻煩你，為什麼在這時候講，因為要讓市長能做承諾，包含你會約束衛生局，會利用北上開會的時間真正的去提出這樣的要求，因為這東西真的是臺南市可以做的，好不好？
Ingay Tali 穎艾達利議員,第4屆 第3次定期會 市政總質詢 986衛生局李局長翠鳳：
Ingay Tali 穎艾達利議員,報告議員，已經納入九月份全國會議……
Ingay Tali 穎艾達利議員,納入你們會去中央講的議題中，可是要有進度、結果，包含像之前講到牙醫的支付點數，你也跟我說你們會反映，但今天公部門不是只做反映的事，好不好？
衛生局李翠鳳局長,因為這個是……
Ingay Tali 穎艾達利議員,這是中央級別要做的事，所以才要你們去講。
衛生局李翠鳳局長,是，所以會提案。
Ingay Tali 穎艾達利議員,但不是單純只發文告訴我這個建議已經有反映，這樣就算數，好不好？
衛生局李翠鳳局長,不是，只是讓你知道的進度。
Ingay Tali 穎艾達利議員,麻煩你。市長，畫面上這些字句知道吧？
黃偉哲市長,已經被你指正過。
Ingay Tali 穎艾達利議員,也已經改了對不對，可是我覺得很好奇，這個工作明明就是經發局市場處去招標的，然後由委派單位去做，才會有各個攤商，難道都不會預先知道它會怎麼發嗎？有那麼多的節點可以處理，為什麼要搞成這個樣子？
黃偉哲市長,基層同仁他們不會想到……
Ingay Tali 穎艾達利議員,你們不是在做第二官方外語嗎？我是不好意思叫你們舉手，你們多少人都是留美、留英的。
黃偉哲市長,這跟留學國家沒有關係。
Ingay Tali 穎艾達利議員,我的意思是說，至少會有初步的sense，當然原民會也是一樣，今天原住民的這些攤位來，是不是……
黃偉哲市長,基層同仁都是經過國家考試結果做出這種事情，我也覺得很遺憾。
Ingay Tali 穎艾達利議員,是不是麻煩原民會針對原民攤商做協助整理，讓他們有一個中文的標示，等到經發局招商的時候，有族人的攤位，直接把書面資料送上去就可以，這樣可以符合他自己的設想及意願，也符合國際溝通的慣習，這麼簡單的事做得到嗎？做不到，很奇怪，臺灣第4屆 第3次定期會 市政總質詢 987燈會的時候我就在講，翻譯也不幫忙翻譯，裡面的產品也不幫忙做說明，試試看，既然都講說要國際化，只是把名單收整好告訴他們說，有這些攤位你們要不要來擺攤？就這樣雙手一攤，公部門做這種事情就好，你們好意思拿七、八職等的薪水？
原住民族事務委員會白惠蘭主任委員,議員，已經在加強，也在改善，課程也導入。
Ingay Tali 穎艾達利議員,好不好？經發局也要特別注意，這不是一、兩次。
經濟發展局林榮川局長,是。
Ingay Tali 穎艾達利議員,跟體育局沒什麼太大關係，這部分我希望大家彼此尊重，你也尊重你的工作，我尊重我的工作，拜託你們也尊重你們……
主席蔡宗豪議員,謝謝穎艾達利議員。接下來請陳秋萍議員質詢，時間10 分鐘，陳議員請。
陳秋萍議員,感謝主席。大家早上好，本席首先要感謝姜淋煌姜局長，姜局長，大家都知道民意代表或里長當選後通常都是一人當選、全家服務，他們任用的鄰長一樣也是具有榮譽感，可以說是全新全意的投入，只要是公所或里長交付的工作除了鄰長一人之外，他們全家都會幫忙完成，六月初是鄰長研習活動的期間，從現在開始會辦到結束，我去參加鄰長這次的研習活動，他們向我反映，為什麼他們的眷屬不能參加？這有一點不合理，所以趕快函文給你，請你趕快研商這部分規定，你也非常積極在最短時間內函文給37 區公所，說明可以攜眷參加，但是要自費。
民政局姜淋煌局長,是。
陳秋萍議員,本來他們就知道要自費，只是我納悶為什麼眷屬不能前往，就像我剛說的他們都是全家在服務，既然是研習，眷屬一起研習就等於培訓，讓他們參與課程也是一個很好的機會，所以你這次做了很明確的決定，要誇獎你一下。
民政局姜淋煌局長,"要感謝市長對鄰長福利的支持，去年是3,000 元現在則變成3,200 元，大家去玩回來也覺得方便，包括眷屬一起參與，一臺車坐20 名和坐40 名的車錢是一樣的，也讓家屬能共同參與，不過眷屬就是要自費。"
陳秋萍議員,有時候還可以以量制價，對不對？
民政局姜淋煌局長,是。
陳秋萍議員,再次謝謝你，謝謝。
民政局姜淋煌局長,第4屆 第3次定期會 市政總質詢 988這是應該的，感謝議員的提醒，謝謝。
陳秋萍議員,"你請坐。西灣里滯洪池整體環境的改善規劃，邱局長，感謝你非常積極，從市長答應後你就非常積極地與本席研討，上一會期我在5 月31 日總質詢時的概算、細部計畫等都出來了，需要經費5,300 萬元，5 月31 日時你也回答本席說經費沒有問題，所以現在我想了解經費何時可以編列？什麼時候可以啟動建置？"
黃偉哲市長,向議員回覆，這是未來的政策方向。
陳秋萍議員,市長，永康居民都非常期待，我也知道你答應後就沒問題，但希望期程可以快一點。
黃偉哲市長,對，研考會就會去追蹤，具體的期程會書面回覆你。
陳秋萍議員,市長，我是想知道經費何時可以撥下來、何時可以動工及何時完工？這比較重要，雖說要追速度，但你們不要像老牛拖車半年才一個小動作，一年再一個小動作，我跟你說我不希望這樣子。
黃偉哲市長,議員，過去當過同事。
陳秋萍議員,我知道。
黃偉哲市長,從縣政府、市政府到現在，一直在精進中。
陳秋萍議員,我知道，市長，我知道你很關心所有臺南市民，不只永康區，全臺南市你都非常關心，所以我也一直很稱讚你積極的做事，但市長你也要開始逐年編列經費。
黃偉哲市長,儘快逐年編列，就像做活動中心，可以的話今年二備金就用來做規劃費，這是積極的態度。
陳秋萍議員,我知道，所以滯洪池濕地公園也希望你能快點，今年年底趕快編列預算好嗎？讓明年可以動工，這樣好嗎？
黃偉哲市長,好。
陳秋萍議員,市長，你知道畫面上是哪裡嗎？
黃偉哲市長,總圖附近吧！
陳秋萍議員,不怪你，現在很多新興開發區都是蓋滿大樓，現在都蓋好多棟大樓，這在永大重劃第4屆 第3次定期會 市政總質詢 989區內。
黃偉哲市長,在哪裡？
陳秋萍議員,永大路，就在滯洪池後面，溜冰場後面，你有看到停車場嗎？
黃偉哲市長,可能是臨時劃的停車格吧。
陳秋萍議員,有停車格，我這張圖是想指出那邊的大樓都已經蓋了很多，我相信陸續會興建更多，人口更是會暴漲，市長，前次定期會本席要求公園開闢需納入停車考量，為什麼要納入考量，因為當時溜冰場的開幕我們有去，才2、30 輛車就無法再容納，當時我也向你提出要求。
黃偉哲市長,你那時候有先見之明。
陳秋萍議員,這是非常大的需求，市長，要未雨綢繆。地政局請坐，體育局陳局長，你有看到且感受到停車場的需求，所以你在原停車場也就是溜冰場後面開闢臨時停車場，有近100格的停車位，是不是這樣？
體育局陳良乾局長,對。
陳秋萍議員,"表示你有眼光。問題來了，市長，什麼問題來了？濕地公園上面有平面的公園，整個公園以後便是新亮點，你們命名為旗艦遊戲場，還加上滑輪賽道，注入了很多元素，我都非常高興，因為大家共同來參與，甚至同事，大家都一起來參與，這是一件好事，你現在看一下，圖上紅色的點呈現了現在的停車空間，只有約1,000 平方公尺，原本可以放100 輛車的停車場卻不見，剩這樣的空間可以停放多少車輛？交通局局長請你起來回答，我有打電話去詢問，1,000 平方公尺約可停放多少車輛？"
交通局王銘德局長,大概2、30 輛。
陳秋萍議員,市長，這到底是什麼邏輯？一個新興區域，一個進步的城市，本來可以放100 輛車的停車空間現在規劃後卻只剩2、30 個格位，這到底是什麼概念？
黃偉哲市長,停車空間規劃倒退的情形，我向議員報告一定會努力極早因應改善。
陳秋萍議員,要怎麼改善？最起碼要讓我知道，現在的初步規劃讓我看了差點昏倒，這是什麼概念？
黃偉哲市長,我聽到議員這麼講，我也覺得很不可思議。
黃偉哲市長,第4屆 第3次定期會 市政總質詢 990陳議員秋萍：
黃偉哲市長,一個新的亮點，我相信……
黃偉哲市長,可能原先100 格都不見得夠了，現在縮成2、30 格……
陳秋萍議員,我跟你講，溜冰場常會有賽事，所以也有需求，未來那裡住戶也會非常多，加上現在旗艦遊戲場又即將啟動，這樣一個新亮點，之前去的時候只有2、30 輛車就快沒地方停，現在又把100 格改成20、30 格位，這絕對不行，市長。
黃偉哲市長,會來儘速做改善計畫。
陳秋萍議員,我要求你們要檢討停車場的配置，若可以的話往下挖，做地下停車場，像水萍塭公園現在也規劃得很不錯，大家風評也很好。
黃偉哲市長,那邊的停車場使用率也很高。
陳秋萍議員,對，還有一點，我希望你們在檢討、規劃時，要知會相關單位，大家一起研討，最起碼交通局要知道，一塊那麼大的停車場地突然就這樣不見，只剩2、30 個格位，這個很受傷。
黃偉哲市長,是。
陳秋萍議員,這樣對整個永康區來說是很受傷的。
黃偉哲市長,所以在接下來的工程進行前會先規劃好。
陳秋萍議員,沒有錯，市長，朝此方向、目標前進，OK，你們請坐。
主席蔡宗豪議員,謝謝陳秋萍議員。接下來請吳通龍議員質詢，時間10 分鐘。
吳通龍議員,謝謝主席。市長、秘書長及各位局處首長，今天10 分鐘的時間，我希望能再好好討論百姓非常關心的國土計畫，目前國土計畫的管制規定已經有編列特目、特登及建地等非農地將依原來目的使用，不受劃入農產業發展區影響，所以我一直非常關心，規劃農1 與農2 到底合不合理？我先說農水路的問題，以前是V 型溝，現在變U 型溝，改善後圖上這個部分是不是都會多一塊空間出來？農業局局長，我跟你說，這塊未來在施工完後還是要想辦法把它鋪設好，若沒有做好，有時機車會車時，尤其像現在下雨天很有可能在這裡打滑，你的看法如何？這個問題百姓們常常在反映。
農業局李建裕局長,在非重劃區內很少看到這樣的情形，都針對非重劃區內的水路進行改善。
農業局李建裕局長,第4屆 第3次定期會 市政總質詢 991吳議員通龍：
農業局李建裕局長,不管重劃區內或非重劃區內都一樣，這部分我認為還是要想辦法做好，在水溝做完時一併做還是隔一段時間再做，都一定要做好，我相信特定農業區在地政局施作下，同樣的情況應該都有做好吧？
地政局陳淑美局長,向議員報告，都有做，做完後農路都會拓寬。
吳通龍議員,我知道，都已經有做，你有說與市長一起過去看，我也有參加過。
地政局陳淑美局長,對，市長也有去視察，都有拓寬。
吳通龍議員,農業局局長，你的管轄範圍都是非重劃區的，不是重劃區的地方也是一樣要做，你看地政局局長也說他們都做了，我希望……
農業局李建裕局長,我來了解看該如何改善。
吳通龍議員,一般農業區也要做，好不好？
農業局李建裕局長,好。
吳通龍議員,我相信這是很合理的，百姓們騎機車去巡田時才不會打滑跌倒，這是安全性的問題，好不好？
農業局李建裕局長,是。
吳通龍議員,先講國土計畫的問題，在國土計畫中農1 與農2 有很多不合理的地方，沒有重劃的地區，因為當時沒有重劃是因為有高低不平的問題，現在國土計畫是否要把它變為屬於容納的土地？
地政局陳淑美局長,向議員報告，以前有農業地重劃的地區大概都是特定農業區，在轉軌到國土計畫時它也可能是農1，臺南市在國土計畫實施之前已經有呈報內政部一批，針對沒有農地重劃或議員剛所說的高低不平的，將過去農業條件較不好的轉為一般農業區，那批轉了很多，已經轉為一般農業區的在這次在國土計畫中也是把它劃為農2，不只這批，包含過去整個農業區，根據農地資源調查所劃設的，現在針對民眾陳情覺得不合理的，也會根據中央的原則逐一檢討，民眾如果有陳情進來的也會逐案討論。
吳通龍議員,局長，我常說什麼叫國土計畫，國土計畫目前外面大家都稱之為惡法，為什麼是惡法？大家都不認同，百姓們都罵聲連連，真的是怨聲四起，若你們有在基層走動應該也會有很多人向你們反映這個問題。
吳通龍議員,第4屆 第3次定期會 市政總質詢 992地政局陳局長淑美：
吳通龍議員,這我了解。
吳通龍議員,因為國土計畫就是要將不合理的土地變更，例如我時常在說的六甲納骨塔，那邊若下雨時水都會往平地流，為什麼把它設定為特定水源保護區？應該在國土計畫中把它重新整編，是不是這樣？
地政局陳淑美局長,是，我覺得議員的意見很好，這就是要與中央各單位來研商，鄭文燦副院長在開會時也提到國土計畫有很多問題，包含各部會缺乏橫向連結，導致後續在劃設時如已經在堤防外的地還是流域治理地區，為什麼在下游的地還是水質水量保護區，這都要從中央圖資方面來檢討。
吳通龍議員,對，所以我常說不是中央說怎樣就怎樣，對不對？也要實地的勘查一下。
地政局陳淑美局長,實地逐案的來檢討。
黃偉哲市長,我向議員報告，我也知道地方上的心聲，但另外一群人很強烈的要求國土計畫要如期實施，而且要加碼做，你知道吧，另一群人主張這樣。
吳通龍議員,如期實施沒關係，但要像我常講的把不合理的土地修正好。
地政局陳淑美局長,沒錯，而且要因地制宜。
吳通龍議員,我時常說什麼叫水源保護區，是指水會往水庫流才叫水源保護區，這樣有道理嗎？
都市發展局徐中強局長,"我向議員說明一下，這次市長與很多議員都很關心這個問題，在農1、農2 劃設方面，農業局在今年初也做了整體的檢討，已經調整了原來公開展覽的草案，將4,800 公頃土地從農1 劃到農2，其中議員關心的官田區約有60 公頃已經從農1 轉為農2，六甲區也約有18 公頃，現在還在國土……"
吳通龍議員,局長，我看不只那些而已。
都市發展局徐中強局長,我知道，還在持續檢討中，因為有很多民眾陳情，還在逐案檢討中，後續還會適當調整，剛才地政局局長也有說明，在國土三階這時候有劃了一些特殊管制變更原則，合理的部分還會逐步檢討，也非常感謝吳議員的關心，同時在此也說明一下，你也點到一個重點，在區域計畫轉換成國土計畫時原來在非都的使用編訂上已經有既有的合法權益，在轉換到國土計畫時是被保障的，包括農1 將來要申請休閒農業都還是可以的，所以這個部分也要向吳議員說明一下。
吳通龍議員,第4屆 第3次定期會 市政總質詢 993國土計畫實施以後所有的農2 都不能做其他使用，這讓民眾們感到懷疑。
地政局陳淑美局長,向議員報告，這就是既有權益保障，像議員所提到的建地的部分……
吳通龍議員,像現在都發局局長所說的與外面的說法截然不同。
地政局陳淑美局長,因為外面也有批有心人士蓄意的說你的土地將來實施國土計畫後就沒有價值，請你賣出來……
吳通龍議員,什麼都不行，只能種稻米可以，只能務農不能作為其他用途使用。
地政局陳淑美局長,這不符合國土計畫的規定，對於既有權益保障，例如原本是甲建、丙建這些土地在轉換過程中還是保障其原有建地的權益，這是非常明確的。
