speaker,content
沈家鳳議員,我們要立即保護當事人，社會局，針對居服員，上次我在總質詢時讚美過社勞的福利政策是最好的，但是管理人的問題真的層出不窮，很難管理。針對社會局的業務，在照服員管理的相關責任也是落在您的擔子上，所以為什麼我會要求市長成立長照處，讓您們可以專責管理這些部門。因為現在長照單位、居服單位已經很多了。
社會局盧禹璁局長,"1,600多個。"
沈家鳳議員,對，您們要怎麼管理、統籌下面的居服員，您們有什麼方式可以管理？針對這個案件，我也想知道您們怎麼處理？因為從2023年6月到現在都還沒有處置好，表示我們真的沒有積極協助受害的家屬，我覺得這樣是非常不對。局長，您有什麼要澄清的？
社會局盧禹璁局長,針對這個案件，它雖然是2023年發生的，但是今年才報社會局，報了之後我們就立刻協助，包括對居服員罰款。
沈家鳳議員,不是只有罰款而已，您有沒有去調查這位曾姓居服員服務過的居家照顧的長輩？有沒有通報他們的家屬，應該要做什麼樣的確認，可能有很多案例。我已經接到第二個狀況了，拿存摺跟印章去領錢，這只是冰山的一角。所以針對這位照服員還有這個機構，您們怎麼處置，這個很重要。
社會局盧禹璁局長,對。
沈家鳳議員,針對這方面，我希望您們可以好好改善一下您們的管理辦法，我相信大部分的照服員都是非常優質的，但我們不能因為少數的害群之馬，現在讓大家人心惶惶。這些居家照顧使用者或是長輩的家屬可能都陷入恐慌的狀態，這要付出非常大的社會成本。
社會局盧禹璁局長,是。
沈家鳳議員,府方應該做好所有的監督責任，提醒您。
社會局盧禹璁局長,是，謝謝。
沈家鳳議員,不要假借長照之名行詐騙之實，有害國家政策的門面，這個茲事體大，我相信真的有很多案例，只是沒有爆發出來，我們真的要好好處理，市長也好好想想是否需要成立長照處。
黃偉哲市長,您剛剛講得很對，沒錢、沒人，不好辦事。我們現在就是要把體制建立起來，就跟剛剛跟蔡議員講的，把制度建立起來，把什麼制度建立起來？做長照就不能跟當事人有任何瓜葛。
沈家鳳議員,要怎麼樣遏止？因為他們都是一對一，所以如果事情沒有爆發出來，很難知道問題在哪裡，這方面要怎麼監督？或者研考會有什麼相關的政策可以協助，大家思考一下要怎麼管理人的問題，人事處也可以想出最好的決策，希望我們要好好善盡監督職責。
沈家鳳議員,社會局，我也跟您反映過了，我們到社區關懷共餐時，有里長反映長照共餐只有針對65歲以上的弱勢族群，65歲以下的弱勢族群，是不是可以一併照顧？其實里內的里長、社區理事長或是地方人士會自掏腰包協助照顧里內的這些弱勢族群，您覺得能不能把他們納入共餐？
黃偉哲市長,您講得很對，對於年長者的共餐，或是將來要不要納入弱勢者，我們都會仔細評估，評估是往擴大的方向，從年初到現在已經服務108萬人次，才10個多月就有108萬人次，表示這個政策非常受到歡迎。
沈家鳳議員,在臺南的共餐服務確實是做得最好的，大家有目共睹，但是我們希望可以向下，這些弱勢族群也應該要被照顧，他們的健康、他們的營養，因為有時候他們整天只吃一餐， 對弱勢族群，都會特別裝多一點給他們，讓他們可以一餐當好幾餐吃。
黃偉哲市長,還有幫他們送餐，有人行動不方便，送到他們那邊去。
沈家鳳議員,臺南做得非常好，我希望好還能再好，因為是里長反映這樣的狀況，不然我們也不知道，以為是弱勢族群都有包括在內，瞭解之後才知道這是遺漏的一角，這個看看能不能納入處理。
沈家鳳議員,再來還是社會福利，這是我選舉的政策，我說到都希望我能做到，現在已經很多都已經達成了，有的甚至還要更高。其實孕母很辛苦，但有時候家庭的狀況不允許，現在臺南市坐月子要多少錢，市長您知不知道多少錢起跳？
黃偉哲市長,我沒有生過。
沈家鳳議員,最少20萬以上。
黃偉哲市長,坐月子要20萬！
沈家鳳議員,我第一胎的時候7萬元就可以住40天，現在隨便一間都要超過20萬，甚至在臺南市區要30幾萬，所以生一個孩子負擔大不大？市府應該好好照顧這些孕母。
黃偉哲市長,收費應該更合理化一點。
沈家鳳議員,合理化以外，現在都把等級做得非常高。
黃偉哲市長,但是他們給工作人員的人事費沒有增加，薪水沒有增加。
沈家鳳議員,是，我們希望整個檢討，但是我覺得孕母相關的照顧，像健康檢查就是衛生局的業務，我知道有補助健康檢查相關的費用，但只有500元還是1000元？這是孕前的健康檢查，孕後的健康檢查，我知道健保都有給付。但是我希望針對這些高齡產婦，跟我一樣，我今天特別穿了我的孕婦裝來，回憶一下自己孕期時候的辛苦，我覺得高齡產婦需要做的檢查真的比一般年輕產婦還要多，要受的痛苦也比較多、壓力也比較大，我們要怎麼照顧？希望可以針對高齡產婦的健康檢查可以增加相對的補助，可以嗎？
衛生局李翠鳳局長,目前是這樣，如果是比較高齡，需要做很多健檢，特別怕可能有遺傳疾病，這些健保全部都有給付，對高齡者來講，比如說我們也會擔心子癲前症。
沈家鳳議員,有些自費的，像優生學方面就要自費做一些特別的檢查，所以這方面我們再研議一下，是不是可以增加一些針對高齡產婦的健檢？
衛生局李翠鳳局長,好，我們再提供更多服務。
沈家鳳議員,社會局長，針對好孕來的政策，我們有針對弱勢族群補助坐月子的時數，但就像不孕症的補助一樣，一開始都是補助弱勢團體，我希望也納入一般家庭，讓他們都可以享有這樣的福利可以嗎？我們來評估一下，不管是時數的高低，或是第一胎、第二胎、第三胎一直增加的。
主席陳皇宇議員,謝謝沈家鳳議員，接下來請許至椿議員質詢，時間10分鐘，許議員請。
許至椿議員,"感謝主席。我先請問一下主計處，我們今年預算編列是不是1,246億？"
主計處方盆處長,是。
許至椿議員,"我們的歲入是1,202億？"
主計處方盆處長,差40幾億。
許至椿議員,差44億，我請問一下短缺的平衡預算怎麼彌補？
主計處方盆處長,就是借款。
許至椿議員,現在的借款債務每年利息是12億，還要再舉債？舉債上限是向誰舉債？怎麼舉債？
財政稅務局李建賢局長,報告議座，目前臺南市的舉債額度大概控制在400多億左右。
許至椿議員,我們的上限可以到幾億？
財政稅務局李建賢局長,"可以到1,700億。"
許至椿議員,平均只有三分之一？
財政稅務局李建賢局長,對，目前大概只用掉28％左右。
許至椿議員,現在利息是每年12億嗎？
財政稅務局李建賢局長,今年是編12億，但是到10月為止大概只用掉8.5億。
許至椿議員,我請問一下平衡預算的問題，歲入那麼少，還有44億才能平衡預算，當然在預算法上是合理，但是這個缺口是透過舉債填補，必要的時候就是舉債來建設，是不是這樣子？等於我們的利息會增加，在統籌分配款裡面，財政部有沒有辦法補我們這個缺口？
財政稅務局李建賢局長,這部分不會納入，統籌分配稅款沒有考慮到地方舉債的利息。
許至椿議員,好，謝謝，您們有自己平衡預算的概念方法。
許至椿議員,接著我們來講地方建設，請問一下交通局局長，也要誇獎您，目前社區型的停車空間陸續在開闢，當然要平衡發展，就是溪南、溪北的都市發展，我希望您能夠布局，未來在都市發展裡面能夠平衡發展。第二點就是現在都市裡面有很多的左轉彎汽車道，我覺得效果很好，我的服務處接到很多民眾好評，因為有左轉車道可以跟直行車分道。
交通局王銘德局長,不會阻擋。
許至椿議員,後面的人不知道您要左轉，跟著屁股後面走，變成大家一直傻乎乎地跟著，所以如果有左轉的專用道就可以分流，塞車的機率就比較低。
交通局王銘德局長,所以比較順暢。
許至椿議員,我想這個idea規劃出來很好，但我希望人行步道是不是能夠加強？比如以我個人的概念，行人道現在是停留在白線對不對？
交通局王銘德局長,是。
我們還是聽到很多的事故發生，有沒有辦法提升地面顏色的強度，研究一下。是不是晚上有夜光也好，不要妨礙到開車的視線，白天是不是讓視覺更效果更明顯，提醒駕駛前面就是一條斑馬線，這點拜託大家思考一下交通局王銘德局長,是，設置規範已經允許設置綠底的行穿線，我們再推廣。
許至椿議員,市長，現在臺南市的捷運陸續都在評估中，準備要進行。
黃偉哲市長,我們現在把錢存起來的用意是未來要花大錢。
許至椿議員,您很會持家，這要誇獎您。
黃偉哲市長,捷運營運下去會花更多。蓋要花很多錢，營運要花更多。
許至椿議員,這當然是一個重大建設，民眾都很期待，我們現在有好幾個路線，但是我提醒一下市府團隊，目前道路上的國中、國小的行人陸橋，我覺得現在的使用率好像很低，臺南市有沒有必要全面檢討這個過去的文化〜行人陸橋，沒有必要的話，是不是全部拆掉？
黃偉哲市長,我們已經打掉好幾個。
工務局陳世仁局長,跟議座報告，只要做人行道改善時，大部分就會檢討行人陸橋是不是有拆除的必要性。
許至椿議員,我的意思是不要只專注在人行道的妨礙，要全面檢討，一次編列預算，沒有必要的一次把它解決掉，對於未來輕軌也許可能也會是一個衝突點，我不知道會怎麼樣。但我想在整個道路使用的現況，行人陸橋的使用率幾乎很低。
工務局陳世仁局長,目前真的使用率都很低，所以這個檢討其實有必要，對於使用率太低而且也比較老舊的應該退役了。
許至椿議員,所以我不覺得個案處理，希望交通局跟工務局可以全盤考量，必要的時候全部把它一次打掉。過去有民眾檢舉，可能這個陸橋也不適合現況使用了，我希望這一次能夠全面評估，沒有必要的話把它全部打掉好不好？
許至椿議員,交通局長我再請問一下，捷運是大家的期待，現在在您的規劃裡面，短期會發包施工的可能有哪幾條路線？
交通局王銘德局長,跟議座報告，目前進度最快是第一期的藍線，就是從大橋車站出發，沿著中華路、中華東路，往南走文化中心的這條。
許至椿議員,請問這條的進度現在怎麼樣？
交通局王銘德局長,目前在做基本設計了。
許至椿議員,環評通過了？
交通局王銘德局長,環評通過了。
許至椿議員,概算經費出來了？
交通局王銘德局長,300多億，預計希望115年發包動工，目前的進度是這樣。
許至椿議員,施工方面會不會有一些很難施工的障礙、瓶頸？您們有沒有評估？
交通局王銘德局長,因為我們是高架的捷運，所以主要利用道路上的中央分隔島來做立墩。工程的話，當然我們希望分段施作。
許至椿議員,目前只有藍線，第二條路線進度最快的是？
交通局王銘德局長,進度第二快的藍延線，目前交通部已經通過綜合規劃，送到行政院審查。
許至椿議員,目前我們是5條路線，再加上一個新藍線，是不是6條？
交通局王銘德局長,對，目前優先路網是6條。
許至椿議員,目前就您概估，捷運在您的工作推展裡面，短期大概能夠做幾條路線？
交通局王銘德局長,都是平行作業，當然藍線會最快進入動工階段，藍延線目前還在做綜合規劃的評估，完成之後我們會送交通部審查。後面還有深綠線，深綠線的可行性研究也已經完成，地方說明會也開過了。
許至椿議員,環評也通過了？
交通局王銘德局長,環評還沒，要到綜合規劃階段才做，深綠線跟紅線都還在可行性研究。
許至椿議員,市區呢？
交通局王銘德局長,市區的綠線目前在做路線的定案，初步有方案了，會再跟府層報告。
許至椿議員,還在初期路線的規劃？
交通局王銘德局長,是，黃線才剛拿到可行性研究的補助經費，我們希望明年可以展開。
許至椿議員,希望在交通局長跟市長任內的，能夠加快速度，在整個經費的統籌方面，我希望除了向中央爭取以外，地方能夠未雨綢繆，這一點我希望局長在業務上能夠多加幫忙。
交通局王銘德局長,好，謝謝議座。
許至椿議員,再來我請問一下交通局局長，火車站前面的圓環是不是要全新規劃？要打掉？
交通局王銘德局長,沒有打掉，做改造。
許至椿議員,圓環不存在了，是不是這樣子？
交通局王銘德局長,會存在，繞行的方式變成雙向，不用再做單向繞行，變成是雙向的道路。
許至椿議員,規劃完有沒有在地方開說明會？
交通局王銘德局長,有，我們還辦過展覽，希望跟大家溝通。
許至椿議員,相關規劃定案了沒有？
交通局王銘德局長,目前在做細部設計，年底細部設計就會完成，施工前當然會再跟地方開說明會。
許至椿議員,在沒有施工之前，在定案時是不是把資料給我一份？
交通局王銘德局長,沒問題。
許至椿議員,因為地方現在都在觀望，因為那個地方的交通會打結，打結的時候，我們只注重在圓環，我個人的想法是希望能把火車站那塊腹地結合圓環，變成整塊，一個延伸的腹地使用。
交通局王銘德局長,是。
許至椿議員,這樣的話是不是在消化車輛的流通量，能夠把它結合在一起？另外計程車的排班問題，排班問題一直都在，有沒有辦法把它納編進來，重新整體規劃。
交通局王銘德局長,我們會一起處理，而且會處理私人運具接送的停放位置。
許至椿議員,未來圓環改善以後，您有沒有想過開闢地下室做為停車場，或是計程車的接駁，有沒有做這樣的規劃？
交通局王銘德局長,目前是沒有，第一是下挖的經費應該會比較高，第二是腹地不夠大，而且如果還有地下進出，會讓圓環的動線更複雜，未來車輛動線會更複雜。
許至椿議員,考慮過了？
交通局王銘德局長,對，目前沒有這個方案。
許至椿議員,前站不行，後站的停車空間應該好好考慮吧？或是成大的體育場、鐵路局的倉庫、南北側兩側的腹地，我想能夠把它納入使用，未來這樣的吞吐量……
主席陳皇宇議員,謝謝許至椿議員，現在休息至10點30分再繼續開會。
主席陳皇宇議員,繼續進行市政總質詢自由發言，現在請蔡秋蘭議員質詢，時間10分鐘，蔡議員請。
蔡秋蘭議員,謝謝大會主席、市長、副秘書長還有各局處首長。本席有一些案件需要跟各局處、市長探討。
蔡秋蘭議員,市長，北門佳里區最近有很多鄉親一直說北門區很多大建設都沒做，國民運動中心也說很久了，之前本席常常在說，七股原本有一個臺南大學，結果也沒有了，為了臺南大學，本席在十份里做社區重劃，為了要配合臺南大學，結果也沒有了、泡沫化了。再來本席在上個會期建議，北門區的人口數也很多，很需要局長、市長支持興建國民運動中心，局長，在佳里區的中心，您有什麼比較好的地點選擇？
體育局陳良乾局長,謝謝議員。其實這件事市長很關心，他也有叫我去找，我找了北門高中，裡面有健身設施、游泳池，還有一些室外場地，我跟校長談過，希望未來在那邊可以做一個比較簡單的運動中心，讓居民可以去那邊運動，這樣是最快的，不然新建一棟又要花很多錢、時間又很長。
蔡秋蘭議員,局長，臺南市的全民運動中心本席已經都列出來了，目前有4座已經啟用，還有7座快要新建好了，全部就11座了對不對？我們有37區，佳里區在北門可以說是中心點，人口最多，已經有6萬。北門區總共17萬近18萬人，所以很需要、很缺運動中心，這件事拜託局長了。
體育局陳良乾局長,佳里以外的話，在學甲現在也要規劃一個綜合運動館，未來也有很多運動設施在那邊。
蔡秋蘭議員,對，不過從佳里要到學甲比較遠，因為大北門區有西港、佳里、七股、北門、將軍、學甲6區，所以在此我要拜託局長，市長應該也瞭解，全民運動中心已經啟用4座、7座新建中，本席在上次會期就提過，您也有在關心，所以您今天的回答，我很滿意，但還沒確認。市長，您可不可以講一下？
黃偉哲市長,謝謝議員，我覺得對一般民眾來說這個很重要，用得到比較重要。新建這個要3年、5年，有時候又延期，當然這是未來中長期的規劃，但是短期內，在佳里找一個適當的設施，局長剛剛跟您報告的，在北中我覺得是可以的。
蔡秋蘭議員,北中確認了喔！局長，這個真的要加快，因為有很多選手、愛好運動的朋友跟學生都很需要全民運動中心，拜託您加強，謝謝局長，請坐。
蔡秋蘭議員,市長，建議改為BOT促參招商，加快設計建設進度，這個也是我前次說過的，我請教一下局長。
黃偉哲市長,BOT是財稅局長的專業。
蔡秋蘭議員,我要請教局長，這次風災造成這樣的淹水跟下水道有關係嗎？
水利局邱忠川局長,這次颱風造成的淹水，最主要是降雨所引起的表面積水，當然如果下水道做得好是有幫助。下水道有兩種，一種是汙水的，一種是雨水下水道。雨水下水道當然對排水有幫助，汙水下水道是讓我們的生活品質變得比較好。
蔡秋蘭議員,局長，我肯定您治水的方案做得很好，而且您又是中央下來的，市長肯定您的能力。我做了這些圖，您看只剩下佳里跟麻豆還沒做，佳里牽涉到學甲，麻豆牽涉到下營。局長這件事拜託了，雖然金額很高，但我們可以找一個方案，比如BOT的，或是您的人脈真的很不錯，我肯定您的能力，是不是在市長任內有一個好消息，您可以向本席簡單回答一下嗎？
水利局邱忠川局長,是，簡單說學甲、麻豆、下營是一個系統，再來將軍、佳里跟西港也是一個系統，這兩個系統正在評估。我們有向國土署爭取，尤其市長也有跟營建署，也就是現在的國土署拜託過，希望趕快興辦這兩個系統，現在這兩個系統都規劃好了，當然要看中央的經費，等經費下來就可以開始了。
蔡秋蘭議員,要看您的表現了，而且總統是我們自己的人在當，還有市長、立委都是我們自己的人，可以趕快努力，這個很重要的。未來不管是汙水處理或下水道都需要做，而且早就都規劃好了。局長，我要看您的表現了，拜託儘量到中央爭取一些經費。
水利局邱忠川局長,我要拜託市長。
蔡秋蘭議員,對，市長可能也會答應對不對？這種有需要的。
黃偉哲市長,全力配合。
蔡秋蘭議員,對，您看，您請坐。
水利局邱忠川局長,謝謝議座。
蔡秋蘭議員,市長，在107年颱風造成淹水，北門的社區整個都淹水，局長到地方看完之後有改善，代表說水利局有在做事，我在這裡要拜託市長。
黃偉哲市長,議員，您還把同樣的校門拍出來。
蔡秋蘭議員,對，113年7月凱米颱風來就沒什麼淹了，您有看到嗎？我覺得我們一些社區的排水做得很好。
黃偉哲市長,報告議員，凱米颱風又比0823的雨下得多。
蔡秋蘭議員,對，您看沒淹水了，市長，我在這裡特別跟您說，我贊成所有的預算，尤其是水利局的預算，我們都支持，絕對不會刪減。因為局長在水利方面非常厲害，本席肯定他的能力，治水方案對他來說是很簡單的事情。不過對一般百姓會覺得很困擾，因為一般百姓如果看到淹水就會說水溝沒清、水溝不通，我們的排水系統不好。市長，這個我們要特別注意，不是只有北門錦湖，37區都一樣，要有它的規劃，局長都有去探討，科長跟一些部屬都很勤奮。市長，我在這裡特別誇獎他。
黃偉哲市長,"謝謝，凱米颱風淹了600多公頃，莫拉克風災是淹5萬5,000公頃，但任何1公頃淹了，我們都有責任，所以最好做到越來越少。"
蔡秋蘭議員,所以市長，我在這裡要拜託，水利局的預算我都支持。
黃偉哲市長,賴總統也很支持，明年度編了551億元。
蔡秋蘭議員,地方聽到淹水都快嚇死，所以市長要重視這個，在此我也要拜託市長，本席所提的這兩三件是比較大件，不過我很希望在您的任內可以有一個好消息，市長請說。
黃偉哲市長,是，我一定盡力在我任內做好。
蔡秋蘭議員,好，謝謝，我的質詢到這裡。
水利局邱忠川局長,謝謝議座。
主席陳皇宇議員,謝謝蔡秋蘭議員，請黃肇輝議員發言，黄議員請，時間10分鐘。
黄肇輝議員,謝謝主席，延續我在總質詢所講的，關於蜈蜞潭中排，這條蜈蜞潭中排從龍潭到王行、烏竹、蔦松、三民，長度很長，不過整個結構有好有壞、有新有舊。在三民、蔦松有的地方做起來了，有的地方還像這樣有一點破破的。再來到烏竹、王行這邊，有的地方只做一邊，另外一邊又沒有，這裡的話兩邊都沒有，算是比較舊的。到龍潭這裡有一段不錯，旁邊都做起來了，開天宮後面那邊做起來了。不過重點就是龍潭，我們看圖，這邊是住宅區密集的地方，旁邊的房子就蓋在中排旁邊，就像這樣，好像一秒穿越到古早時代。現在我們已經是直轄市了，永康又是人口最密集的地方，感覺又回到30、40年前的那個地方，是要做古鎮嗎？溝旁邊有房子，又把房子延伸出來。
黃偉哲市長,好像有違建。
黄肇輝議員,當然有違建的問題。
黃偉哲市長,因為阻礙了水流。
黄肇輝議員,違建是違建，我重視的是安全的問題，這邊還有幾張圖，這個地方已經崩塌了，有些地方真的不太適合了，旁邊又這樣子老老舊舊的、臭臭的。上次業務質詢時也跟局長討論過，今天要報告給市長知道，蜈蜞潭中排這個地方有好有壞、有新有舊，我們有沒有辦法做一個比較好的規劃？特別是像這種，去年太子廟中排在不是颱風造成的豪雨，只是颱風來之前的一陣大雨，一樣是過去那種施工方式，整個都崩塌了。當然那時候局長也很辛苦，親自坐鎮在那邊把它做起來，有這樣一個前車之鑑，我們是不是能夠事前預防，比較老舊的堤防、堤邊，我們把它整修起來？
水利局邱忠川局長,給我一些時間報告好不好？
黄肇輝議員,好。
水利局邱忠川局長,"針對蜈蜞潭中排，市長爭取到差不多1,920萬，現在在設計中，應該年底就可以發包了，所以明年就能改善一段。您提到整條排水道都要改建，牽涉到用地的問題，還有一些違建拆除的問題，當然我們會趕快辦理。"
黄肇輝議員,是，謝謝局長。希望趕快，因為真的有些地方很危險，之前說要把它做起來，旁邊要拆除等等的，我覺得有一些技術性的方式可以克服的，好不好？如果有違建，我們把下面做好的話，我相信這些住家應該也會配合。
水利局邱忠川局長,如果要做的話就要拆，不能直接在下面做。
黄肇輝議員,部分而已。
水利局邱忠川局長,"現在在設計了，年底就可以發包，市長跟賴署長爭取到了1,920萬的經費，馬上來做。"
黄肇輝議員,謝謝市長、局長。另外住宅密集區有一段變成是暗溝的，從這邊進去，由那邊出來，水流都在地底下，上面有蓋子，之前不知道是怎麼蓋的，因為是以前的事情，可能在縣市合併之前就做了。現在做一個小小的公園、一個小廣場，或是像這個地方做個籃球場，其實這個也不錯，我不知道現在法規有沒有辦法，可以在一些住宅比較密集的區，我們也把它蓋起來，局長這個有辦法嗎？
水利局邱忠川局長,原則上我們儘量不要蓋，因為蓋了之後……
