speaker,content
主席王家貞議員,開始會議。臺南市政府黃偉哲市長、方秘書長、各局處首長、新聞媒體各位女士先生、本會各位同仁，以及電視機前關心臺南市政的好朋友們，大家早安、大家好。今天是10 月27 日星期五，也是本次定期會第8 次會議，上午議程為市政總質詢。向大會報告，市府請假的首長為財政稅務局盧貞秀局長，由邱寶彧副局長代理；研究發展考核委員會陳淑姿主任委員請假，由王珠環專門委員代理。今日議員質詢順序為趙昆原議員、黃麗招議員、陳秋萍議員，因為手語翻譯的關係，原則上我們每50 分鐘休息5 至10 分鐘。首先請趙昆原議員質詢，時間50 分鐘，趙議員請。
趙昆原議員,感謝主席。在座的官員，市長所帶領的團隊，黑雞在此要對你們說一聲，大家辛苦了!在我心目中，身為公務人員的你們真的不簡單，自從你們通過考試後，從基層開始磨練、訓練，直到今天可以坐在前面這幾個位置，這是你們的才情。我相信大家身上都背負著使命，在黃市長的領導下，為臺南市奉獻，要幫助臺南市成為一座繁華的都市，黑雞在此向你們鞠躬，感謝你們。今天總質詢50 分鐘的時間，先感謝媒體朋友及電視機前關心臺南市政的好朋友們，大家早。首先向市政府說一下，我可能較逞強也較不專業，我只是將我所知道的提供給你們，我知道市長很不愛被人批評說他都沒在做事，所以我也減少說這樣的話。
趙昆原議員,在座的長官們，新營糖廠活化案從我擔任議員開始就在爭取，一直在拚，過程中有拜託過2 位市長，包括現任的黃偉哲市長共3 位，期間也拜託過好幾個局長，這麼久的時間，新營糖廠目前一樣閒置中，荒廢在那裡。今天藉此機會，我將新營糖廠的由來及價值再說一次給市長聽。
趙昆原議員,新營糖廠位於雲嘉南的中心點，之前縣市合併時，應該是要將雲嘉南合併成為直轄市，這樣我們新營就有救了，因為剛好位在中心點。自我擔任議員，開始奔走成立產業文化園區，我只有一個很簡單的想法，糖廠那些宿舍和行館可以做成一館一館的，將臺南產業集中於此營運，不用跑到七股買虱目魚丸，也不用到玉井買芒果，那裡可以規劃成為產業文化園區。結果當時我們的市長，現在是副總統了，他說要做就做大一點，稱之為「動漫園區」，我予以尊重，在地人也都尊重，只要市政府要規劃、開發，我們都予以尊重，用什麼名稱都可以。我努力這麼久，賴清德這樣唬弄我6 年，也簽了承諾書，請幫我播放賴清德說的話。(影片：前臺南市長賴清德受訪時表示，市政府絕對有決心、也有信心，藉由糖廠的開發帶動整個大新營。)他讓我們新營人陪他去看新營糖廠，說這些話讓新營人很高興，動員很多人，里長及各地方人士都歡迎市長來規劃。隔年再問他，他也說一定要做，承諾書都寫了，結果呢？局長，這與你無關，過程中我一再提及新營糖廠荒廢這麼久，尤其地處新營中心點，我們是否該將之活化，動漫園區規劃下去後馬上判了死刑，不行。我再去計較時，就說董事長是國民黨在做的，說他們的資源不願來臺南市。我只好忍耐，與你們再一起努力，支持民進黨執政。為了新營糖廠的開發案，我也替民進黨拉票，好讓台糖的董事長可以換成民進黨，後來當選了、執政了，結果有第4屆 第2次定期會 市政總質詢  289要做嗎？還是沒有，仍然荒廢在那裡。所以我今天再次重提這件事，希望能遇到一位好市長、一位較好的局長來幫我們規劃。這個案子牽涉到都市發展局、文化局及經濟發展局，這幾個單位是否願意同心協力來幫忙新營糖廠的開發？市長，這絕對有典故也有其價值，絕對可以讓你的名聲響徹全世界，請放陳亭妃立委質詢的影片。
趙昆原議員,（影片：陳亭妃委員質詢台糖董事長，要求其將糖廠成功的案例複製到新營，不要再走回頭路，一點一點慢慢放是錯誤的，整體規劃可以把前面的時程省下。台糖董事長答覆若有好的計畫他不反對。陳委員表示，台糖應該全力支持而非只是不反對，當市府提出政策時，台糖應全力支持，現在雖說要全力支持，但事實上只要使用到台糖土地，你們就覺得皮肉痛。台糖董事長答覆不會如此，他與文化局的互動很多。）
趙昆原議員,市長，這樣都有聽到吧，所以你若聽到底下官員說是糖廠不同意，我的影片可以提供佐證，讓你心裡有個底，知道官員們是不是又在瞞騙你，讓你可以做個主宰。台糖公司董事長在過去國民黨時代，據說臺南市政府送去的案件都不會通過，我不知道是不是真的，有沒有做我也不知道。我們一直透過地方民意代表來幫我們爭取，當時規劃2 甲地，後來變3 甲地，慢慢地增加，對我們臺南市整體規劃真的不合理，也沒有價值。事到如今，都發局既然那麼有心，這條路好不好走，希望市長能明確指示他，這樣好嗎？
趙昆原議員,市長做得到嗎？
黃偉哲市長,好。
趙昆原議員,因為我不好意思再讓你寫承諾書，寫一寫若又沒做，那我就要公開這張承諾書。不要這樣，說話算話好不好，我相信你。局長，你有什麼要補充說明？
都市發展局徐中強局長,向議員報告，我們會繼續努力打拚，新營糖廠確實是新營區最重要的未開發處女地，也是我們新營未來發展的重點。我之前向您承諾過，這個案子我會親自操刀，也向您報告，現在糖廠的董事長是我以前在高雄的老同事，我已經與他接觸過了，台糖在這部分會全力配合。
趙昆原議員,感謝你。
都市發展局徐中強局長,感謝你。
趙昆原議員,如同我剛才所言，我們都是身負使命而來，我們要讓臺南市繁榮發展。局長，我期待你的作為。我有一個見解，新營糖廠、岸內糖廠及鹽水糖廠3 處，剛好可以打造如同美國迪士尼樂園那樣的規模，真的要把它實現。本來魏德聖的拍片場景要在安南區，後來嫌土地太小，賴清德幫他在黑樹林找到一塊地很大，結果也沒有做成，現在只剩文化局主導的岸內糖廠轉型成功。局長，這個轉型得不錯吧？
文化局謝仕淵局長,岸內影視基地目前已經到第4 期，今年文化部與我們市款配合的經費總計1 億多元，開始要慢慢將整個園區做得更完整，現在已經有好幾個劇組進駐我們岸內糖廠拍片。
文化局謝仕淵局長,第4屆 第2次定期會 市政總質詢  290趙議員昆原：
文化局謝仕淵局長,局長，我從以前就開始運作新營糖廠產業園區案，也拜託以前的葉局長，就是現在的葉副市長，他當時也很努力、很用心，擔心新營糖廠會恢復成過去的工業用地，就將裡面幾處列為古蹟，讓他們無法開發。市長你看，很多人這麼用心的在推動，結果後面卻脫節了，市長於心何忍？葉局長將幾個重點處列為古蹟不能開發後，新營糖廠就永遠荒廢在那裡；但若沒有列古蹟，我想那裡現在已經變成工業區了，不是嗎？市長，憐惜一下我們新營，新營、鹽水、岸內及烏樹林糖廠的發展，真的很關鍵。過去載運甘蔗的小火車，所行駛的鐵道多數還存在，市長，若你有興趣，是否能規劃一條鐵路觀光路線，這真的會為臺南市帶來很多遊客，我相信若做起來，這就是你的德政，好不好？也拜託你和都發局一併規劃看看。
文化局謝仕淵局長,在李孟諺前代理市長時期，本席就建議以「軌道」發展溪北，接著議員同事們也跟進，這些同事都差我2 屆了，他們在議會也提議，糖鐵規劃勢在必行。人家傳了影片給我，蘇貞昌在2、3 年前到蒜頭糖廠時，曾說要讓蒜頭糖廠裡的所有小火車通車。市長，臺南還是沒有，你看這觀光路線規劃真的很廣，可以坐火車欣賞嘉南平原美景。新營糖廠那裡，都發局爭取到前瞻計畫經費，興建了地景公園案，但我們感覺真的不夠，都忽視新營糖廠的特殊條件。市長，以前新營的火車站，臺鹽火車可以直接進入到臺鐵，糖廠製糖的火車也可以進入；那條鐵路到新營後，可以讓臺鹽火車進入，也可以讓臺糖的火車進入，這就叫三鐵。市長，你走過世界各國，我請教你，是否聽過三鐵共構？
黃偉哲市長,較少。
趙昆原議員,有還是沒有？
黃偉哲市長,有，我有看過兩鐵，較少看到三鐵。
趙昆原議員,新營這個就是三鐵。你覺得光是三鐵這樣的名稱，能否能夠號召民眾來到臺南市？
黃偉哲市長,應該可以。
趙昆原議員,尤其若你們將園區設立完成，也能一併強調其特色，只要坐火車來到新營的觀光客，都能以小火車接駁至園區，可以只坐火車就好。
黃偉哲市長,現在我們的沙崙火車站與高鐵是兩鐵，臺北車站是三鐵共構。
趙昆原議員,好，我們這裡也是真正的三鐵。我再次重覆我們對新營這塊土地的痛心，從糖廠的煙囪被拆除，新營便開始沒落至今，人家蒜頭糖廠的那支煙囪被保留著，現在帶來多少觀光人數，所以我們錯失了一次先機。市長，期待你能讓新營這地方恢復過去的風華，可不可以讓我們拜託？讓我們新營人拜託好嗎？都發局局長，這真的是具有歷史性，希望你們可以幫忙。這是臺鐵、糖鐵、鹽鐵三鐵，可能有長官還未看過，新營糖廠中的這第4屆 第2次定期會 市政總質詢  291些地方目前都還在，旁邊才建了一座地景公園，局長，這地方你知道嗎？
都市發展局徐中強局長,我知道。
趙昆原議員,是不是能藉由臺南市及中央的資源一起來努力？
都市發展局徐中強局長,我們來研究看看，但是……
趙昆原議員,再研究就慢了。
都市發展局徐中強局長,在新營糖廠的規劃中，我們會將這些考慮進去。
趙昆原議員,你若說還要考慮看看，那我就又要失望了。
都市發展局徐中強局長,不會。
趙昆原議員,因為之前那些人都說他們要考慮，一考慮8 年就過去了；8 年後換黃市長上任，又已經過了5 年。
都市發展局徐中強局長,我們先開發新營糖廠，有人潮進來後再來做這些，循序漸進。
趙昆原議員,好，那你已有計畫就對了？
都市發展局徐中強局長,會，我們會掌握。
趙昆原議員,市長，再來是荷蘭村的議題。話說這是自我擔任議員開始就一直用心計較，一直向官員們拜託的部分，我請教局長，荷蘭村當時投入多少經費？
觀光旅遊局林國華局長,合併之前……
趙昆原議員,蘇煥智任內。
觀光旅遊局林國華局長,我們5 年的開發經費總共……
趙昆原議員,總共多少錢？
觀光旅遊局林國華局長,2.4 億元，從基礎開發開始。
趙昆原議員,那當時有完工嗎？當時蘇煥智的規劃是否有完成？因為他剛好卸任。
趙昆原議員,第4屆 第2次定期會 市政總質詢  292觀光旅遊局林局長國華：
趙昆原議員,當初的整體規劃都有完成。
趙昆原議員,我現在要問的是，為什麼我們不延續？若沒有完成為什麼不延續？臺灣的縣市長及執政者都有這樣的心態，前朝做的工作，後面的人不延續下去，這實在很可悲。市長，我舉2 個發生在臺南的例子；陳唐山的工研院規劃，蘇煥智不再延續；蘇煥智的規劃，賴清德不再延續，還重新規劃別的。怎麼都不延續做到好？當初蘇煥智規劃要將德元埤荷蘭村發展成觀光景點，可以和虎頭埤一樣有遊船，為什麼後來就停下來了？一座碼頭從民國94 年開始，空放在那裡幾年了？
觀光旅遊局林國華局長,那是東碼頭，離這裡2 公里多的碼頭。
趙昆原議員,民國94 年完工的是嗎？
觀光旅遊局林國華局長,是，東碼頭。
趙昆原議員,民國94 年至今已經幾年了，有沒有進一步規劃，使「荷蘭村」這3 個字，讓人覺得是個好地方。
觀光旅遊局林國華局長,我從二個方向向議員報告；第一階段我們已經爭取到德元埤……
趙昆原議員,好了，你不要再說爭取什麼，平常為什麼不來說，我現在質詢時間有限，你才在說這套，這樣你夠格嗎？市長，我這麼善意，竟然用這套說法……
黃偉哲市長,議員你的善意我知道。
趙昆原議員,我現在問的是，花了多少錢？何時完工？你們有沒有要繼續做？就這麼簡單。你要辨解什麼，是當作我都不懂嗎？沒關係，我剛才就承認自己不夠專業，我也不懂，我都有向你們承認。
觀光旅遊局林國華局長,目前我們有在努力。
趙昆原議員,提到這些過程，主要是希望市長能在任內幫忙延續工作，讓柳營荷蘭村能成為觀光景點。從蘇煥智做好後，荷蘭村的風車就不曾轉動過，每年都在辦風車節，但風車卻不曾轉動過，只在地上插一些紙折的風車，這樣叫做風車節，悲不悲哀？真的很令人感慨。
趙昆原議員,你這些歷任的主管，都以這樣的心態在唬弄你，你只看到一面而已，是不是？水利局局長，德元埤那麼大的水域，是屬於你們管轄還是水利會？
水利局邱忠川局長,德元埤是台糖在管的。
水利局邱忠川局長,第4屆 第2次定期會 市政總質詢  293趙議員昆原：
水利局邱忠川局長,台糖管的嗎？
水利局邱忠川局長,對。
趙昆原議員,那水是你們管的嗎？
水利局邱忠川局長,水也是他們管的。
趙昆原議員,灌溉呢？
水利局邱忠川局長,灌溉是農水署。
趙昆原議員,你們都沒有管到？
水利局邱忠川局長,水權的部分都是他們的。
趙昆原議員,這樣等於我不用拜託你們就對了。船要行駛才發現，沒有清淤無法行駛，不然你就用這個藉口跟我推拖，你若說沒有清淤，淤泥太多使船無法行駛，這樣我就甘願。
水利局邱忠川局長,清淤的部分我們會要求台糖來做，去年他們有清5 萬方淤泥。
趙昆原議員,都這樣推拖沒道理吧？市長，你聽著，我今天專程要說給你聽的；哪個局處做的工作與你所知道的部分對接不起來，你就要小心了，請坐。荷蘭村案我想強調的是，希望市長能在任內將賴清德手上未延續完成的事情繼續完成。我敢跟你說，賴清德本身沒有留下什麼可以讓你延續的，應該沒有，市長，不然你站起來說一下，他有留什麼工程要讓你延續做下去嗎？
黃偉哲市長,美術館。
趙昆原議員,只有美術館而已，那不是都做好了嗎？
黃偉哲市長,做好了。
趙昆原議員,都做好了還要延續？
黃偉哲市長,還有永康圖書館。
趙昆原議員,我希望能將過去整體的規劃延續下去，最主要是強調，很多案子做了之後不延續，第4屆 第2次定期會 市政總質詢  294會浪費很多錢，2.4 億元……
黃偉哲市長,我向議員報告，這我們會趕快思考要如何延續下去。
趙昆原議員,就當蘇煥智只投資2 億元好了，結果這幾年就放在那裡荒廢，還得請人整理。接下來照片中的這個碼頭，當初蘇煥智的規劃是從德元埤裡面的碼頭，行船到敏惠醫護管理專科學校旁的碼頭，讓遊客能騎機車或腳踏車上船，環湖遊覽到另一碼頭，這是他規劃的動線，先讓你們知道。我們虎頭埤的太陽能船也行駛很久了，船若能定點放在荷蘭村，讓遊客觀光使用，這樣的規劃會很差嗎？這是很有觀光特色的，德元埤那麼大，放艘船在那裡需要投資多少錢？但1 艘船就可以帶動觀光，這樣你要做嗎？回答我，要嗎？
黃偉哲市長,這很好。
趙昆原議員,那1 艘船多少錢？局長，多少錢？
觀光旅遊局林國華局長,"當初購買約1,000 萬元，不是船的問題，而是水域的問題，我剛要補充報告。"
趙昆原議員,我此刻在說船，你卻跟我說水域，剛才你怎麼不說水域，真的好像要跟我對立一樣。
觀光旅遊局林國華局長,沒有，我是補充說明。
趙昆原議員,"市長，若投資1,000 萬元能將柳營荷蘭村的觀光帶動起來，這樣的價值應該很划算，我只是建議而已，不敢叫你一定要怎麼做。"
黃偉哲市長,這很好。
趙昆原議員,我都是在建議你，很怕你說我在恐嚇你。先讓水利局局長再站一下，德元埤再過去是我們柳營八老爺庄頭，以前每次水災就會淹水，因為德元埤上游還有個「洗布埤」你知道吧？
水利局邱忠川局長,知道。
趙昆原議員,上游洗布埤的水流到德元埤，德元埤雖然很大，也無法容納那麼多水，水溢出就流到柳營街上，再來就是八老爺大排接往龜仔港大排。根據我們長久以來的觀察，我是不敢說你們治水做得不好，但德元埤的水影響到柳營街面及八老爺庄頭，每次淹水時，水深都達到大腿處，百姓叫苦連天；尤其酪農區都是豬屎味，每當下雨時，大家就得與豬屎尿共存。所以本席曾建議，在八老爺村落裡做分流，直接設置抽水站，將水抽到急水溪，這個建議你知道嗎？
水利局邱忠川局長,第4屆 第2次定期會 市政總質詢  295知道，之前去拜訪議員時您有提到，我知道您是水利系畢業的，因為這是很好的建議。我們現在是在下游做八老爺滯洪池及抽水站，那比較慢。
趙昆原議員,這個案子規劃面積多大？
水利局邱忠川局長,應該開始在做了，有24 公頃，現在……
趙昆原議員,24 公頃做抽水站？
水利局邱忠川局長,不是，是滯洪池。
趙昆原議員,滯洪池兼抽水站對不對？
水利局邱忠川局長,對。
趙昆原議員,24 公頃。農民的土地是先祖留下來的，我們為了要治水而辦理徵收，我相信這個經費一定很高。
水利局邱忠川局長,那裡是公有地較多。
趙昆原議員,私人的地也都要負擔，工程來到龜仔港大排時，八老爺是不是都已經淹水了？
水利局邱忠川局長,我們現在也在檢討議員所建議的將其分洪，因為目前有文化遺址的問題，24 公頃這個地方，有文資處專家向我們建議……
趙昆原議員,既然有文化遺址，你們動作要快一點，先移開。
水利局邱忠川局長,有，現在已經在檢討規劃了。
趙昆原議員,不要等到下雨時，我又得讓你們再看一次淹水的嚴重情況好嗎？
水利局邱忠川局長,這部分市長很關心，有對我說議員建議要在中游分洪，我們已經開始規劃了。
趙昆原議員,反正你遇到我，都不會有太好的事，事情沒完成前我就會一直講，講到我不當議員為止。
水利局邱忠川局長,市長有交代，我們一定會照做。
趙昆原議員,我希望是這樣，百姓給我這個使命，我一定要替他們爭取，為他們發聲，讓你們來第4屆 第2次定期會 市政總質詢  296替百姓完成。
水利局邱忠川局長,是，之前拜訪議員時，您有講過，我完全了解，已經開始在規劃了。
趙昆原議員,好，請用心一下。接著講到鹽水，鹽水前幾天在月津港有辦理活動，月津港這個水域是你們管的嗎？
水利局邱忠川局長,是，沒錯。
趙昆原議員,觀旅局要辦活動是否要通知你們或與你們合作？
水利局邱忠川局長,那都沒問題，府內一體，我們會全力支持。
趙昆原議員,好，但這次有發生一個小狀況，就是辦活動要繳4 萬元保證金給你們水利局，因為有危險性。我聽到這樣的說法感到很驚訝，若是說要來玩水得買保險，還說得過去；你們繳錢，我們來幫忙買保險，有幾個人下去玩，就得繳幾個人的保險費，這我是認同的。
趙昆原議員,但如果是說要繳4 萬元當保證金，我有點傻眼，我的想法可能較偏激，若有1 個人發生事故受傷了，4 萬元可以解決嗎？哪有這麼表面的做法，局長，你下面的人有出現這樣的狀況，要注意一下。
水利局邱忠川局長,這我們會檢討。
趙昆原議員,可以配合推動較為重要。
水利局邱忠川局長,全力支持，觀旅局辦的活動我們沒有反對，絕對全力支持。
趙昆原議員,好，地方上若辦理活動也得幫忙。
水利局邱忠川局長,是。
趙昆原議員,不一定只有觀旅局辦活動，地方或社區等……
觀光旅遊局林國華局長,我補充說明一下，那筆費用是管理費，是設施維護費，與活動沒有關係。
趙昆原議員,水利局要收的管理費，你們觀旅局早就該處理了，既然要辦理活動，管理費就要先準備。
觀光旅遊局林國華局長,好，以後我們會改善。
趙昆原議員,第4屆 第2次定期會 市政總質詢  297不要讓水利局背這個黑鍋，出面叫你們繳管理費。
觀光旅遊局林國華局長,好，我們和水利局再來討論。
趙昆原議員,各項活動的舉辦一定要互相配合。
觀光旅遊局林國華局長,謝謝。
趙昆原議員,再來要拜託工務局。月津港也算是國際景點了，接下來如同日本一樣，也可以在月津港遊船，但過程中有幾座橋的問題。照片中的橋，下方是弧型的，船可以通過；但像這種較低的橋，船就無法通過了。是否能拜託工務局，將這種橋設計為景觀橋，讓船可以通行，不用做到像日本那樣，讓乘客先跳到上面再跳下來，我們沒有那種技術，若讓遊客直接通過橋下，是否有困難？之前蘇局長跟我說這要花幾億元。
工務局陳世仁代理局長,2.3 億元。
趙昆原議員,不然我們重來，一座一座完成，這樣好嗎？今年完成1 座，明年完成1 座，讓地方上的民眾覺得有些不同。局長，這樣好嗎？可以幫忙嗎？
工務局陳世仁代理局長,有，我有想要幫忙，但擔心錢的問題。
趙昆原議員,錢的問題，老闆就坐在前面。市長，鹽水月津港的開發，透過文化局把燈會辦得那麼好，也名揚國際了，月津港水域的5、6 座橋，可以都打造成景觀橋，不要再做成平的。
趙昆原議員,那天到大眾廟，我請你看當地的那座橋就是做平的，用鐵製的，這樣好看嗎？不好看吧。
趙昆原議員,市長，你怎麼都不說話，你要回答。
黃偉哲市長,不太好看。
趙昆原議員,不太好看吧，要改進一下對不對？
黃偉哲市長,一部分要有通行的功能，一部分要有景觀的功能。
趙昆原議員,主要是景觀，若整個月津港可以讓船隻通行，遊客自然就來了。
黃偉哲市長,橋上讓人走，橋下讓船走，又要兼顧好看。
趙昆原議員,若能這樣我會感謝你，我代表鹽水民眾向你道謝。我爭取了12 年，鹽水一直沒有公園，你去年在這裡興建特色公園，我代表鹽水人向你道謝。過去我爭取10 多年，從臺南縣時代到賴清德時代，都只是被帶過，更好笑的是，賴清德還跟我說照片上這3 座也算第4屆 第2次定期會 市政總質詢  298是公園。現在看到的這是特色公園，不要說我都是找你要錢，或是罵你、指責你，今天我在此公開向你道謝。這是鹽水第1 座公園，第1 座!鹽水的歷史悠久，一直沒有公園，只有這座，你是不是該受我一拜？
黃偉哲市長,不敢。
趙昆原議員,真的好不容易，只是現在特色公園興建了，若周邊的景觀橋可以配合夜晚景色，我想鹽水就會更好。
黃偉哲市長,希望特色公園和月津港那邊可以互相呼應。
趙昆原議員,對，一定會。
工務局陳世仁代理局長,向議員報告，因為公20 特色公園目前還在施工當中，明年度還有。
趙昆原議員,我知道。
工務局陳世仁代理局長,其實景觀橋部分，早期我們蓋過一座水月橋，剛才照片上有看到，在……
趙昆原議員,佛寺那邊。
工務局陳世仁代理局長,對，佛寺那邊有座水月橋，那是景觀橋。
