speaker,content
趙昆原議員,"但沒有景觀，只有那座橋而已，希望晚上也能展現橋梁之美。再來，從月津港一直走到這裡是岸內大排，大排左側國小旁要做綠美化，這次市長也有去動土，並向中央爭取一筆武廟風貌整合計畫經費6,371 萬元，我們也拜託陳亭妃委員，向中央爭取經費來建設。我一直在想，既然有爭取到岸內大排單側綠美化的經費，左側要花6,000 多萬元做綠美化，那為什麼對於這條岸內大排，都沒有動作？過去幾位局長都不在任了，一位是前都發局局長吳欣修、一位是前工務局局長蘇金安，還有前水利局局長，他們都同意、認同改善大排的情況，結果一直拖到現在。這條岸內大排夏天很臭，水底都是髒泥，我想請你們改善一下，結果卻做成這樣；你們眼睛睜大一點，這是在岸邊圍起了網子，市長，圍起網子就叫景觀？你看悲不悲哀，這樣叫景觀。都發局局長，你的部分要拜託你；水利局局長，水溝的部分是你的權責；景觀部分則是都發局的。拜託你們配合一下，旁邊都已經爭取到6,000 多萬元要做綠美化，市長那天也去動土了，這條岸內大排地處鹽水中心，在武廟前方，希望能一併將它美化完成，不要零零落落的。局長，有沒有辦法？"
都市發展局徐中強局長,我們來爭取看看。
趙昆原議員,你若還不清楚，局裡一定有相關資料，可以回去找找。
趙昆原議員,第4屆 第2次定期會 市政總質詢  299都市發展局徐局長中強：
趙昆原議員,我會找我們地景規劃工程科先研究看看。
趙昆原議員,這個我已經講好幾年了。
都市發展局徐中強局長,現在前局長吳欣修在國土管理署，我可以向他爭取經費來做。
趙昆原議員,可以爭取得到最好，不然這裡從他當局長至今，都是這樣。
都市發展局徐中強局長,他家就住那附近而已。
趙昆原議員,對。市長，這是鹽水的入口意象，我沒問你所以你比較輕鬆，都在看手機，不然你也看一下我播放的照片。
黃偉哲市長,我都有認真注意聽，你剛才叫我起來回答，我也有回答。
趙昆原議員,不然你也看一下螢幕上的照片，我都是在看你的表態而已。市長，在你還未做特色公園前，我曾向賴清德爭取，他說鹽水已經有3 個公園，就是照片上這3 個，放大讓市長看一下。
黃偉哲市長,這算是公園？那是精神地標。
趙昆原議員,這個是在「七歲姑娘廟」前，工務局被我一直吵，後來才在「伽藍廟」前也做了這個入口意象。鹽水有3 個入口，除了伽藍廟前，還有七歲姑娘廟及復興路，都做這種圓型設計，栽種些樹木，設有噴水池及夜晚的燈光設計。這樣就叫公園？市長，若沒有你的這座特色公園作比較，他們的嘴巴都不會閉上，將這些地方當作公園，把鹽水人當成什麼了。局長，伽藍廟前的入口意象已經完成，噴水功能也做好了，你看，晚上的景色多漂亮，我希望復興路及七歲姑娘廟這2 個入口，也都可以加速辦理，把鹽水四周圍的整體景觀做起來，有困難嗎？
工務局陳世仁代理局長,我們回去規劃看看，因為復興路口那塊……
趙昆原議員,你們都沒有一個有擔當的，直接說好，這個我來處理。
工務局陳世仁代理局長,總是要先去看，因為這塊地不會很大。
趙昆原議員,是不是我對你們太好，你們都這樣賴過去。
工務局陳世仁代理局長,這塊地不會很大，要再評估是否適合做，不然已經有噴水了，又要再做……
工務局陳世仁代理局長,第4屆 第2次定期會 市政總質詢  300趙議員昆原：
工務局陳世仁代理局長,沒有，哪有？噴水的都壞了，沒在噴水了，你們再去看一下。
黃偉哲市長,噴水的設施壞了？
趙昆原議員,"那2 個都沒在噴了，只剩下剛做好的伽藍廟這裡可以噴水。我的時間有限，局長，你在業務報告時，我也有拜託你，跟你說農民的心聲；中央的休耕補助1 公頃9 萬6,000元，這些青農、農民實在沒辦法生活。休耕二季，一季4 個月，9 萬6,000 元的補助對他們而言是不夠的，你知道吧？"
農業局李建裕局長,我知道。
趙昆原議員,今天我透過總質詢對你們說，你們要去籌劃一下，能否再補貼農民一些，讓農民有不同的感受，覺得臺南市政府有積極在照顧我們，這樣好嗎？
農業局李建裕局長,了解，我們積極來辦理。
趙昆原議員,市長，我交給你們局長處理，不再問你了，不然好像我一直向你挖錢似的。
黃偉哲市長,不會。
趙昆原議員,不會嗎？那健保費要不要讓我講？還是要講老人津貼？不用了吧。跳過去，我也不想再向你要錢，那都是你的決定，權力在你手上，我只是給你建議而已，不要讓人常在那裡比較。但這項我要講，市長，賴清德任內6 年，公共債務652 億元，在你手裡替他還了179 億元，我要讓臺南市民知道，你真的超級節儉，替人還債。有句話要送給你，「儉腸凹肚(臺語) 」替人買衛生紙擦屁股就是黃偉哲，這樣對嗎？這樣形容你，不會過分吧。
趙昆原議員,我希望財稅局及社會局要注意，為什麼我們的非營業基金自償性債務只有10 億元，對比其他縣市，就是因為我們不太有建設，公共工程也很少。高雄市的有575 億元，臺中市的597 億元，我打電話去臺中、桃園、高雄市詢問，他們說因為有蓋停車場、工業區等，雖然先花錢，但是將來會回收。
黃偉哲市長,我們的債務減少，那個自籌性的……
趙昆原議員,市長，這樣會讓人覺得我們沒在做事。
黃偉哲市長,有。
趙昆原議員,意思是做越多，借越多；借得越多就是我們工作做得越多，你知道嗎？我希望財稅局及社會局要提供正確的資料給市長，好不好？
趙昆原議員,第4屆 第2次定期會 市政總質詢  301財政稅務局邱副局長寶彧：
趙昆原議員,好。
趙昆原議員,如同我剛才跟你們說的，我們都背負著使命來幫助黃偉哲，要讓臺南市更繁榮發展。
趙昆原議員,我從頭到尾都堅持這點，期望你們能做到，好不好？
財政稅務局邱寶彧副局長,好。
趙昆原議員,我現在罵市長也來不及了，都已經過去，只能說給你們聽；你們可能太平宴吃太久，過去沒人提醒你們，你們就這樣過了。本來就應該告訴市長，這樣的錢可以借來花，百姓不會罵，建設越多百姓們越高興，不是嗎？因為我們會賺錢來償還。市長，我舉個例子，以前蘇煥智縣長開發柳營科技園區，他是先借錢向台糖買土地，在賴清德任內開發時，經發局賣土地讓企業進駐，這是可以賺錢的。應該要誇獎蘇煥智眼光長遠，看得到這項建設日後能賺錢；結果讓人說成別人替他還了負債，這不公平。經發局局長當時擔任副局長，所以也知道吧。現在我還要提醒一件事，聽說經發局要設立柳營科技園區第三期？
經濟發展局林榮川局長,有。
趙昆原議員,我在這裡也向你提醒，這個地點是否會影響到德元埤荷蘭村的開發？是不是距離太近？你們也評估一下。
經濟發展局林榮川局長,是。
趙昆原議員,成立柳營科技園區的本意很好，那時是想讓科技相關工業進駐，但現在卻都是些有毒的，臭味滿天，我相信經發局局長、秘書長對這裡最清楚，汙染也已經汙染了，你們若要進行第三期開發，我希望……
主席王家貞議員,再給1 分鐘，趙議員趕快說。
趙昆原議員,你做不做得到？做得到吧。市長，這1 分鐘讓你說明，柳營科技園區設置公家焚化爐，你要不要做？經發局都推拖說只要有人抗議，就不要做了，你表示一下。
黃偉哲市長,現在地方上有些意見，包括議員也有去連署，所以這部分要再慎重評估。
趙昆原議員,但你知道私人的做了很多嗎？現在柳營科技園區私人的做了10 多支。
黃偉哲市長,真的嗎？
趙昆原議員,第4屆 第2次定期會 市政總質詢  302局長，報告一下。我這個都沒有讓你知道，因為我怕你聽了很不甘願……
黃偉哲市長,我會後向你報告好嗎？
趙昆原議員,你不用向我報告，你告訴局長要如何延續或取締，或者將它管理好，不要製造汙染。
黃偉哲市長,好，我知道。
趙昆原議員,局長，市長不知道這件事，你看你多慘。好，謝謝主席。
主席王家貞議員,謝謝趙昆原議員。臺南市議會的設備為什麼無法更新？時間差那麼多。謝謝大家，我們休息到10 點30 分再繼續下面的質詢。
主席王家貞議員,不好意思，耽誤了點時間。我們現在繼續進行市政總質詢，請黃麗招議員質詢，時間50 分鐘，黃議員請。
黃麗招議員,謝謝主席。黃市長、臺南市政府一級主管、各局處室首長、臺南市議會各位同仁、新聞媒體記者及親愛的臺南市民，大家好。
黃麗招議員,今天是我第4 屆第2 次定期會的市政總質詢，在此我要特別澄清一件事；之前交通局及警察局業務報告時，我有提到安南區交通檢舉的事情，針對記名檢舉與不記名檢舉，我特別詢問了交通局局長，局長當時回覆我，不記名檢舉是不能開罰單的。針對這句話，我也講得很清楚，若真的有違法，我沒有說不能開罰單；但新聞媒體斷章取義，因為這句話，我在網路上被熱搜了一段時間。所以，我在此特別重申，我個人一向非常守法，有關騎樓的部分，過去臺南市的自治條例中有修訂，只要保持1.5 公尺騎樓地的暢通，是不能開罰單的。我藉由總質詢的時間，向臺南市民及那些對我有意見的朋友說明，網路上也有人為我講話，因為他們懂相關法令。
黃麗招議員,繼續談我今天的議題，臺南市停車位不足的問題。目前我們的公有車位不足，對安南區來說更是如此，車位不足的問題產生許多民怨，所以我今天要探討這個問題。臺南市是文化大都，許多觀光客前來旅遊，在整個臺灣的觀光旅遊條件中，我們臺南市是非常具備優勢的，然而頻繁的違停檢舉問題，卻衍生出了民怨。就我所知，在鬧區一個車位可以賣到200 萬元，200 萬元都可以買到一間套房了，我知道王局長一直在努力這個區塊，向中央爭取設置大型公共停車場，不知道這筆預算是否到位了，局長？
交通局王銘德局長,9 座立體停車場，我們第一階段爭取到；近期也被核定補助2 座，分別在九份子與未來社宅裡面。
黃麗招議員,9 座停車場的預算到位了嗎？
交通局王銘德局長,到位了，都已經開始建設了。
黃麗招議員,第4屆 第2次定期會 市政總質詢  303車位不足是我們臺南市的民生大問題，9 座分布在5 個區。
交通局王銘德局長,是。
黃麗招議員,安南區是在你剛剛講的九份子。
交通局王銘德局長,那是後來爭取到的。
黃麗招議員,九份子那個位置，我上一任時就建議過教育局，為彌補學生就讀時教室不足的問題，我建議教育局將停車場改為地下停車場，地上則做教室，能夠澈底解決九份子國中、小空間不足的問題，你也把這些預算分了一部分在九份子。當然，這也只是解決少部分問題，這9 座停車場解決了各個小區域中的問題，但以大範圍來說，例如安南區那邊，需要停車又礙於法規問題，才會衍生今天的民怨，大家應該都知道，包括黃市長應該也有聽到這件事。我知道這9 座停車場分布在5 個區，包括安南區、北區、新營區、善化區及歸仁區，就我所知，北區應該設立較多。
交通局王銘德局長,中央的補助要看需求性，所以第一階段的9 座停車場，主要分布在市中心，商業活動較繁華的地方，第二階段我們再爭取……
黃麗招議員,我知道西門路與健康路那座停車場已經完成，現在已在使用，解決了那個區域的停車問題，這是一個讓市民肯定臺南市政府、認可王局長領導能力的作為。你一直有在這件事上付出努力，希望你能再繼續努力，因為安南區雖不算是都會型區域，但民眾一直找不到停車位，想要增設停車格，有時也真的找不到空間。騎樓不可停車，停了馬上就有人檢舉；私人停車格也不足，而且價格昂貴；道路的寬度不夠，路邊停車有安全顧慮。
黃麗招議員,比如同安路，目前騎樓沒辦法停車，民眾只好停在路邊，反觀那些騎機車的人，在這個路段騎行時，路邊停放整排的機車，對其造成的安全疑慮。王局長，你認為我的講法如何？
交通局王銘德局長,向議員報告，路邊停車格的提供，是最後不得已的手段，道路其實應該用來維持交通順暢使用，在停車位的解決上，我們會優先尋找路外的停車場，因為這樣對於路面交通的干擾是較少的，我們會從這個角度來處理。
黃麗招議員,好，你先請坐。都發局局長，請問你建築法規的問題。假設我今天蓋房子時，路邊基地退縮2 米，這樣我的走廊可不可以停車？
都市發展局徐中強局長,現在一般都不止退縮2 米，基本上退縮地主要是供綠化及人行步道使用，停車的話，我們是沒有……
黃麗招議員,民眾向我陳情中提到，他蓋房子時有退縮，退縮的部分已超過走廊的部分，這樣可第4屆 第2次定期會 市政總質詢  304以停車嗎？
都市發展局徐中強局長,退縮地的部分基本上要看各計畫區的規定，像安南區有分成好幾個計畫區，每個計畫區的規定不太一致，基本上如果是新開發地區，依內政部現在統一規範，退縮5 米的部分是不允許停車的，但臨時停車可以。
黃麗招議員,當然。我們有地方的自治法令，且這裡不是熱區，停車位的問題會衍生罰單問題，造成民怨，這地方還是應該有專案討論的可能性。
都市發展局徐中強局長,好，這我們再來檢討。
黃麗招議員,今天我暫時不講到這個問題，你請坐。
都市發展局徐中強局長,是，謝謝。
黃麗招議員,市長，我在此建議臺南市政府規劃增設里鄰型的停車空間，你認為如何？我們討論過這項建議的優點；首先，可以善用閒置的土地增設里鄰型的停車空間，而且能配合綠美化來優化環境，還能解決道路違停的現象。再來，可以增加市民生活的便利度，最重要的一點是，增加外來人口入住臺南市的吸引力。停車空間是最大的民生問題，臺南市在熱區的部分，一直有在重視這個議題，但像安南區這樣較有發展潛力的地區，每條路、每條街停車位不足的情況，造成有些檢舉達人認為民眾違法予以檢舉，警局開罰單後又造成民眾抱怨，那這筆帳算在誰頭上？還是一樣會算在你黃偉哲市長頭上。所以這就是為什麼我今天會在此提出，請市府增設里鄰型的停車空間，改善我們停車位不足的問題。
黃麗招議員,市長，請你回答我，希望臺南市政府透過我今天的質詢來探討這件事，使未來能解決民怨，能在里鄰內找到方便停車的地方。
黃偉哲市長,是，謝謝黃議員，你的想法與我的想法不謀而合。增加停車空間一直是我們窮盡洪荒之力在做的，過去較著重在中、大型面積的立體停車場，現在已經有9 座了，您剛才也提到，這9 座都是在我任內做的，臺南市的第1 座立體停車場是我們做的。
黃麗招議員,所以我也希望你……
黃偉哲市長,過去我們都把眼光著重在這種大型的停車場，反而忽略了里鄰型的，這種里鄰型的我願意去做。
黃麗招議員,若公園有空間可以開放的話……
黃偉哲市長,前提必須是公有地、台糖地或國有地，不要再去徵收了。
黃麗招議員,第4屆 第2次定期會 市政總質詢  305我沒有叫你去徵收。
黃偉哲市長,我是說這是前提，我們積極朝這方向來進行。您剛才說的公園，若是在公園的角落可以增加一些停車空間，我也願意。
黃麗招議員,好，希望在你的任期內，可以就這方面加以探討，改善我們的停車問題。
黃偉哲市長,我腦袋裡已經有些圖像可以趕快付諸實施，不只是討論而已。
黃麗招議員,好，先請坐。
交通局王銘德局長,向議員補充，其實過去我們也一直積極在推動，安南區的部分會再加快盤點，依市長指示的方向去處理。
黃麗招議員,好，謝謝，你辛苦了。9 月22 日屏東明揚工廠大火，造成4 位消防員殉職；過去10年內，中臺灣共有43 位消防員殉職。李局長，這些悲劇有讓我們記取教訓嗎？
消防局李明峯局長,向議員報告，保障同仁安全是本局的願景，也是我的職責。我們有全國獨創的CCIO訓練編組，能夠確保同仁安全，我們有幾次的救災包括新力美科技公司爆炸案及0206 震災，大家都能安全的把案件處理完成。
黃麗招議員,無論是警消或義消，我們都不樂見這些消防人員的自身安全不保，所以希望不要再發生這種憾事。我住在消防隊的旁邊，也常在那裡出入，若碰到消防人員就會叮嚀他們，出去救火時一定要注意自身安全，這是第一要點。今天在此，我要與李局長討論消防手套的數量，你先不用回答我。這些手套有防熱的效果，但若在救火過程中濕掉了，就會失去防熱作用，是不是？若這些消防人員救火時消防手套已經濕掉，此時萬一又遇到下一場火警，怎麼辦？我不知道是不是每個人都有一雙消防手套？
消防局李明峯局長,"向議員報告，我們的外勤同仁只有960 人，現在警消有1,125 套消防手套；義消實際參與救災的有1,000 多人，但義消有2,660 套。我們每年都有編列汰換預算，市長也很重視，要求我們在向中央爭取的預算中，要特別提到這些高科技的裝備。"
黃麗招議員,我在這裡建議，是否能編預算多買一些備用的？
消防局李明峯局長,有，我們明年也有要買；警消的有50 套，義消明年也要買190 雙。
黃麗招議員,好，在此提醒你要多購買些備用的，萬一手套濕掉沒辦法達到隔熱效果時可以替換，再次向你叮嚀這件事。
消防局李明峯局長,第4屆 第2次定期會 市政總質詢  306不只是手套，還有很多，像空氣瓶、面罩等都有備品。
黃麗招議員,好，我也希望這些部分都能有多一些備品替換。另外，熱顯像儀是打火兄弟在火場的第二雙眼，警消的部分應該沒有問題，但義消的呢？
消防局李明峯局長,向議員報告，我們警、義消在救災時是一體編組的，在編組上，沒有警消帶隊，義消是不能進入火場的，所以……
黃麗招議員,這樣的話，1 個消防隊內有幾支熱顯像儀？是由特定人來負責操控的嗎？還是每個人都拿1 支。
消防局李明峯局長,這不必要讓每個人都拿1 支，我們現在53 個分隊共有222 支，也就是1 個分隊有4支。因為我們救災採編組制，1 個災害現場有1、2、3、4 個面，有4 個分區指揮官，由分區指揮官掌握。
黃麗招議員,那我再問你，熱顯像儀是否分較好用的或較不好用的？
消防局李明峯局長,它有價格的高低。
黃麗招議員,對，日前義消他們在籌錢買這個東西。李局長，我要拜託，是否能補足義消的熱顯像儀設備？
消防局李明峯局長,這我再來了解實際上的需求情形。
黃麗招議員,好，這就麻煩你了，請坐。
消防局李明峯局長,謝謝。
黃麗招議員,這是舊事重提，天馬電臺案。天馬電臺包含給水利局做抽水站的部分，大約有29 公頃，應該沒錯，有將近2 公頃是給水利局做抽水站，剩下的27 公頃原本在106 年有專案討論，由機關用地調整為創意文化專用區。日前黃偉哲市長特別召集去那邊會勘，我不知道市長的用意是什麼，因為這個創意文化專用區招商招不到。文化局，我們是否需要繼續努力？
文化局謝仕淵局長,是，其實過程中也不只是經過1 次招商，就像剛才議員關注的，那時候也在進行溝通，當時我還未到文化局服務，但溝通是一直持續的。
黃麗招議員,對，我知道，因為這個地方是國產署的土地，我覺得市長可能有新的作法或想法，但現在臺南市議會已經有很多聲音，有好幾個同事一直反映，這地方要重新專案處理，第4屆 第2次定期會 市政總質詢  307從文化創意園區再變更回來，把區公所、警察局移過去蓋在那邊，我過去也一再向黃市長反映這件事。安南區公所目前正在拉皮，姜局長，工程完工了嗎？
民政局姜淋煌局長,"12 月底會完成，總經費2,000 多萬元，有做結構補強。"
黃麗招議員,好，有做結構補強的部分。
民政局姜淋煌局長,是。
黃麗招議員,我一直很納悶，為什麼市長對此地的開發，突然間又有其他的想法？我不知道為什麼。日前我所聽到的訊息是，有財團到那裡炒地皮，黃市長是不是為了這塊土地要去量身訂做，我不知道，這是我的問號。但我覺得若區公所移去蓋在那裡……其實我們有好多民眾一直反映，目前區公所位於區中心，現在12 月份才能完成，那個是……
民政局姜淋煌局長,結構補強。
黃麗招議員,"是結構補強的部分，但區公所後面的土地總共有1,000 多坪，包括區公所原用地及市有地……"
民政局姜淋煌局長,還有農會的地作為停車場。
黃麗招議員,"對，也有市有地，是商業區，總共有1,000 多坪，為什麼不把區公所重建呢？為什麼突然間又有人有想法，想把區公所移去天馬電臺，這是什麼想法與作為？我心中有問號。"
黃麗招議員,工務局，安南區目前有51 個里，有幾個公園？
工務局陳世仁代理局長,整個安南區有113 座公園。
黃麗招議員,51 個里，113 座公園。地政局陳局長，我再請問你，商60 未來重劃完成後，那邊的公園用地有多大？
地政局陳淑美局長,向議員報告，有2 塊地，加起來3、4 公頃，它是特色公園兼滯洪池。
黃麗招議員,安南區的公園已經有上百座了，包括最近重劃留下的公園用地，加起來也不只這些，為什麼一直有人建議要在那邊做都會公園或什麼公園，為什麼不能看遠景，把眼光放更遠？黃市長，若能在此規劃一個可以吸引外縣市遊客參觀的地方，不是很好嗎？你看大眾廟，只有一個綠色隧道就吸引多少人潮，若能在你任內將這裡規劃、興建成有建設性，可以帶動地方發展、繁榮的地方，難道不比增設公園還理想嗎？市長，請回答我。
黃偉哲市長,謝謝議員。對別人的土地，我的想法是比較開放，如同您剛才所講，有議員提議要第4屆 第2次定期會 市政總質詢  308作為行政區，我沒有首肯；有議員提議要蓋公園，我也沒有首肯，我只是說保留這樣的可能性。您現在說要做一個讓大家眼睛一亮的地方，我也覺得可以敞開想法，希望能與議員一起共同討論。至於有人想要炒土地，要來蓋房子這部分，我也略有耳聞，總之，那是國產署的土地，委託我們臺南市招商，我們也招商了2 次，有人來投標，結果評審委員認為，該廠商只是要來蓋房子，對於安南區的發展及這塊土地的最佳運用，並不符合期待，所以委員沒有同意，我們絕對沒有涉入。
黃麗招議員,好，我希望在市長你的任期內，將這塊土地開發成一個熱點，帶動地方發展，用不同的視野來看待我們安南區。
黃偉哲市長,第一階段我們是有拿到滯洪池，至少能保護附近的安全。
黃麗招議員,我一直在關心區公所，安南區區政中心的部分，至今已經是第3 次質詢這個議題。
黃麗招議員,"我再次重申這個地方的地理位置，此處人口密集，方便辦公也方便民眾前往洽公，土地面積總共1,100 多坪，包括商業區的部分。若在這塊土地上設置區公所，就將它原地重建，市長，為什麼不能？"
黃偉哲市長,我沒有排除。
黃麗招議員,你沒有排除，好。
黃偉哲市長,只是現在才剛補強完就把它敲掉，是有點可惜。
黃麗招議員,當然，我希望在你的任期快結束時，這裡有明確的想法和作法，好不好？之前我有將天馬電臺案的訊息讓民眾知道，他們也認為在這個地方多建設一個熱點，何樂而不為？
黃麗招議員,也覺得是可行的。
黃偉哲市長,安南區公所現址附近不知道好不好停車？
黃麗招議員,那邊不好停車沒關係，上千坪的地不用煩惱。
